asin	title	reviewer_id	reviewer_name	review_text	rating	summary	review_date	total_votes	helpful_votes	unhelpful_votes
B0000INU6S	LeapFrog: Letter Factory	AYF5TPNXZO4PY	"crys ""crys"""	I want to add my comments to the chorus of other parents who love this DVD.I purchased this for my 16 month old daughter for Christmas.When we went to watch it I was initially disappointed.  It is poorly animated, and has a pretty lame story line.  The characters are predictable and the plot doesn't even make sense at points.But my daughter loved it.I know a 16 month old should not be watching television.  But we let her watch this almost every day to wind down before nap time.In about two weeks, our 17 month old new her alphabet.She could say her alphabet, she could tell you what letters made what sounds.When we would show friends and family how great she was at her alphabet they were shocked, and filled us with compliments about what awesome parents we must be.  Truth be told, be gave all the credit to the movie.It has a lot of repetition, songs and silliness that appeal to toddlers and work towards a learning goal.Now my daughter is three.  She can read small words and is constantly pointing out letters and their sounds, spelling words just for fun, and writing short words, etc.  I think her advanced reading and writing skills at this age are a direct result of her coming to love letters so early.I am actually online looking at this product to order a new one for our 17 month old son.  Our fist copy broke and I want him to have the same love for letters.I recommend this book to everyone who wants their children to learn letters and sounds.	5.0	TV really can Teach	2010-08-10	1	1	0
B0000INU6S	LeapFrog: Letter Factory	A2YXZ5XPYI7PGZ	"Crys M. ""LtlCrys"""	I bought this dvd for my 23 month old daughter a little over a month ago and she absolutly loves it!! She asks to watch it all the time and I have no problem with that because I know what she is watching is educational. Now whenever she sees letters, she can recognize them and even recites their sound. I highly recommend this dvd!!!	5.0	Instant Success!!!	2007-07-17	0	0	0
B0000INU6S	LeapFrog: Letter Factory	AAFVB4SGR3AC5	"C. Sharifi ""CS"""	This video is fun especially because the kids recognize the characters from their toys, games, etc.  This is also neat because you can purchase a board game that is part of the Letter Factory Sets.  My son learned 3 letter words by 3 1/2 yrs old - 4 yrs old with the help of Leap Frog products and games.  The on that really spurred him on was the Talking Words Factory by Leap Frog (the next one after this video).  Talking Words Factory also has a game you can play afterwards using your remote (to spell 3 letter words).  He loved that and learned without realizing it!Leap Frog - Letter Factory	4.0	Letter Factory	2008-03-28	0	0	0
B0000INU6S	LeapFrog: Letter Factory	A1Z54EM24Y40LL	csm	"I just can't believe how well done this DVD is for little ones.  My little guy, age 3, learned his letters and sounds very quickly after watching this DVD.  Then, 3 weeks later after not watching it for about that long, he's still talking about what sounds each letter makes.  It's very well done, makes it very easy for children to understand, plus it's very enjoyable to watch.  After about 34 times of hearing, ""The R says errrr"" with that tune attached gets a little redundant, but not to little ones.  You have to get this for every preschooler you know.  It's really that good!"	5.0	The best there is! You HAVE to get this!	2004-12-09	135	117	18
B0000INU6S	LeapFrog: Letter Factory	A1B50NHN0OW0LU	"C. Snider ""History Professor"""	My sons (2 & 3 years old) love this video.  They have watched it several times and never seem to get bored with it.  My older son can now pronounce almost all the letters in the alphabet.  The video focuses more on just recognizing and naming letters, but the phonics behind letter sounds as well.  I think it will be much easier helping them learn to read now that they know what sound the individual letters make.My only criticism is that I think the letter L is pronounced funny in the video.  Doesn't quite work as well with phonics reading as the other letters do.	4.0	Great Phonics Video	2006-03-15	0	0	0
B0000INU6S	LeapFrog: Letter Factory	A26WKO4ITCDS1J	cstanford	"I have not received this product yet.  It has been over a month. It was sent to the wrong address, which was not the sender's fault.  However, they didn't even have a tracking number for me to track it.  It was finally returned to them and I gave them my correct address.  That was two weeks ago.  Still nothing.  I am sure the dvd is fine, but the sender gets a bad review.  I will never order anything from Amazon again that isn't straight from ""amazon""."	1.0	leap frog dvd	2010-11-01	29	2	27
B0000INU6S	LeapFrog: Letter Factory	A10566TEP2SO6I	"C. Starr ""Blake & Drew's  Mommy"""	We gave this to our son last year when he was 2 and he loved it!  He still watches it and he is now 3 1/2 we are giving him the Leapster cartridge of The Letter Factory for Christmas so he can watch it on the Leapster when we are in the car.My son has learned all of his letter sounds and recognizes almost every letter since he was 2 because of this dvd!  Amazing!	5.0	my son loves this dvd!	2004-10-22	2	2	0
B0000INU6S	LeapFrog: Letter Factory	A36AU96RZ5QQ7I	CT	My 4 years sons teacher in his kindy complained to me that my son cant recgonize the letters even after several times of teaching.I got so worried and try to do the teaching myself several times but still fails.He forgots the letters easily...Then I surf through the net and saw people talking abt the leap frog dvd...I purchased the DVD straight away and now I am very happy that my son able to recgonize the letters..He only takes abt 2 weeks and he is pefect with his capital & small letters...He enjoyed watching the video...He watched it almost 4-5 times daily...untill today :)thanks to leap frog	5.0	Superb choice!	2010-03-11	0	0	0
B0000INU6S	LeapFrog: Letter Factory	ANP5ZZGG9U7KZ	Cugel the Clever	"This video teaches letter recognition and basic letter-sound encoding through the use of mnemonic devices wrapped in a frame story.  In the frame story, frog children explore rooms in a letter factory, where animated versions of each letter are congregated, doing something to reinforce the primary sound for that letter.  For example, the Zs are sleeping, going ""Zzzzzz"".  In each room a short ditty also increases stimulation of the child and is intended to aid recall.I will say that my two-year-old son, after watching it once, demanded to watch it again, and was enthralled.  He also started vocalizing some of the sounds, which for a youngster with a mild expressive language delay is nice to see.  Hence I have to rate it highly in terms of appealing to children on a basic level.However, there is one subpar aspect to this video: it only teaches upper-case letters.  Since it is far better to learn the lower-case letters, this is a mistake on the part of the designers, mirrored in other products such as theLeapFrog Fridge Phonics Magnetic Alphabet Set, which only comes with a set of upper-case letters, forcing one to buy the lower-case letters as an add-on set.  There is a brief mention, several seconds long, of the existence of the lower-case letters, and the letter B is briefly shown then in lower case, but aside from that, it's all upper case.(All leading pre-reading programs today primarily stress recognition of the lower-case letters, and secondarily the upper case letters, for a number of reasons.  Since lower-case b-d and p-q reversals are common in early writing, getting practice in differentiating them early can help greatly.  In addition, the vast majority of text a young child will learn to read is in lower case.)All in all we found this video charming, memorable and well-constructed, with the glaring flaw of a nearly exclusive focus on the upper-case alphabet.  If it is used, it must be accompanied by plenty of other material which stresses the lower-case alphabet; and the fact that the lower-case alphabet is not taught by this video represents a huge missed chance."	3.0	Catchy, but only stresses upper case letters	2012-01-11	3	3	0
B0000INU6S	LeapFrog: Letter Factory	A2HD8QOPDEGPSN	customer	EXCEPTIONAL product. Fun and absolutely effective. Inexpensive and simple way to teach. Simultaneously engages all learning styles: Audio, visual, and kinesthetic. After a few weeks of enjoying this video, my 28-month-old identifies each letter of the alphabet and tells me the sound each letter makes! The results have AMAZED me. We are ready to move on to sight words.	5.0	Exceptional teaching tool	2012-10-13	0	0	0
B0000INU6S	LeapFrog: Letter Factory	A2AT20GAM10AV	C. White	"We got this for my 3yr son's birthday.  He has watched it twice a day for 2 weeks. He already knows the sounds that the letters make!  Last night he walked up to the TV and pointed at ""SONY"" and said ""S says SSSSS"".  I was amazed!  This video doesn't only teach the ABC song, but also takes the learning one step further; teaches the sounds that the letters make.  He identifies letters by their sounds, which is fundamental in learning to read.  AWESOME"	5.0	ABC solution	2008-06-05	0	0	0
B0000INU6S	LeapFrog: Letter Factory	A29WJNZ639EYUZ	cynthia penny	Love this Letter Factory. The  kids have picked up the beginning sounds of the letters and we are now moving into the Talking Words Factory. This is a great teaching tool to blending sounds and help the children establish vowels and that connect to make words and correlate to the site word chat. Thank you Leap Frog and Amazon.com for making it so affordable.	5.0	What a Wonderful Invention	2013-08-28	0	0	0
B0000INU6S	LeapFrog: Letter Factory	A234BUOJQ7WR1P	"Daddy ""Daddy"""	My 4 years old just watch for 2 times and she can remember all letter sounds.  She is begging me everyday to watch this DVD.  My 18 months boy who can't really talk yet.  He can follows Tad on reading letter out loud. That was amazing!	5.0	It's great!	2005-06-29	0	0	0
B0000INU6S	LeapFrog: Letter Factory	AUKUQHD5C2UNK	"Daddy-O ""Daddy-O"""	"My son is in preschool and suddenly knows every letter and how to build words and sound them out after watching this video and the talking word factory.  He just turned 4 and in preschool, but I am certain he is now ahead of most kids in my daughters kindergarten class and they are over halfway through the year.The weird thing is he LOVES watching it and playing the simple game at the end using the remote.  I watch him as he mouths the sounds as the letters come up.The only downside is that we as adults have to hear it.  The simple songs are eerily addicting and almost impossible to remove from your head after only a couple viewings. My wife and I laugh about it and when we notice the other looking content and peaceful, all the other has to do is sneak up and sing ""The B says ""buh"""".  Its good for a laugh but sort of mean because it take a few hours to forget it again.  I'd almost rather have 6 hours of hiccups.As for my son, he could have worse songs stuck in his brain so I'm sure he'll be OK.  But definitely buy the video and be amazed at how smart your kids really are."	5.0	Excellent Learning Tool but beware!	2007-02-27	0	0	0
B0000INU6S	LeapFrog: Letter Factory	A17ZGRB1A7JXSB	Daddys Best	My daughter's favorite DVD!  She watches this once a day, and it helps with her a b c's!  It's very interactive, great DVD for the kids  :)	5.0	My daughter's favorite DVD!	2013-07-29	0	0	0
B0000INU6S	LeapFrog: Letter Factory	A3G978KGCMMZFG	Dadof3	I have a two and four year old sons that absolutely LOVE this video.  They have watched it over and over.  My son's preschool teacher recommended this video and it is very educational in teaching letter sounds. Highly recommended!	5.0	Leap Frog - Letter Factory	2007-01-09	0	0	0
B0000INU6S	LeapFrog: Letter Factory	A30RSBTCFNXBY1	"Dad of two small boys ""Scott"""	I bought this DVD for my then two year old because I thought it would be an educational movie for him to watch.  We are always trying to make most TV time educational.  I was astonished to see that this became his favorite DVD instantly and within a few weeks of watching regularly he could tell me what sounds all of the letters made.  It was amazing to me.  We have since bought the next few Leap DVD's in this series and my son (three now) is sounding out words on his own, and loving it. Sure, he isn't always able to put the individual sounds together and figure out the word, but most three letter words are read easily and correctly.My younger son and one of my neices, both two years old, know all the letters by name, the sounds they make, and which are vowels. Don't be mislead by other reviews of leap movies that say the animation is low end.  I have not noticed anything low quality about these DVD's.	5.0	Little ones get a huge jump toward reading!	2005-10-12	0	0	0
B0000INU6S	LeapFrog: Letter Factory	A1BCMDATTN7T19	Daisy_3	Highly recommended! My 2 year old loves this movie!! It teaches them how to pronounce letters in a very fun way!! :) It was recommeded to us by a children's speech therapist. We also got the LeapFrog Fridge Phonics Magnetic Alphabet Set which is also a great learining toy!	5.0	Great educational movie!!	2010-10-24	0	0	0
B0000INU6S	LeapFrog: Letter Factory	A27KPOU769ABU8	Dalila	I had my child see this movie once a day for about one month and he learn most of his word sounds in a month!  He was happy that he knows all the sounds before his K class start it this year.	5.0	great for kids to learn the letter sounds!	2010-09-28	0	0	0
B0000INU6S	LeapFrog: Letter Factory	A2GN6XYOM3ZCL5	"Dancer ""Tiffany"""	I'm so happy with this! My son who is 4 is a very visual learner, but is just too active to sit very long when trying to teach him his letters. He knew his ABCs but that was it. So after playing this a few times, in less then a week he knew all his letters sounds and what they looked like! My 2 year old is loving it as well and knows many of his !	5.0	must buy !	2009-04-06	0	0	0
B0000INU6S	LeapFrog: Letter Factory	A231YEKXBABN90	Danette Lajo	This is a great DVD.  It uses the same letter songs that the Leap Frog toys use.... &#34;B says 'b', B says 'b', every letter makes a sound, B says 'b'.  You can play the DVD so that it will go through all the letters or you can choose to play specific letter.  It also includes review sessions.... for example after the first 5 letters are introduced these letters perform together as a review before the rest of the alphabet letters are introduced.	5.0	Fun and Educational	2013-10-16	0	0	0
B0000INU6S	LeapFrog: Letter Factory	A1WAJTRFAVOG4Y	danic	We are working on ramping my daughter up for kindergarten (at the school's suggestion) and they want the kids to know most of the alphabet sounds before they begin kindergarten. Before this video she knew 9 of the sounds and after 2 weeks of watching it maybe 3-4 times a week she knows 18 of the letter sounds! :) Also keeps my 2.5 year old's attention - another plus!	5.0	Daughter learning letters and loving it!	2013-04-10	0	0	0
B0000INU6S	LeapFrog: Letter Factory	A8O593PAC4ICP	Daniel Elliott	"Everyone we knew was recommending this video so we bought it for our almost 5 year old daughter.  She had been struggling with letter recognition and sounds.  This video and the ""Talking Words Factory"" taught her to read in about a week!  She still loves to watch it and sing along with the songs.  We also got her the ""Complex Words Factory"" video in the series.  I recommend these videos to everyone I meet.  They are that good!"	5.0	Taught Our Child to Read!	2007-06-21	1	1	0
B0000INU6S	LeapFrog: Letter Factory	A3CL5FFT0HDMQ3	"Dani-L ""*Sunset819"""	I bought this for my two year old about a month ago. She watches all kinds of shows from Dora to Spiderman, and everytime we go to pick something to watch she ALWAYS picks this! I was honestly surprised. She gets distracted with other shows and she will go off and play sometimes...but with this, she won't even hear me when I try and talk to her, she is so absorbed in it! It's a great dvd and I'm so glad she loves one that is so good and involves learning!! I will DEFINITELY buy more of these!!	5.0	My 2 year old LOVES this!!!	2012-01-18	0	0	0
B0000INU6S	LeapFrog: Letter Factory	A2LU4XSU0BE0PE	D. Appel	Okay, I admit, I was skeptical.  2 year olds learning the alphabet in a day?  Come on, I have a bridge to sell in Brooklyn.  But....we have several other Leap Frog items and our daughter loves them.  So, I bought this DVD for our Daughter for her second birthday.  After the first viewing, my daughter was running through the house pointing and calling out letters.  During the second viewing, she was calling out the next letter in the alphabet as each letter was being shown.I have only two concerns:--  Only one sound is taught for letters like C, A, O, E, G etc...a little confusing, but I can deal.--How to convince family and friends that kids really ENJOY watching this even though it could be perceived as 'flashcardy'.This is a 'must buy' for toddlers and preschoolers!  And, it has the added bonus of not being too annoying for parents.  We have had this for 3 days and I know I have watched it 15 times.  IT IS GREAT!	5.0	AMAZING LEARNING OPPORTUNITY	2004-09-07	0	0	0
B0000INU6S	LeapFrog: Letter Factory	A14C4LBA4WL1EK	Darby Toler	I have a 4 and 2 year old and they both love this video. My 4 yr old was struggling a bit in recognizing some of her letters and after watching this video a couple of times she's got them all nutted. The two year old is already ae to recognize some letters. Job well done LeapFrog.	5.0	Awesome	2011-03-04	0	0	0
B0000INU6S	LeapFrog: Letter Factory	ALNFHVS3SC4FV	"Darena Shopz ""darenashopzatoutlookdotcom"""	Although there are already hundreds of reviews, I just had to add my review too. This video is one of the best ways to teach children letters and their sounds. We have hooked on phonics and lots of other books and videos but the LeapFrog series are absolutely the best, especially the Letter Factory. The video not only teaches children their letters but the letter sounds also. My sons have watched this video over and over again and now know all their letters and their sounds. I was amazed at how quickly they progressed watching this video.Highly recommend.	5.0	Excellent	2010-10-15	0	0	0
B0000INU6S	LeapFrog: Letter Factory	A2Z2QVODG3ZU03	"darklord752 ""dancing_rican"""	This is a great product for any young kid.  The songs are so memorable about the letters and they get stuck in you and your child's head.  I recommend this to everybody that has little kids.	5.0	awesome	2012-11-09	0	0	0
B0000INU6S	LeapFrog: Letter Factory	AWT8TI3KQNX96	"David Baldwin ""Dave"""	I've bought many videos including elmo, disney, and dora. This video is by far my daughter favorite and has helped her identify letters and their sounds. A+	5.0	A great video for teaching sounds	2009-06-24	0	0	0
B0000INU6S	LeapFrog: Letter Factory	A2XW0CQ5BZFER	David Dietz	This DVD has my 20 month old reciting the sounds for various letters of the alphabet! She loves it, stays entertained and allows me to make dinner while she watches. I can ask her the sound of several letters and she will tell me. Great video!	5.0	Awesome precursor to reading, a must buy	2013-11-04	0	0	0
B0000INU6S	LeapFrog: Letter Factory	A3R6REUXRD84CR	David Glaspell	Bought this for a friend's son. He loves it, and it seems to be working. When he first got it, he watched it continuously.	5.0	Exactly what I wanted.	2013-04-29	0	0	0
B0000INU6S	LeapFrog: Letter Factory	A32N93GKFTH5GM	"David Waibel ""Missy"""	My friend told me about this b/c her two year old learned her letters and sounds from it.  I was skeptical b/c I was a kindergarten teacher for 9 years.  So, just to check it out I bought it.  My son LOVES it.  He knows almost all of his sounds.  He doesn't know all the letters...but, that is A-OK with me.  The reason why he learned them so quickly is b/c the video incorporates a movement, a sound, and the name of the letter....this hits three different learning styles.  My son ASKS for his letter video almost everyday!!	5.0	My two year old loves this dvd!!	2008-11-29	0	0	0
B0000INU6S	LeapFrog: Letter Factory	A3OHE0S04GB9WO	"Dawn Detweiler ""psych mom"""	"My 2 y/o daughter loves this movie and I cannot believe how very well done it is.  She gets totally engrossed in watching it, and I'm impressed with all of the teaching tools cleverly embedded.  After one week of watching it, she's already recognizing letters and walking around the house making letter sounds.  Her favorite is ""/c/, /c/, cold, Mommy""  Highly recommend this to anyone with preschoolers."	5.0	Fantastic Movie	2008-02-21	0	0	0
B0000INU6S	LeapFrog: Letter Factory	A36CBEH5JUXCK1	Dawn	My 4 year old son has had little interest in letters or their sounds until a friend introduced us to this video.  He has watched it 3 times and loves to tell me what sounds the letters make.  They have a new meaning to him now.  The letters are as alive to him as they are in the video.  My 2 year old daughter seems interested in the video also and tries to make the sounds with her brother.  Thanks Jessica for recommending it!	5.0	Huge Success!	2006-10-19	0	0	0
B0000INU6S	LeapFrog: Letter Factory	ACZEV9PNFC5SP	Dawn	My son rec'd this DVD at the age of 2 1/2 from his Godmother and within days he knew his ABCs.  The books we had could not do it as quickly, thanks to leapfrog.  He was one out of 3 toddlers in pre-school who knew his alphabet and I mean knew it; the sounds they make and can identify them else where when we go out. I have all the DVDs except one which I am about to get from Amazon.  You can't loose with this DVD, so what are you waiting for get it now!	5.0	A Must Have For Your Pre-K	2007-08-08	1	1	0
B0000INU6S	LeapFrog: Letter Factory	A24DWEC1Z05601	Dawn M. Gonzalez	My son (2 1/2) loves this DVD and he has learned his letters so fast!!	5.0	Buy this DVD!!	2010-02-22	0	0	0
B0000INU6S	LeapFrog: Letter Factory	ANY1X60XELGR4	"Dawn Souto ""Bellas Mommy"""	This is the best DVD I have bought for my daughter thus far.  She is only 22 months old and after watching the movie only a few times she knows almost all her letters and can identify every sound each letter makes.  It is truly amazing.	5.0	WONDERFUL	2007-05-07	0	0	0
B0000INU6S	LeapFrog: Letter Factory	AMOX5S7AKWC1T	"DBHER ""Jaden's Mommy"""	I bought this DVD when my son was 2. At 3 he knew most of his alphabet along with the letter sounds. It's a cute, catchy movie and it really works! The Letter Factory game is also great!	5.0	Fantastic!	2008-01-03	0	0	0
B0000INU6S	LeapFrog: Letter Factory	A2QX7NV9PZEV8T	"DD67 ""babyonahill"""	"I have tried and have many Alphabet videos. My son has watched First Impressions alphabet, maisy's ABC's, richard scarry's alphabet movie, Sesame Street, Dora Explorer ABC's. And many more. Although Dora Explorer was his favorite. And I have gotten him to watch and talk about the other ones. He fell in love with the leap frog family. He asks to watch it every day. Talks about it. Wants to learn his letters. After watching it just a couple times he learned that K is For kick and makes the sound ""K"" and S is for snack and makes the sound ""S"". He started to pick out the letters in the stories we read. And is very excited about the letter sounds.  He will now sit and play with his leap pad system. I purchased the leap frog learn the alphabet booklet. We are on our way learning the alphabet and reading. Thanks Leap pad.  For the number of positive reviews. I am not the only one that is having success with this great video."	5.0	Finally, my son is wanting to learn!!!!	2004-08-28	3	3	0
B0000INU6S	LeapFrog: Letter Factory	A15275I9GO2MH5	"D. DeGrado ""Bradybunchmama"""	Love this video! My preschooler has gotten so much out of it! It lays an excellant foundation for letter recognition and phonics. It's a must for every family with young children, its NOT boring at all! (Even the older kids get a laugh out of it).	5.0	Awesome tool	2006-03-27	0	0	0
B0000INU6S	LeapFrog: Letter Factory	AA3ESLV1GSTUX	deanachavez	I bought this when my 7 yr old was 3 and she knew her letters and their sounds by the time she was 3 1/2. Now that my son is 3 and my old copy is very scratched from so much play I thought that he could use it to help learn his letters and sounds. The songs are catchy and help kids memorize what each letter says along with teaching them what each letter looks like. It is an amazing way to help teach kids just while they are at home playing.	5.0	Our favorite learning DVD	2011-09-19	0	0	0
B0000INU6S	LeapFrog: Letter Factory	A28F7HNGBQ1AY6	Deanna Winn	I have been trying to teach my 2/3 yr old his letters for a while. He is not one to sit and look at letters on paper, so he only knew some letters by sight. He had only watched this video 2-3 times and has picked up the other letters in a matter of days! Each letter has a theme so they remember it. It's great!	5.0	Great tool for your child!	2009-09-22	0	0	0
B0000INU6S	LeapFrog: Letter Factory	A384XZVB7ALGJ7	Debbie-Ann	I recently bought this dvd together with the Talking Words Factory and have to confess that these were both excellent buys. Simply put, within a day or two my 3 year old son knew all the sounds of the letters of the alphebet.  These are great phonics tools and pre-reading equipment.  Presently my son and I reside in a non-english speaking country and I am always on the look out for (english) pre-school material that would hold his interest. One or two of the letters sounds are a bit off but really of no major consequence.	5.0	Leap Frog Letter Factory/Talking Words Factory	2007-02-16	0	0	0
