asin	title	reviewer_id	reviewer_name	review_text	rating	summary	review_date	total_votes	helpful_votes	unhelpful_votes
B0000INU6S	LeapFrog: Letter Factory	A1JZH8PYQ0WYT2	2006harvestmoon	I don't know what it is about this DVD exactly, probably the catchy tunes but it has captivated both my kids at a young age.  Usually my children were more drawn to puppet/character shows like Sesame St. or Blues Clues with real people in it but this one is cartoon and they both loved it. They learned phonics quite early and would sing the tunes from the dvd all day!	5.0	Both of my Childrens Favorite DVD at ages 1-3 years old!!	2013-05-29	0	0	0
B0000INU6S	LeapFrog: Letter Factory	ADUZNIFG18085	2Boys	"This is an entertaining and educational DVD that my boys love to watch!  The only down side is that is doesn't mention the c says the ""k"" and ""s"" sound and that vowels have 2 sounds.  Maybe the vowels would be too confusing for this video though.  I still give it 5 stars because I think this is a creative and fun way to teach preschoolers alphabet sounds."	5.0	The kids love it!	2006-12-31	0	0	0
B0000INU6S	LeapFrog: Letter Factory	A3M1DG8BCK852P	2BoysMom	My son loves this video and it helped him learn his alphabet very quickly.  I liked it so much that I bought more for friends that had kids his age (he started watching it when he was 2 1/2 - now he's 4 and still likes it).	5.0	Great video for kids	2013-10-02	0	0	0
B0000INU6S	LeapFrog: Letter Factory	A1E2SNS80G5TPL	2 great kids	My son is almost 5 and he has very little interest in learning his ABC's and 123's.  He would much rather play on the computer, ride his bike, or pretend he is a superhero.  The videos sat there after Christmas for a few days until he tried everything else out that he had got and now he watches them all day long.  One after another and he keeps amazing me how he knows his the sound for V or R.  He feels so smart now and these videos have made it so fun.  Even with a interactive game on the DVD too.  He loves it and I love that he is learning.	5.0	Best gifts this year	2006-01-12	1	1	0
B0000INU6S	LeapFrog: Letter Factory	A111K9LFJ4S7H6	4mykids	Great dvd!!! My child loves it!!! It keeps him wanting to learn more. I recommend the entire series of leap frog. This is one great product!!! My child who is speech delayed is now sounding out letters and his vocab has improved immensly. Im proud parent to purchase this for my child.	5.0	Got To HAVE IT!!!!	2010-07-26	0	0	0
B0000INU6S	LeapFrog: Letter Factory	A1JAJGMDEDDQH8	7676	I got this video when my son was 1 1/2 years old.  He is almost 3 now and still loves it.  My son knew what all the letter said ( sounded like ) before he could name the alphabet :)	5.0	Keeps his attention	2012-12-18	0	0	0
B0000INU6S	LeapFrog: Letter Factory	A391N6Z17MTNWM	A. Albarq	I'm a teacher , and i used this DVD for my students , they loved it and they gazed on the screen during the show time.. and they asked me to repeat it again and againperfect in teaching phonics and vocabulary , i love to watch it too .	5.0	Excellent	2008-08-23	0	0	0
B0000INU6S	LeapFrog: Letter Factory	A1LGNJITM3NCXJ	A. Aldridge	My 3 year old daughter has learned most of her letters and some of her sounds from this DVD and we have only had it about two weeks.  My 6 year old son also enjoys watching it with her.  It is good review for him.  A wonderful mix of learning and entertainment in one DVD!	5.0	Great for learning letters and their sounds!!	2006-04-01	1	1	0
B0000INU6S	LeapFrog: Letter Factory	A11CUSIJDNG0Y2	A. Artman	We purchased this dvd for our 17 month old.  She was very familiar with the alphabet and could recognize all the letters.  With the help of this video and our own help while reading, she knew all the sounds of each and every letter in one week.  We were amazed that she caught on so quickly.	5.0	DON'T HESITATE, BUY THIS DVD	2007-12-09	2	2	0
B0000INU6S	LeapFrog: Letter Factory	A1AAU41P7QGYJ0	Abinormal	So far I have yet to find a leap frog product I don't like. This video is cute, simple and keeps my daughter's attention. She's still a little young for it but I figure any exposure to the alphabet and words is good.	5.0	Really cute!	2011-08-17	0	0	0
B0000INU6S	LeapFrog: Letter Factory	A3R2WOOF1V40HG	A. Boyer	I bought this for my 4 yr old daughter but my 2 yr old and 1 yr old enjoy it too. My daughter can now write her  letters and knows their sound.  She likes to write the letters while watching th dvd. My 2 yr old can now identify letters and their sound and beleive it or not my 1 yr old(16m) can say the sounds. This video has totally impressed me! I just bought the Number one and I hope it works the same. Oh, we also watched the word factory and My daughter loves it, but it's too advanced for the other two. Leap Frog products are amazing!	5.0	wow-this  is great!!!	2006-11-22	0	0	0
B0000INU6S	LeapFrog: Letter Factory	AGCTET1AWZ8TA	Aboysmama	Both our 4 and 2 year old's favorite movie, even months after we purchased it.  I've given it away as a gift 2 times in that short period, it is that great!  It's cute, holds their attention, and TEACHES them letters and their sounds.  I couldn't ask for more.  We use it in our homeschooled/preschool curriculum as a nice educational break.	5.0	Our Favorite DVD!	2010-07-06	0	0	0
B0000INU6S	LeapFrog: Letter Factory	AE4ZCEVRLHR3V	"A.Brown ""Life is short, Play naked!"""	My son loves the song in the show, this is one of the best products that teaches children both the letters and the sounds in a simple easy song!	5.0	Buy this NOW!	2014-01-24	0	0	0
B0000INU6S	LeapFrog: Letter Factory	A31WETVAZ3HSJD	ABUELO	My granddaughter loves it and my daughter thinks its very useful to learn how to read. Recommended.	5.0	leap frog	2008-02-15	1	1	0
B0000INU6S	LeapFrog: Letter Factory	AGYR8RQVTWIWJ	A. Butterfield	A teacher friend let us borrow this video one weekend for our then 2 yr. old daughter.  She watched it twice and begged for more.  We couldn't believe how enthralled she was with the music and cute storyline.  Later that day she was playing with her magnetic letters and began to correctly identify some of the sounds.  We later bought the DVD, and we used the letter song to help her learn the sounds of all her letters. We have really enjoyed this Leapfrog DVD and many of the other Leapfrog products.	5.0	A great way to learn letters and letter sounds	2007-11-22	0	0	0
B0000INU6S	LeapFrog: Letter Factory	A1WO206HZ3HCU6	"AC ""acarlson"""	My son (2 years old) enjoys this DVD - he sings along, makes the sounds of all the letters, and is still captivated by the story despite watching multiple times.  Would recommend Letter Factory for little ones.	5.0	Great educational and entertaining DVD	2010-11-14	0	0	0
B0000INU6S	LeapFrog: Letter Factory	A1W0TXHNDQVRB9	A. Chen	Im pretty amazed. I've been trying to teach my 26 month old daughter to recognize letters but her attention span is basically zero. I bought a few different DVD's with letters (sesame street) and this one. This one is amazing. The content is organized and entertaining. The letters are on the screen for a long enough time without flashing away like some other videos. Even though each letter segment is different enough to be entertaining, they are consistent enough that she can recognize all the letters along with their sounds after watching about 15 times. She can watch the video over and over and sings along with it now.The DVD starts right into the letters without a lot of fluff and I like that there is one DVD chapter for each letter.	5.0	2 year old daughter knows all letters after watching 15 times	2010-03-15	0	0	0
B0000INU6S	LeapFrog: Letter Factory	A2F9XOEGQUP266	"A Child Without An Eye ""mutilatedlips"""	My daughter has been watching this DVD since she was just a few months old. She is almost 2 now at the time of writing this and the DVD has never gotten tiresome to her.It is a nightly request before bedtime and never tends to get annoying to my wife and I (like a certain purple dinosaur most likely would.)It is a good length and keeps her attention the whole time. We have watched her progress educationally with this dvd over time. It was an extreme help with first vocalizing the sound of the letters and then recognizing and saying the names of the letters.I'm amazed how well this show works. I'm a big fan of Sesame Street and she loves Elmo, but Leapfrog's Letter Factory beats out all the other educational DVD's we own.	5.0	Simply The Best	2011-03-04	0	0	0
B0000INU6S	LeapFrog: Letter Factory	A1BU1CDS7L6CB7	"A. Churchwell ""mom of Kyle"""	I have been trying forever to teach my 3 year old son his letters.  He had really been having a hard time with letter recognition even though he knew his ABC's.  I could not get him to associate the written letter for the letter name.  He would say that A was P or something weird.  I was starting to get worried that he may have a learning disability.  I bought this video and the Talking Word Factory not really expecting much.  Within a week he knew his letters!!!  He is the kind to want to watch a video over and over and since this is educational I did't mind.  Boy did he ever learn from this video.  He now (within a month) knows every letter and letter sound!!!!  I am so proud of him.  I thought there was a real problem but now I see that I just needed a way to put each letter into something interesting and that related to the letter and letter sound.  I can't say enough about these videos.  I thought the Talking words Factory would be a little over his head but he can now say that A E I O U are vowels. Even if he isn't quite sure what vowels are I think it will help when the time comes to learn vowels in school.  He even has been learning about similar sounding words such as bat, cat, mat.  I can't wait to see what the next Leapfrog videos are about.  I hope they will help us with numbers since that is another area we have trouble with.  I love Leapfrog!!!	5.0	Best teaching video ever!!!	2004-09-03	1	1	0
B0000INU6S	LeapFrog: Letter Factory	A2AYSHAB2UFW5I	A. Coates	My preschooler has picked up on this show! I decided to order them all.He now tries to sound out letters everywhere. The fun songs help him remember the sounds...I am very impressed.	5.0	Wow!	2008-11-02	0	0	0
B0000INU6S	LeapFrog: Letter Factory	A6ZQKARTLNHA9	Acswan	This movie isn't exactly what I had pictured.  It is cute though.  My daughter seems to enjoy it as well.	4.0	I like it	2013-02-16	0	0	0
B0000INU6S	LeapFrog: Letter Factory	A3BTIYBP7P4UQI	"A. D. Aguilar ""mom of one"""	"It's been a while since I purchased this video for my then 4-year-old. It was recommended by his Kindergarten teacher during their orientation about a month before classes started. I order it because I could not find it at stores. My son loved it from the first time he watched it. He knew some of the letter sounds, but the video helped him learn all of them well before school started. Best of all, he didn't feel like he was doing a chore or ""homework,"" which he actually doesn't like, but instead he was enjoying a video and learning as a result. All the Kindergarten teachers at his school spoke well of this video, and they were quick to asure us they are not receiving any benefit from the endorsement of it; maybe they should."	5.0	Letter Factory Video Review	2009-09-05	0	0	0
B0000INU6S	LeapFrog: Letter Factory	A1FR60Y3S1H6VX	ADR 98	Not that this series needed another rave review, but we love all the Leap Frog movies.  My son (2 years, 2 months old) just did the alphabet flashcards and named all but 4 letters (confusing O with Q and F with E).  He also understands the sounds they create.I can't believe it...and I know it's b/c of this great video.  Thanks so much, Leap Frogs!  My son is well on his way to literacy!	5.0	Another 5 stars!	2011-02-13	0	0	0
B0000INU6S	LeapFrog: Letter Factory	A2FFD45E05C8QP	A&E's Parents	I love this video, so does my 3 yr old. She knew all her letters before watchng this and now knows all their sounds after only a few viewings.  This has laid a great foundation.  Sure, it's a bit cheesy, but she doesn't know that.  I highly recommend it.	5.0	Redeeming TV Time	2007-05-12	0	0	0
B0000INU6S	LeapFrog: Letter Factory	A28DO6T6XGIK23	A. Ferrell	"I have had several friends who love this video, and whose children learned a lot from watching it, so I bought it. I thought it was more of an educational DVD that reviewed letter sounds. The letter sounds are introduced, but in the context of the plot of a cartoon show. Most cartoons annoy me, and this is one of them. There's a lot of extra stuff that I don't necessarily want my almost-two-year-old saying, ""Okie-Dokie-Artichokey"" being one of them. And it's annoying to sit through all of the beginning and end plot of the show surrounding the alphabet sounds. I'd recommend watching someone else's copy before buying one for yourself.We also bought the Leap Frog alphabet fridge magnet set that uses the same catchy song...highly recommend that over this video to teach the sounds."	1.0	Did Not Meet Expectations	2009-09-27	32	9	23
B0000INU6S	LeapFrog: Letter Factory	AF8V03PAKD5G7	A. Holbrook	On recommendation of one of my friends, who is a teacher and mother of young children, I purchased this DVD for my daughter when she was almost 3.  In the past year, she has learned all about letters and their sounds.  Almost immediately, she began to sing the catchy song heard in the show.  She really did enjoy learning letter sounds and still watches it regularly, by choice, a year later.	5.0	A MUST Have for pre-schoolers	2013-10-29	0	0	0
B0000INU6S	LeapFrog: Letter Factory	A3HMTJ5XECWSI8	A. J. Beemer	This DVD is great.  All three of my girls (ages 3-6) love to watch it over and over.  My 3 year old has learned so much as far as sounds and the alphabet itself.  I hear them singing the music from this DVD throughout the day.  I would definitely recommend this for kids just starting to learn the ABC's or letter sounds.	5.0	Educational and fun!	2007-08-26	0	0	0
B0000INU6S	LeapFrog: Letter Factory	A3LCLEBGTVVVLA	"A. J. Kennedy ""Sailwin"""	One of the best and entertaining alphabet videos I've seen. Goes over names, sounds, placment, and it repeats everything to help stick it in your brain. A+	5.0	Leap Frog ROCKS!	2009-06-12	0	0	0
B0000INU6S	LeapFrog: Letter Factory	A3KBG9BDSGG00E	"A. Johnson ""NC Mom"""	"My son was having a difficult time learning his letters.  More specifically, he didn't have the desire.  Two different people recommended this DVD to us, and it has been amazing!  There is a room for each letter, with that letter making its sound, and a catchy tune for each letter.  For example, in the ""E"" room there is an old Letter ""E"" in a rocking chair, and every time the young frog says something to him, he says, ""eh?"" (the ""e"" sound).  The song for each letter is to the tune of ""The Farmer in the Dell,"" and says, ""The (letter) says (sound), the (letter) says (sound), Every letter makes a sound, the (letter) says (sound).""  I knew it was a success when an older child said a letter, and my son broke into song! :-)  I HIGHLY recommend this DVD!!"	5.0	Fun and educational letter-learning guide	2006-11-09	0	0	0
B0000INU6S	LeapFrog: Letter Factory	A1Q6RWP789UPUA	"A. Jones ""Sinople"""	I dont think my daughter is quite ready for this DVD (she's 14 months). She watched it at approx 10 months when I bought it (we watched it together, whilst I was sussing it out). Im planning to show it to her at about 18 months when she might be able to follow the story a bit better. Im sure babies would become familiar with the shapes of the letters after watching this DVD, BUT Id rather my daughter play and experience the world at the moment... this DVD can wait a while :)	5.0	I can see that my DD will love this	2011-02-15	0	0	0
B0000INU6S	LeapFrog: Letter Factory	A2GGSRTLLI52KJ	"Alabama mom ""r.t."""	Okay, I read the great reviews for this DVD, but as a kindergarten teacher, I was very hesitant to buy it!  However, I have a 22 month old, and I was interested in seeing if this would work.  Wow!  She has most of her letters and their sounds.  It is absolutely amazing.  We don't watch it every day (although she would love it if we did), but she is still learning them.  This dvd will be a part of my classroom instruction from here on out!	5.0	Who knew?	2011-04-13	0	0	0
B0000INU6S	LeapFrog: Letter Factory	A2HUKDYPATWREE	Albert E.	The DVD brilliantly teaches the letter names and sounds of the letters.  A wonderful head start for kids learning to read.  Along with some other resources, such as the later Leap Frog DVDs, the Your Baby Can Read Series, and films with subtitles, young children can learn to read effortlessly.  Leap Frog is an excellent building block. [Similarly, for those interested in teaching their babies about music, a DVD called Trebellina works in a similar way.]  Hurray for Leap Frog!!	4.0	Brilliantly conceived!  Will have kids reading early.	2009-04-28	0	0	0
B0000INU6S	LeapFrog: Letter Factory	A1A093208TM5OS	Alena	My children (2 and 4) love to watch this video.  For a while, it was all they wanted to watch.  It taught my two year old all her letter sounds.In the story, Tad visits all 26 letter rooms in the talking letter factory and learns what each letter looks like and what sound it makes.  Each letter and sound is presented in a creative way.  The video also has a catchy song for learning letter sounds.The video helped teach my children the alphabet, and I've heard good things about it from friends, too.  Leap Frog does a good job of making fun, yet educational toys.	5.0	Entertaining and Educational	2009-11-19	0	0	0
B0000INU6S	LeapFrog: Letter Factory	A3ALFGO8R354LX	Alexandrea	Love this DVD!! As soon as my kids watched it they were trying to copy the sounds! Now they know how to make the sounds of the alphabet! My twins are 18m got for my daughter when she was 15m and it has worked both times is teaching my kids sounds.	5.0	Great	2013-09-13	0	0	0
B0000INU6S	LeapFrog: Letter Factory	A30PV8ELGUPH1	"alexsmom ""alexsmom"""	"From this video, my son (almost 2 1/2) can tell me the letters when i point them out as well as make their sound.  i never got these results using flashcards or even the alphabet card to his leap pad. he absolutely loves watching the ""letter show.""  he just got the words factory and is hooked on it, too."	5.0	Fabulous!	2005-01-25	0	0	0
B0000INU6S	LeapFrog: Letter Factory	A2IMTONWRDOBSX	Alice F	"I cannot say enough great things about this DVD. Our 2.5-year old learned to recognize and sound all the letters in about 3 weeks, watching the DVD about 6 times. We combined this with those ""letters for the tub"" during bath time. I tried not to laugh when he would mimic the sound or activity for each letter exactly as on the DVD. We both had a lot of fun learning the alphabet.The approach to teaching ABCs is very original. Congratulations to the creative minds that put this story together!"	5.0	Simply amazing! Original story and very effective.	2012-11-27	0	0	0
B0000INU6S	LeapFrog: Letter Factory	A2A014A12AFUQ8	A. Light	Excellent, fun, educational DVD... our 17-month old just loves it and it's actually helping him learn letters.	5.0	Terrific DVD	2009-10-06	0	0	0
B0000INU6S	LeapFrog: Letter Factory	A301GP4G3DNAWY	Ali	Awesome video.  It makes learning sounds fun.  Even the 9 year old watches it with the 4 year old and one year old.  I've even got some stuck in my head.... Wwww what's happening dude, wwww what's goin on with you?	5.0	Kids LOVE IT	2013-10-06	0	0	0
B0000INU6S	LeapFrog: Letter Factory	A2Z400ULOBSDZL	"aliR ""aliR"""	My 3 year old son could already recognize the letters of the alphabet, so I bought this hoping it could help him with the sounds of the letters. He watched it about 4 or 5 times and I was amazed, he now knows most of the sounds. The story is very entertaining and he is learning without even realizing it.	5.0	Great for learning letter sounds	2006-01-20	0	0	0
B0000INU6S	LeapFrog: Letter Factory	ATW8X64WT9CKG	Alison Dickerson	This purchase was made because of a recommendation from a friend whose children were early readers. Now I know why. My four-year-old has quickly learned the letters and their sounds. The Alphabet Game at the end of the movie was very helpful in reinforcing what was taught. I would definitely recommend this product to others.	5.0	very helpful for teaching letters and their sounds	2011-07-15	1	1	0
B0000INU6S	LeapFrog: Letter Factory	A1H5FWCPWUCBDT	Alison	I heard about this dvd from a friend but was still skeptical...but i figured what do i have to lose ...my daughter was starting kindergarten next year....we put it in the car so anytime we went any place that's what she would watch....she now knows all her letters and sounds:)	5.0	Awesome way for the kids to learn:)	2008-12-16	0	0	0
B0000INU6S	LeapFrog: Letter Factory	A161EVLR37H6ZW	Alison Miller	I purchased this DVD after reading some of the reviews on Amazon and decided to order it for my 2 1/2 year old daughter. She loves it! It was everything I had hoped it would be. She already knows all of her letter sounds and can't get enough of the DVD. It was definately worth it and makes me feel good knowing she is watching something educational. LeapFrog definately lived up to its reputation with this one.	5.0	Worth every penny!	2006-08-22	0	0	0
B0000INU6S	LeapFrog: Letter Factory	A1U7FE2J6YJY5Y	"all girls ""cris"""	My 3 year old learned every sound of every letter just by watching it 4 times. My neice also picked up on it very quickly. I strongly recommend purchasing it.	5.0	makes learning fun	2005-01-11	2	2	0
B0000INU6S	LeapFrog: Letter Factory	A1IPVF09P00URT	Alonna Brickhouse	My oldest loved this dvd and played it all day long. It helped her to learn her phonics at an early age!	5.0	Great for early learners!!!	2013-08-25	0	0	0
B0000INU6S	LeapFrog: Letter Factory	A2LLSKWVAEJ6R9	Alpha101	This was my first time purchasing anything online and as you can imagine I was very very concern about the quality of the product.  It was as good as new, thank you so much for being honest.	5.0	As good as new - thank you for being Honest	2010-11-09	0	0	0
B0000INU6S	LeapFrog: Letter Factory	A325PCR1AV4U7N	Alvin Liau	Leap Frog - Letter Factory (2003)Buy this DVD now - it is that good.  We tried teaching our two year old his alphabets using flash cards and the Leap Frog Fridge Phonics but his attention span was never long enough, he knew his A through G, but never stuck around long enough to learn more.  After watching the Letter Factory DVD for about 10 times, he now knows them all!  In addition, he is beginning to sound the letters and plays with the Fridge Phonics toy a lot more.  The coolest thing is that when we are out somewhere, he will point to a store sign or billboard and yell out the letters he sees.  The DVD is well put together and manages to hold our son's attention.  It's great that it isn't too long since we try to limit his tv time - the show's length works out well during his dinner time.Alvin Liau	5.0	Simply Awesome.	2005-03-23	2	2	0
B0000INU6S	LeapFrog: Letter Factory	A5Y1JK8JTXMTK	"Always Shopping ""Mother of Goodness"""	My 3-yr old loves this video! We rented it, and after watching it once she began repeating the sounds of the letters. I have even overhead her on other occasions trying to sound out words she sees which is FABULOUS!! Although the video does not address that fact that some letters have more than one sound, it is a great start for children to understand the importance of letters and opens the door to reading. I purchased the reading system many people may have seen on TV but her response was far better with this video. And, it actually teaches her to read words rather than memorize them. I will recommend this video to everyone I know with toddlers, it's definitely a good choice.	5.0	My 3-yr Old Now Sounds Out Words!	2009-07-26	0	0	0
B0000INU6S	LeapFrog: Letter Factory	A3K012A3YL6BMR	Alyelder	My 3.5 year old enjoys it and is learning his ABCs now! The actions that the letters play out in the video are entertaining and educational.	5.0	Fantastic Catch Learning Video	2013-04-01	0	0	0
B0000INU6S	LeapFrog: Letter Factory	A3BDI8D37U9MLE	Alyson	Children love these videos.I got them for my 3 year old and 4 year old grandsons and they both only want to watch and learn,what a great product.WE have all the videos.	5.0	Another great video	2013-07-13	0	0	0
B0000INU6S	LeapFrog: Letter Factory	A3MX8TDDL199BN	A. Mallette	I bought this for my niece as I already have it for my children. It really helps them learn the letters and they all love the cute tune in the song.	5.0	Great Educational Video	2009-12-22	0	0	0
B0000INU6S	LeapFrog: Letter Factory	A36VHLFJLDNVPO	"amanda2 ""just2"""	my three year old loves this dvd.  After just watching the dvd a couple of times my son knew at least 13 of the letter's sound which was incredible to me. You can't go wrong with this dvd.	5.0	worth the money	2009-07-22	0	0	0
