asin	title	reviewer_id	reviewer_name	review_text	rating	summary	review_date	total_votes	helpful_votes	unhelpful_votes
B0000INU6S	LeapFrog: Letter Factory	A209N64E695ZC2	mrs.say it like it is	I want my children to go to kindergarten knowing the alphabet. This video has helped them do this. I would recommend this to friends.	5.0	great learning tool	2013-02-03	0	0	0
B0000INU6S	LeapFrog: Letter Factory	A3BCB4Y587ZDZ8	Ms.Jenkins	The video was great for my 2 year old son. He loved the video and loves watching even though he doesnt know that he is being prepared for Pre-K. I work for the school system and I also, use this in my classroom and my students actually have learned there letter and letter sounds within a month. GREAT BUY	5.0	Great for Pre-k and Kindergarten	2012-11-05	0	0	0
B0000INU6S	LeapFrog: Letter Factory	A28QSTG1XNCNM9	M. Spindler	This DVD was great. My son, who is 3, quickly learned colors, shapes and numbers from the preschool prep videos, but was not interested in the letter video from that company. We had been working on learning his letters using puzzles and books for the past few months with little success. I bought the letter factory dvd and within one week he now has complete upper case letter recognition and most of the lower case letters as well. He has also started pointing letters out on buildings, his toys, and books. I would highly recommend this video especially for a child who is a visual learner.	5.0	Letter Factory Review	2010-03-01	0	0	0
B0000INU6S	LeapFrog: Letter Factory	AXAXZXF7X4UCU	MT	Sample on you-tube was very good.  The one we purchased, the actual one,  has a very poor voice quality, can not even hear the alphabets clearly. So we did not use it for the child, had to go out and buy another one by a different manufacturer. This is the 1st LeapFrog educational product that we are totally dissatisfied with.	1.0	LeapFrog: Letter Factory	2013-01-14	6	3	3
B0000INU6S	LeapFrog: Letter Factory	A3OVJ6Z7SYQ74O	"M. Thompson ""new mom"""	Not only does my 18 month old love this video, he has already started recognizing what sounds letters make. Love it!	5.0	18 Month Old Loves it!	2010-11-22	1	1	0
B0000INU6S	LeapFrog: Letter Factory	AOIF7DKTXNM9L	M. Trujillo	I bought this video for my son who just turned 3.  After watching this video for 1 week he can already  tell me the sound any letter makes.  I was completely amazed at how quickly he learned his letter sounds.  This DVD is amazing and my son loves to watch it!	5.0	Great learning tool!	2010-09-10	0	0	0
B0000INU6S	LeapFrog: Letter Factory	A3JBEV1QHWSEZ2	munich75	Bot this for my 2 yr old son for Xmas recently..after 3days of watching it 2-3X a day,he could tell us e Phonetics sound for each letter..n starting to guess short words now using Phonics...we are really thrilled... no regrets having gone thru so much hassle to get this DVD...it is not available in Singapore,so I had to order it n hv sent to a fren's address in Houston..she fwd it to me in Singapore..worth every penny n effort....p/s: this is my second DVD set as the first order was sent directly to singapore few mths back..,aft 1 mth of waiting, to our great disappointment,e Letter Factory dvd was missing fr its sealed box..didnt want to wait anymore, so ordered a brand new set instead..	5.0	A Must Buy !!	2012-01-05	0	0	0
B0000INU6S	LeapFrog: Letter Factory	A1RMOP3AR1JQSV	"Musicflower ""Heather"""	This video is a great educational tool for preschool parents!  My two kids learned their letters as well as the letter sounds by watching this tape!  All the tapes in the series are excellent!	5.0	Great to help your kids learn their letters and phonics	2006-02-18	0	0	0
B0000INU6S	LeapFrog: Letter Factory	A30BCRSABL9AYI	Music Lover	"We got this DVD 6 days ago with the Talking Word Factory and my 3 year old has already watched it 6-8 times.  Each video is about 35 minutes long so it's short enough to keep their interest at such a young age but long enough to teach them what the letters are and what they're sound is.  Our daughter is already singing along with them as when they teach the letter's sound they always sing ""Every letter makes a sound and 'J' says 'juh'""  Kids love to sing so you can see why this works so well."	5.0	Working already after 6 days	2006-01-22	0	0	0
B0000INU6S	LeapFrog: Letter Factory	A1JKOJOCNVKZ63	"M. Wood ""New mom"""	I got this video for my 25 month old after it was recommended by some friends who said it was greatly instrumental in helping their now 6 year old son learn to read (and he can read pretty big words!)My son begs to watch it so I let him watch it once a day.  After a couple of weeks, he was able to repeat the sounds of every letter in the alphabet.  (We practice in & out of order and that doesn't phase him.)  So proud of him.  (I'm not big on TV and this is the only video he gets to watch - but it doesn't appear to tire of it at all.)	5.0	Happy, learning toddler	2010-07-09	0	0	0
B0000INU6S	LeapFrog: Letter Factory	AB5V2Q12XNRAS	My two cents	"This is probably the best video out there for your kiddos! I have had it for about a month and my son loves this video and is now spelling words by sounding them out... he is not even 4! My 1 year little girl is not far behind in being able to imitate the sounds. Buy this before the ""Words Factory"" (which I also love) because it gives them a great foundation."	5.0	Are you Kidding Me!	2005-03-14	1	1	0
B0000INU6S	LeapFrog: Letter Factory	A1FTJIRYO29LD4	"Nabila Ali ""techqueen"""	This is a good video...NOT great as people seem to think. There are some grave mistakes, for example, the 'O' and the 'U' both seem to say 'Ah', the 'L' says 'Ul' and the 'R' says 'Er'.Im distressed that my 2-year old sems to be learning the letter sounds incorrectly. Even when I try to correct the video, she seems to go with the sounds made on the video. Im kind of turned off by the Leap Frog company. How could they have let this kind of stuff fall through the cracks?	2.0	OK video but contains some phonics mistakes	2008-10-03	17	8	9
B0000INU6S	LeapFrog: Letter Factory	A3V2WBS7VKYL5U	Nancy Alldredge	I bought this DVD for my three, almost four-year-old, son.  He has had trouble pronouncing many letters, commonly saying the 'd' sound for 'g', 'p', etc.  He had been in speech therapy and it was helping a little, but he wasn't making that great of progress.  Until he started watching this DVD, that is!  Within watching it just two or three times, there was a noticeable improvement with his speech.  After three weeks of having it, with him watching it maybe five times a week, he can say every letter clearly and correctly.  This DVD has made a world of difference!  Plus, he is able to recognize all the letters and is well on his way to having the alphabet memorized.  Thanks Leapfrog!!	5.0	This DVD is great!!	2010-02-15	0	0	0
B0000INU6S	LeapFrog: Letter Factory	A2XO2D1ZIXKLQX	"Naomi Balaban ""mother goose"""	Leap Frog - Letter Factory is THE BEST. Both educational and enjoyable.	5.0	learn to read	2007-05-14	0	0	0
B0000INU6S	LeapFrog: Letter Factory	AXHP93K4LXFL2	Natalie C. Howard	My 2 and 3 year-olds now know all of their letters from watching it about 3-5 times.  They love this DVD and so do I.	5.0	best educational DVD ever!!	2009-09-08	0	0	0
B0000INU6S	LeapFrog: Letter Factory	A355NVFFML0R28	Natalie	I prefer not to have my child watch a lot of television however my two y/o has a speech delay, our speech therapist recommended this video.  My son enjoys it and tries to repeat the sounds of the letters.  Granted he is not going to learn words but if he can learn the sounds of letters it is a start.	5.0	Great.	2013-10-06	0	0	0
B0000INU6S	LeapFrog: Letter Factory	ANGT3Q82ZTY37	Nathaniel's Mom	The mom of one of my son's Pre-K classmates noticed how well her daughter learned her letter sounds after watching this, so the mom bought a copy for the classroom. Now the kids watch it about once a week. After only a few viewings my 3 year old son knows more than half of the letter sounds and really enjoys pointing to letters and making their sounds. If you're going to show your kids videos, show them videos like this!	5.0	It really works!	2006-02-06	0	0	0
B0000INU6S	LeapFrog: Letter Factory	A1JTHSX7509BAZ	navywife&amp;mom	I have a 18 month old and a 3 1/2 year old. They watch this video a few times a week while i'm making dinner. Experts say not to use the tv as a babysitter, but this video gets them to sit, relax, keeps there attention & they are learning!! We love this video, really for the 9 bucks it costs, take a chance, you won't be sorry!!	5.0	Perfect!!	2011-09-22	0	0	0
B0000INU6S	LeapFrog: Letter Factory	AVAEOHBH2V9T6	Navywife	We bought a new one when our other one got scratched. Our 23 month old is now singing along to it with her big sister. We love hearing them sing in the car. Warning! tune is catchy so you may just find yourself singing it at random moments.	5.0	Perfect!	2013-02-18	0	0	0
B0000INU6S	LeapFrog: Letter Factory	A33U5VXHMJ2V2N	"N. Bravershteyn ""alandnel"""	I've never written a review before, but i must for this product. it is great. My kids have a number of videos, but they ask for only this one every time. it's fun, educational and has a great way to reinforce the concept of letters and phonics. My 2 year old knows all her letters and now all the sounds they make. My one year old doesn't talk much, but sits through the entire video and repeats all the sounds! Great product. Best 10 bux i've invested.	5.0	Best Video Ever	2007-03-09	0	0	0
B0000INU6S	LeapFrog: Letter Factory	AQAZ0DHPJM1GO	NC	Don't know why it is, but my kids love this DVD, and they've learned their letters and sounds from it.	5.0	Really gets into kids heads	2006-06-28	1	0	1
B0000INU6S	LeapFrog: Letter Factory	AZKTVYSAV3KD1	"N. Chung ""mkmmommy"""	I bought this for my 3.5 year old after hearing about it from friends and reading so many great reviews.My daughter loves it and she often asks to watch 'professor Quigley' over and over again.  I have found her reciting the letters and sounds to herself before she goes to bed at night.The reason why I didn't give this 5 stars is because of one thing.  When teaching the L sound, it is not very clear and both my daughter and I hear 'O'.  When we get to that part, she would ask me why are they saying 'O' when it's 'L'.Other than that, I'd recommend it to all parents of preschoolers.	4.0	Great Learning Tool	2008-10-05	1	1	0
B0000INU6S	LeapFrog: Letter Factory	AXFGFT8J1QNM3	N. Clifton	Leap Frog - Letter FactoryI bought this DVD to watch with my granddaughter.  By 22 months she knew the letters of the alphabet and I thought this DVD might help to reinforce it in a fun way.  It surpassed my expectations because now at 24 months my adorable granddaughter now knows the sound that each letter makes and can tell you words that start with each letter as well.  She recognizes letters on boxes, cards, and signs and tries to sound out the letters.  She also can tell you several words that start with each of the letters.  She's just turned 2 at the end of December!!  It's incredible.  I have now ordered Talking Words Factory and am looking forward to watching it with her.  (Check back for my review on Talking Words Factory too!)  The video makes the way the letter produces the sound easy for a child to understand AND remember.  It is a wonderful learning product presented in a fun and exciting way. (I'm a retired librarian and am always on the lookout for great learning materials.)  I highly recommend this for as soon as your child shows an interest in learning ABCs.	5.0	Letter Factory is awesome!!	2008-01-02	0	0	0
B0000INU6S	LeapFrog: Letter Factory	AL3UI8LF5A42L	N. Crawford	It is no surprise to me that some people are incredibly naive when they buy things on amazon, they buy a DVD and expect their child to magically learn the alphabet within days and sit threw the entire thing every time from start to end.I am not writing a load of Tosh from a teachers perspective or a psychologist point of view. Simply from a mother of a toddler. Being Scottish living in the USA (where they pronounce letters different from the rest of the world) it is already a learning curve for me to teach my daughter the American sounds like J (Jiy and Jay ) and Z (Zed and Zee). I was looking for something to go along with our books and flash cards.This DVD does a great job at keeping up the pace, it gives the sound along with the letter name which makes it easier for my toddler to link the two and the graphics (that someone said looks like 80's graphics) are great. They are sharp and clear from things that might distract. I watched with my daughter to ask her what the letter was each time.Great learning aid for toddlers.  It has been PROVEN to help children learn ABC's but all kids learn differently so you have to buy this DVD knowing that . Flash cards are great to do with this to help teach lower case letters .	4.0	Great tool for learning	2013-10-14	0	0	0
B0000INU6S	LeapFrog: Letter Factory	A21JY36W4LB5C4	N. D	WOW.  That's all I have to say.  I got this for my 3.5 year old son.  He got sooo addicted to it from the start.  He would ask to watch it over and over.  He would tell me when to restart it.  Now I'm working on getting him to pronounce 3 letter words.  He's 4 now and is really trying.  I can't believe how amazing this is.  A coworker recommended this.  She said the private school her son is in was using it for all their kids.  A CD was given to each parent.  Parents were encouraged to have the child listen to it 5 times per week.	5.0	Great for 3 years and UP	2011-07-18	0	0	0
B0000INU6S	LeapFrog: Letter Factory	ATIWGXWUJ2L6V	Nellie	Very good product. Not much singing and music though as that is what captures their attention more. But generally helps them learn the alphabet and my child (one yr 8 mths) repeats some of what she hears on the dvd, like &#34;the A says ah&#34; and so on.	3.0	Very good	2013-05-13	0	0	0
B0000INU6S	LeapFrog: Letter Factory	A3UYHTXN7XFN8O	"Newbie Yogi ""Adada Baby"""	My toddler would sit in front of the TV to watch this over and over again. I love that she is learning from this. I am getting all of the leap frog DVD.	5.0	my toddler loves these	2010-12-22	0	0	0
B0000INU6S	LeapFrog: Letter Factory	A35DO0WZ8JKS10	New mommy	My son 18mos love this movie so much I always put it on for him when Iam  cooking . He's not bothering me at allLove it!!!!!!	5.0	Excellent for my 18months old.	2014-07-01	0	0	0
B0000INU6S	LeapFrog: Letter Factory	A2H5IWX8X4QJOT	"New Mommy ""New Mommy"""	My daughter learned all of her letters and sounds from this video. I love it so much that I have purchased this video for multiple friends.	5.0	Amazing product	2013-05-24	0	0	0
B0000INU6S	LeapFrog: Letter Factory	A2IVSVH5CFMFUD	"New York City mom ""newyorker100"""	I have two children, ages 4 and 6, and they both love this video, which teaches the letters and their sounds.  This product is superior to the Leap Frog toys, which I find very gimmicky. It is a straightforward educational video with a lot of humor.  It's also reasonably priced.	5.0	My sons love it and learn a lot from it	2007-01-09	0	0	0
B0000INU6S	LeapFrog: Letter Factory	A18YOV1DLO8XPN	"Nezar Reed Whitsett ""reed"""	Great educational movie for age 2+! I don't love to let my children watch a TV, but I don't mind them watching this. Very catchy tune for children!	5.0	My 3 year old loves, loves, loves this movie!	2013-12-19	0	0	0
B0000INU6S	LeapFrog: Letter Factory	A2N4EQFRZFG43F	"N. Ficaro ""mama to 2 girls"""	My 3 y/0 is really learning her letters and the sounds they make from this video.  We watch it and as soon as it comes to a close, she wants it again, and again.	5.0	My daughter loves this DVD	2009-04-09	0	0	0
B0000INU6S	LeapFrog: Letter Factory	A1EDTT48JL7VHE	"N. Gleeson ""Niamh"""	My 33 month old daughter loves this video. Within a week or two (watched the video 5-6 times) she recognizes all of her letters and knows most of their sounds. She loves it.	5.0	Wonderful Educational video	2008-02-22	1	1	0
B0000INU6S	LeapFrog: Letter Factory	A3JIBIQZTGHOU	N. Hong	"My toddler (22 months) absolutely LOVES this video.  He even knows the next scene to anticipate for after one is done.  For example, right after the b-b-b, he would say ""uh-oh, cold"".  I like how the tunes are catchy and the video makes it easy to remember the sounds each letter makes.  I've purchased this video two weeks ago, so my son doesn't know the letters or sounds yet, and I'm trying not to let him watch it too much, but it's certainly something he'll be able to grow into and learn from."	5.0	My toddler keeps asking to see it over and over	2009-05-30	1	1	0
B0000INU6S	LeapFrog: Letter Factory	ABWIOLQTFL21K	Nhor NCMom	The catchy song and the cute memory tools used is this video has helped my son learn his letter sounds and REMEMBER them.  It is something he has enjoyed watching many times.  I love this video!	5.0	excellent teaching tool	2006-08-15	0	0	0
B0000INU6S	LeapFrog: Letter Factory	A3IFKBUE064H5V	"Nia ""www.altimatepublishing.com"""	I'm elementary teacher and I just have to say that this video is outstanding. I originally bought the tape to help my 4 yr old brother learn his sounds in a fun way. He absolutely loved the video. So much so, we had to watch it 3 times in a row. But needless to say, afterwards he knew most of his sounds. If that's not impressive, I don't know what is.Having such good results with him, I used it in my first grade class to help the lower students. Also I used it when I taught preschool during the summer. The kids really get a kick out of the songs. Each letter has it's on idividual catchy song to help your child remember the sound. This is a video I would recommend to anyone.	5.0	Teacher's Opinion	2006-03-02	2	2	0
B0000INU6S	LeapFrog: Letter Factory	A2JTBC9Z2XD36	Nicholas Achkar	My three year old twins learned the sounds of the letters of the alphabet well and quickly just by watching the DVD. It is fun to watch. It works.	5.0	Engaging DVD	2006-10-03	0	0	0
B0000INU6S	LeapFrog: Letter Factory	A2G7KSMRN3DPG9	Nicholas P. Taylor	"Simply delightful.  Very cute.  I bought this for my cousin, 23 months old, on the advice of a friend of mine who teaches kindergarten.  My cousin adores it.  She keeps asking ""Watch froggies"", and she's already picking up a few letter-sounds."	5.0	Wonderful!	2005-09-20	0	0	0
B0000INU6S	LeapFrog: Letter Factory	A2XRX0YPHO73BE	"Nichole Hood ""Kindle Fan"""	I bought this for my three year old. I was hoping for something entertaining to help her learn her letters because flash cards were not holding her attention. Well she was bored about two minutes in. It would probably be better for a younger child but it didn't hold her attention and after trying several days in a row of watching the video with her she just got mad that she wasn't watching Mickey Mouse or Dora.	3.0	Okay, but not great	2010-04-23	2	0	2
B0000INU6S	LeapFrog: Letter Factory	A3E43CGZ847R52	Nicky's Mom	"This is my sons new favorite DVD.  He just turned 2 1/2 and just started saying real words a few weeks ago.  Since this DVD, his letter sounds are said more clearly.  He asks for this DVD all the time and as soon as he sees the ending credits come up he says, ""More fogs peeze"".  He watches it daily and never just once.  I actually find myself singing the song in the shower or on the bus!  A well done product for teaching letter sounds.  Very clever, fun and educational.  As the mom of a late talker, I highly recommend buying this DVD."	5.0	Another wonderful product from Leap Frog!	2005-09-06	2	2	0
B0000INU6S	LeapFrog: Letter Factory	A1JI8J1QQBSAHJ	Nicole	After this being recommended to me by several other moms, I bought it for my 2 yr old son. The only tv he watches is Super Why and Sesame Street and the occasional toddler movie, so he is not a huge 'sit and watch tv' kid. This did not hold his interest, nor mine, the first several times we tried it. But then he grew more interested in and started interacting with it, repeating the letter sounds and shouting out the letters. Now he asks to watch it at least once a week, and just as my mom friends told me, I have noticed an increase in understanding, as well as interest, in the alphabet, letters and their sounds from him. I am a believer now!	5.0	Helped my son learn his letters!	2013-02-04	0	0	0
B0000INU6S	LeapFrog: Letter Factory	AGAOLD7VKRU6B	"Nicole Leishman ""N Leishman"""	"I'm probably going to say what everyone has already said, but this DVD deserves it.My 2-year old son rarely sits still or pays attention to much of anything.  However, he really does watch this whole show.  The characters are cute and colorful, but the animation is simple enough not to be overwhelming.  Do not expect a movie of cinematic genius, but do expect something your pre-schooler will love.  Aside from the letter learning, the story and how the characters interact and treat eachother is charming and appropriate without being too saccharin.Additionally, and most importantly, he was repeating letter sounds the very first time he watched it.  He already has a favorite letter, ""W"", which he calls ""double.""  He dances to the music and I think it helps that he has the magnetic letter set and the little player that came with them sings the same song for each letter and it's sound, so he recognized it.I was nervous when it first started playing because the legal warnings at the beginning were very poor video quality and I thought maybe the whole movie would be that bad, but it was ok once the movie started.  I love the letter song, it is so cute, that I sing everyone of them!  It is repetative, but that's what makes it such a good learning tool.  I think we will be watching this for some time to come!"	5.0	I'll say it again!	2007-09-23	1	1	0
B0000INU6S	LeapFrog: Letter Factory	A2VJNS9N2WHONK	Nicole Reitz	I can't believe how much my 18 mth old has picked up from this DVD.  She absolutely loves it and wants to watch it all the time.  She can now see a letter and make the sound on her own!  It has also helped her to use more words.  Would recommend to anyone with a young child.	5.0	Smartest kid ever	2013-02-17	0	0	0
B0000INU6S	LeapFrog: Letter Factory	AIWCRHUPZVR56	"NIKOLE TERRY ""Heritage Maker"""	My sister recommended this dvd to me after her daughter learned all her letters in only two weeks.  We got the dvd and the same thing has happened with my son!  This dvd hs figured out the way to get into a kids head and how they'll remember what they need.  AWESOME!	5.0	LOVE IT	2006-03-16	2	2	0
B0000INU6S	LeapFrog: Letter Factory	ANM52MEHG497T	Nimue Amethyst	I have tried everything to get my energetic four-year-old started reading.  He knew letters, but I couldn't find anything to get him beyond that.  He loves playing with his leap pad, and he also loves watching movies, so I picked up this video and he was telling us what sounds the letters made almost immediately.  It's true that they only teach one sound per letter, but I feel this is less confusing.  Even with one sound per letter, they can still assemble simple words by sounding them out.  Both of my boys watch this video over and over, as well as the Talking Words Factory video, and now not only is the four-year-old starting to put sounds together to make words, but the two-year-old is learning the letter sounds.  The animation and the sonds keep the kids engaged, and each letter has a special trick to help the kids remember their sound.  I find the older one pantomiming each function while he tries to connect sounds.  We've tried other videos and have been less successful.  I'd recommend this video even if your child does not know the alphabet yet, because it teaches the names of the letters along with the sounds.	5.0	Last Resort	2004-04-04	4	4	0
B0000INU6S	LeapFrog: Letter Factory	A2NT9976WBKOY9	"nina F ""nina"""	amazing learning resource!!!!i combined this dvd with the fridge phonics....after 2 months,my 18 month old daughter knows all her alphabets and sounds....	5.0	amazing results	2008-03-21	0	0	0
B0000INU6S	LeapFrog: Letter Factory	A3GKEBJPQ9P4WW	"NiskyMom ""2kids0time"""	I tried countless ways to help my son learn his letters and letter sounds, spending more money than I care to admit.  Leapfrog's Letter Factory DVD was the first and only method that worked!  He watched it over and over.  Within a week or two, the transition was amazing.  I cannot say enough good things about this product.  My son needed something that would entertain, educate and hold his attention.  The Letter Factory did the trick!	5.0	HUGE SUCCESS	2010-08-08	0	0	0
B0000INU6S	LeapFrog: Letter Factory	AFSI17C9K3SYJ	"NJB ""research diva"""	I first purchased this for my first child 5 years ago..He has a learning disability, but this tape really helped him.I recently purchased this for my daughter and I had the same results.  They both picked up the sounds and letter recognization.  It's a great tool.	5.0	2nd time purchasing this video	2009-10-22	0	0	0
B0000INU6S	LeapFrog: Letter Factory	A3F259CQI3UUXV	N. Jobe	I got the first of these (Letter Factory) based on the reviews.  As an adult, I was not impressed AT FIRST -- the cartoon characters are a little annoying.  But don't be put off; keep watching.  These videos are amazing!  What a creative way to teach phonics.  We encorporated the fragments of song in the video into one long alphabet/phonics song.  My grandchildren learned phonics and were on their way to reading before the age of 3.  (My granddaughter actually read her first book shortly after receiving these videos.)  Get them all!	5.0	All of these videos are great!	2005-11-18	1	1	0
