asin	title	reviewer_id	reviewer_name	review_text	rating	summary	review_date	total_votes	helpful_votes	unhelpful_votes
6302320488	The Quiet Man [VHS]	AYPS4RCXEFSJP	K. Boullosa	"This is my personal favorite among all John Ford's films. Presenting what is probably a rather romanticized image of an Ireland that I suspect never existed even 100 years ago, the film's visual beauty, interesting romantic dilemma, and wonderful performances, are nevertheless worth every minute of its slightly longish running time.  John Wayne is not one of my favorite actors and I can only go so far on the red-haired beauty of the admirably upholstered Maureen O'Hara.  However, as the conflicted, heartsore, regretful boxer Sean Thornton, who returns to his mother's natal village in Ireland, Innisfree, to find some peace and healing, Wayne strikes a nice if wooden balance between machismo and vulnerability.  O'Hara, as Mary Kate Danagher, the (sorry, there is no other word for it) fiery neighbor with whom Sean falls in love, provides for Wayne what can only be called a match made in Heaven: physically, temperamentally, intellectually, and spiritually - only culturally do Sean and Mary Kate suddenly find themselves at loggerheads.Sean travels to Innisfree to find solace after a terrible experience in the boxing ring.  He began life in Pittsburgh, where his mother emigrated, and spent his youth in the city's legendary steel mills, a purgatory from which his boxing talent eventually freed him.  But all his young life his mother filled Sean's mind with the beauty and peace of Innisfree and the pretty cottage she was born in, White O'Morn.  Now wealthy from his boxing career, but with a deadly secret heavy on his heart, Sean returns to his mother's village to buy back the family cottage, rediscover his roots, and achieve reconciliation with his own past.  It is Mary Kate Danagher who Sean spots the day he arrives in Inisfree, barefoot in the lush green grass as she tends her brother's sheep, red hair blowing in the wind.  For Sean, it is love at first sight.But Red Will Danagher (the formidable Victor MacLaglen in all his ham-fisted glory), also wants White O'Morn, as well as its owner, the genteel Widow Tulane, whose land lies so neatly next to his.  When Sean outbids Will for the cottage and its land, Danagher's volcanic ire fastens implacably on the Yank newcomer.As ill-luck would have it, Mary Kate is Will's younger sister, who keeps house for him.  Sean, to his dismay, soon finds out that in order to win Mary Kate, he must first conquer her irascible brother's hostility, because without her brother's consent Mary Kate cannot marry, or if she does, would forfeit her dowry.  The symbolic importance of a girl's dowry as she leaves her family home to found one of her own, the necessity for a local matchmaker to facilitate proceedings - all the small village's seemingly immutable mating customs puzzle and infuriate Sean.  Only slowly does Sean come to understand what Mary Kate feels when she says that if he doesn't have her dowry, he doesn't have any real bit of her, that she is ""still the servant I have always been.""  Reluctant as Sean is to use his fists again for what he thinks of as ""only money"", eventually he realizes that he will have to come to terms with his last fighting experience or lose any chance at happiness with Mary Kate.How Sean and Mary Kate and Red Will and the Widow Tulane, as well as a delightful supporting cast of characters (e.g., Barry Fitzgerald as the matchmaker and Ward Bond as the powerful village priest) find their way through this romantic and cultural tangle makes for a lovely, well-written, beautifully played two hours.  The exploration of different cultural expectations and misunderstandings is gentle and the custom of the dowry, and what it meant to a woman in such a culture freeing herself from girlhood obedience, provokes thought.  ""The Quiet Man"" is very much in a class by itself and shows all Ford's talent for marshalling exactly the right people in the right roles."	5.0	Irresistably Romantic Gaelic Culture Clash	2010-08-26	0	0	0
6302320488	The Quiet Man [VHS]	A3011MN92X5BAF	kc	The quality is very poor for a collector's addition. I was quite disappointed, when I attempted to watch it.  I LOVE the movie itself....but this DVD is not worth the $33.99.	2.0	Quality	2013-01-29	3	1	2
6302320488	The Quiet Man [VHS]	A2XWVY6ETBH4C	Keith Melton	This is my overall favorite John Wayne and Maureen O'Hara film. I first saw it as a kid on TV, and had caught a few times over the years. Now very happy to own it. Another good match of these two in film is McLintock. If you like either of these stars I'm sure you'll enjoy.	5.0	Probably my overall favorite.	2013-12-21	0	0	0
6302320488	The Quiet Man [VHS]	A3ODUE1H9D3R4U	Keith Ridden	This movie is incomplete as it stops at the end of chapter 13 with the famous fight only halfway through.	2.0	Incomplete Movie	2013-07-19	1	0	1
6302320488	The Quiet Man [VHS]	A3VFRQRXGM106G	Kelly Read	This movie is a classic! We gather family together during holidays, pop the popcorn, set everybody up with coffee or hot chocolate and enjoy this movie often. We never seem to get tired of it. The Quiet Man will make you cringe while you laugh out loud at some of the dated, sexist behavior, but the movie was produced, like, 65 years ago. The character of Michaleen Oge Flynn is a special treat!	5.0	Best (and funniest) fight scene in all of moviedom!	2013-11-10	1	1	0
6302320488	The Quiet Man [VHS]	ADDBRYM7Q50HO	"Kendra Thomas ""shedevil"""	Loved this classic movie, had an old VHS copy that was bad. This is a great gift!	5.0	Great movie	2008-02-15	2	0	2
6302320488	The Quiet Man [VHS]	AP5KU4U1DXQ5A	KENNED423	The Quiet Man is my all time favorite movie.  John Wayne and Maureen O'Hara give the performances of a lifetime.	5.0	THE QUIET MAN	2013-05-16	0	0	0
6302320488	The Quiet Man [VHS]	A37QTYERFKU85H	Kenneth R. Von Gunden	Great movie, absolutely terrible transfer. Stay away from this! This is the latest of many copies I've bought for my wife looking for a good transfer. This isn't it!	1.0	Disappointing	2012-07-13	2	2	0
6302320488	The Quiet Man [VHS]	A3I4PWZSJNOS1R	kenneth tripkos	Best movie John Wayne ever did; it has romance and action in a style that has past out of fashion.	5.0	The Quiet Man	2013-12-23	0	0	0
6302320488	The Quiet Man [VHS]	A14TACJAKQHE2A	"Kenn's comments ""Kenn"""	I bought this new DVD of the Quiet Man hoping to get much improved picture quality over my old VHS tape copy of the Quiet Man.  Picture quality is still dismal, thought with remastering would be a vast improvement, instead turned out to be a total waste of money	1.0	QUIETMAN VIDEO POOR QUALITY	2007-05-06	5	2	3
6302320488	The Quiet Man [VHS]	A356QJWDT3P62R	Keoma	"I recently had to reduce my satellite programming (due to cost) which meant that I had to let Turner Classic Movies go. However the upside is that now that more and more classic movies are coming to blu-ray I will be able to enjoy them even more in full 1080p and can build the kind of library I have been wanting. The Quiet Man is one of these essentials. Just like in ""The Searchers"" the cinematography is absolutely stunning and the colors are vivid, and this was on the dvd. However, the picture quality and clarity was certainly not conducive to the movie and was a disappointment to say the least on the dvd. If they have put the care and time to transfer it to the blu-ray format that they did with ""The Searchers"" then I can't wait to see this the way that it was meant to be seen. These are the timeless classic titles that I can watch again and again and never get tired of them. I will update this review when I have seen if they have fulfilled my expectations for this video release."	5.0	A Wonderful Classic from John Ford and John Wayne	2012-11-19	0	0	0
6302320488	The Quiet Man [VHS]	A1O9OBV791588J	Kerry	This is a classic and I have not seen it in years.  Luckily it was available on Prime and the quality was great.	5.0	Classic	2014-03-20	0	0	0
6302320488	The Quiet Man [VHS]	A1WP1RAL9K8V95	Kerry S. McGill	I have enjoyed watching this movie every time I have done so. It represents Ireland in a great way, and the story is wonderful.	5.0	Always a great movie	2014-03-19	0	0	0
6302320488	The Quiet Man [VHS]	A1EHNNWRJBA4HO	Kevin	This print of one of my favorite movies really makes this movie look good, even on a large screen TV.  I bought this copy to send as a gift (part of a &#34;Saturday Matinee gift pack to a soldier) but wanted to watch it one more time.  I'm glad I did - seeing it in this version.I have always thought of this as a perfect &#34;date movie&#34; because it has romance for the ladies and bar fights for the guys.	5.0	New print worth the price	2014-02-06	0	0	0
6302320488	The Quiet Man [VHS]	ASS10K9U02GG6	Kevin	THIS COMPANY DID AN EXCELLENT JOB ON THIS BLU-RAY - I SUGGEST YOU BUY IT, IT IS REALLY WORTH IT!! You can see many details in this blu-ray version that you are unable to see in the regular dvd versions.	5.0	Review of BLU-RAY DVD Quality Only	2013-03-01	1	0	1
6302320488	The Quiet Man [VHS]	A22UK1R5V8YLAE	Kevin M. Donohue	Beautifully filmed, well-acted with great characters and a charmingscore. If you haven't seen it, it should be on your Things-to-do-for-StPaddy's-Day list.A warning however: this was filmed about 62 years ago and, as we OldTimers know, society hadn't begun losing some of it's old ways. Thereare those who say we still haven't and they MUST see this movie.The story-line and the characters' lines reflect a very old fashioned viewof a woman's &#34;place&#34; and will make you laugh, cringe or both. Accept itas the &#34;period piece&#34; that it is and you'll love it.	5.0	The Quiet Man...a dated Classic	2013-05-22	0	0	0
6302320488	The Quiet Man [VHS]	AIT979YDF549R	K. Grant	Excellent movie, wonderfull actors, I have enjoyed this movie very much, one of the best I have ever seen,  but its a shame about the poor quality of the dvd transfer,  this ruined a great movie,	5.0	Movie 5stars, tranfer only 2star	2005-08-04	8	6	2
6302320488	The Quiet Man [VHS]	A222DNSEPJHK1E	"K. Hamlett ""doc Smith"""	This is one of the greatest movies of all time. Fortunately they have improved the image quality over a prior release of the DVD. While the image quality is not up to the same standards as the original movie it is fine for general use.	4.0	Much better than prior release	2010-02-01	0	0	0
6302320488	The Quiet Man [VHS]	A1KM4SO6K2X85K	K	This is our favorite John Wayne and Maureen O'Hara classic movie.  The case of characters and famous actors is huge.  John Ford produced this Irish classic and it is superb story .  The production was filmed on location in Ireland and the &#34;behind the scenes&#34; extra DVD segments are fascinating.  Highly recommend.	5.0	Wow a John Wayne & Maureen O'Hara classic.	2014-01-21	0	0	0
6302320488	The Quiet Man [VHS]	A3UZ1S23HTHC80	kim billingsley	Brand new movie. Awesome movie wanted for St Patty dat. Had it in plenty of time I would buy from again	5.0	The Quiet Man	2014-04-12	0	0	0
6302320488	The Quiet Man [VHS]	A2Y4QU9EKOVKTG	"Kim Everett ""Movie buff"""	This is a fantastic movie and is one of our favorites. I thought I had already replaced the VHS copy so when I realized I didn't I had to get it.	5.0	Fabulous	2012-03-07	1	1	0
6302320488	The Quiet Man [VHS]	A2Z83TBC67YZ1W	Kim Ginn	This is a fun movie to watch.  The simple irish humor mixed in with the softer side of John Wayne is a great classic movie to see.  Maureen O'Hara is such a lovely lady.  It's a great movie to sit down on a quiet Sunday afternoon and enjoy!!!  This is one of the outstanding classics!!!  You'll be glad you took the time to see it.	4.0	Relaxing Sunday Afternoon	2007-09-29	2	1	1
6302320488	The Quiet Man [VHS]	A20JI3FL53KXJZ	Kim S.	This movie is a classic.  There is so much to enjoy:  the plot, the beauty of the scenery, the characters, the acting, relationships,  culture, etc.  Our family never tires of viewing this movie when it has been on tv (absolutely no commercials), and we are glad to now have our own copy.  This particular edition has interviews about the making of the movie, which was appealing to me.	5.0	glad to get it	2013-06-30	0	0	0
6302320488	The Quiet Man [VHS]	AV77WNMU7Q4V	Kindle Customer	This movie always leaves me humming the song.Pride, Tradition, Love.Beautiful scenery throughout.Great one to own, it's a keeper.	5.0	The dynamic duo	2013-09-07	0	0	0
6302320488	The Quiet Man [VHS]	A2HJECM2TCZG4O	Kirk H	"Of course the 2 star rating is for the DVD transfer, not the movie, which is one of John Ford's and Wayne's best, but it seems all the other bad reviews spend so much time commenting on the poor picture quality that no one seems to have noticed the entire audio track is out of sync!!  It's noticeable throughout, particularly when characters speak quickly.  I gave a 2 rating instead of 1 (but would prefer 1.5) because, although the transfer is not good, many of the shots retain their beauty - particularly the landscapes.  Where the problem arises is in the red and facial tones.  Terrible.  Still, the movie is so good, I laughed out loud many times.  ""Impetuous!  Homeric!"""	2.0	AUDIO TRACK OUT OF SYNC!	2006-08-04	10	7	3
6302320488	The Quiet Man [VHS]	A1VHG8FXC657BK	kiwi kate	"i know this film well already, love it, just the thing for a cold wet day baking, i want on dvd, pop it in to play one wet day when i'm off work sick and it will not play! just says ""wrong region"" what does that mean? it's a DVD, how does it even know its half way around the world. don't know what to do about it or how ot fix it."	1.0	willn't play	2011-12-27	3	1	2
6302320488	The Quiet Man [VHS]	A3QKRCYIGZSXAR	K. Jessee	The Quiet Man (Collector's Edition)This is one of my, all time, favorite movies. As my dear Mama has said, many times, this was the one film in which John Wayne really had to act! He wasn't being his cowboy or soldier persona in this film. He showed a tenderness and depth that was quite moving! And of course, as always, Maureen O'Hara is gorgeous and fiery! Lots of great, and memorable, lines, an incredible cast; it's always been our favorite to watch around St. Patrick's Day. I definitely recommend it to Duke fans everywhere!	5.0	"""The Quiet Man"" DVD"	2012-10-05	1	1	0
6302320488	The Quiet Man [VHS]	A1ERSU7NW18GYD	"klesmith ""John P. Klesmith"""	This has always been my favorite John Wayne movie.  It's touching, funny, emotional;  it reaches all of your emotions.  Great cast, beautiful  scenery, authentic Irish dialog;  who could ask for more?  This definitely  should be on your list for St. Patrick's day viewing!!	5.0	Should be seen every St. Patrick's Day!!	1999-11-01	0	0	0
6302320488	The Quiet Man [VHS]	A2T8DGH1NY6VM9	K. Lewis	I first saw this when I was a kid. Loved it then and now. The movie is great, but that fight sequence was grand. Ordered last year just before St Patrick's Day and it arrived in time to watch with corned beef, Guinness and Irish whiskey.	5.0	A St Paddy's Day go to	2013-01-20	0	0	0
6302320488	The Quiet Man [VHS]	A1FDNWCJ64BRYH	"K. Lynch ""Katy Girl"""	I've been looking for The Quiet Man DVD for a while and I finally found it on Amazon.com.  It arrived very fast and the transaction was smooth.	5.0	Hard to Find DVD	2011-05-05	2	0	2
6302320488	The Quiet Man [VHS]	A2GPEV42IO41CI	Kona	"John Ford's ""The Quiet Man"" takes you to the beautiful Irish countryside for a romantic-comedy and slice of folksy life.  Sean Thornton (John Wayne) has left America and returned to Ireland to settle in his ancestral home.  On his first day, he sees the lovely spinster, Mary Kate (Maureen O'Hara), and makes up his mind to marry her.  She's more than willing, but the local customs must be observed, and Sean courts her with the help of the local marriage broker (Barry Fitzgerald).  All goes well, until Mary Kate's brother Will refuses to pay her dowry.  She is shamed and ashamed of Sean for not answering Will's challenge to a fist fight.  No one knows that Sean once killed a man in the boxing ring and has vowed never to fight again.This is a lusty, entertaining movie thanks to the terrific chemistry and charisma of big John Wayne and spitfire Maureen O'Hara.  They are a perfect match and a joy to watch.  I didn't like Sean's manhandling of Mary Kate - I'm sure it was meant to be funny and earthy (it seemed barbaric to me).  But the scenery is lush and idyllic, the score is a merry collection of Irish folk tunes, and the feeling one gets from watching is that there would be no finer place on earth to live than the fairy tale village of Innisfree.Kona"	5.0	"""You can tell him, 'I go for it!'"""	2005-10-01	8	7	1
6302320488	The Quiet Man [VHS]	ABLOQZIL42W7I	"kone ""kone"""	"If you're like me, once you view ""The Quiet Man"""", you will want to take it out each year on St. Patrick's Day and laugh, cry, and revel in it's genius!  This may be the best movie that John Ford ever directed, as this is truly a masterpiece from start to finish. Filmed on location in Ireland, Ford used the beautiful green countryside to frame his story of a former boxer, Shawn Thornton (John Wayne) who leaves America for Ireland after he accidently kills another fighter in the ring.  Hating himself for pummeling his foe to death for the money purse, Shawn vows to never use his fists again.  In Ireland, Shawn buys his boyhood home in Innisfree, and simutanelusly incurs the rath of his neighbor, Will Danaher, who wanted the property himself.  Shawn quickly falls head over heels for the bewitching beauty of Mary Kate Danaher, Will Danaher's sister (Maureen O'Hara - in perhaps her best role).  Unfortunately for Thornton, Will Danaher refuses to give his sister in marriage to the man he despises.  Enter official matchmaker Michaleen Oge Flynn, who with the help of the local clergy, hatches a secret plot to get Will Danaher to give up his sister to Thornton.  Shawn and Mary Kate are finally married; however, there is one more problem, Mary Kate's brother Will refuses to deliver her 350 dollar dowry after he discovers he's been tricked.  Shawn, who hates money due to his boxing history, refuses to press the issue with Danaher, causing Mary Kate to think Shawn is a coward and does not care for her.  Mary Kate decides to leave her husband to shame him, and heads for the train station.  This is the last straw for Shawn and the end of his ""quiet-man"" ways.  The last 30 minutes of the film is an absolutely delightful, hillarious romp through the contryside, first to retrieve his wife, and second, to fight Mary Kate's brother for the dowry.  A marvelous finish it is.  Ford's genius is clearly evident in the humorous manner in which he wraps up this film.  I laughed until I cried!The movie's score is wonderfullly Irish (of course), and I guarantee you will be humming the various musical themes long after the movie is over.The character casting is excellent and unforgettable.  Wayne is superb as the American Yank Shawn Thornton, and O'Hara matches him scene for scene as the fiery and fiesty Mary Kate.  Their on-screen chemistry is obvious, and it is apparent both actors truly enjoy each others company and work.  The supporting cast is superb as well, with Ford gathering his ""family"" of actors around him to make ""The Quiet Man"" a movie you will never forget.  Barry Fitzgerald (as Michaleen Flynn), should have won an Oscar for his hilarious portrayal of the boozed-up mathchmaker.  Victor McLaglen as Will Danaher is equally gifted.Beautifully filmed, artistically directed, and wonderfully acted, ""The Quiet Man"" is pure and simple, a true gem of a film, and one you will want to watch again and again. Make sure you purchase the BLU-RAY version - it is crystal clear!kone"	5.0	Simply Terrific - Get the Blu-Ray Version!	2003-04-03	5	4	1
6302320488	The Quiet Man [VHS]	A299FJQ0TPE7WO	Kurt K. Christensen	While watchable on NTSC, the presentation is pathetic on new HD monitors. It is time for this movie to be remastered from the original cine.	3.0	How about a remaster in Widescreen?	2010-03-19	0	0	0
6302320488	The Quiet Man [VHS]	A3P3TNH6IVABCZ	Laddie	Finally we have a proper transfer of what may be Ford's greatest film. Sharp images and proper color, apparently from a new scan. A great job by Olive Films; this is the version to get.	5.0	Olive Films The Quiet Man (60th Anniversary Special Edition)	2013-01-22	3	2	1
6302320488	The Quiet Man [VHS]	AZUZSHTS2JTIE	"LadyElisabeth ""LadyElisabeth"""	Love John Wayne and Maureen OHara together. They play off of each other so naturally you would not know they were acting. Classic cinema at its best.	5.0	Classic John Wayne	2013-06-08	0	0	0
6302320488	The Quiet Man [VHS]	A3MYKGD7VUA5CS	larry	Was trying to buy a DVD. Entered a search for a DVD of the Quiet Man.  Screen posted a list of options and I clicked on one.  When it arrived it wasn't a DVD but a VHS and one of very poor quality even though it was unused.	2.0	Wrong format	2012-04-14	0	0	0
6302320488	The Quiet Man [VHS]	A15Q7ABIU9O9YZ	Larry Scantlebury	"Actually in a manner of speaking, this movie is an extraordinary success in spite of John Wayne. I love the Duke even when he acted out of character, as a detective or a deep sea diver. But he probably owed his presence in numerous films because of his presence in life. He was, odd as it may sound, larger than life. Being an actor was something he did almost as a hobby. Here, he is surrounded by capable actors, Fitzgerald, Bond, Maglaglen, O'Hara, Mildred Natwick whom you recognize from a hundred different roles. So that he 'hung in' with that crowd, is a credit to him, to his loyalty and to his friendship, to his joie vivre. But probably not his acting skill.Everyone knows the story. Trooper Thornton, an up and coming U. S. heavyweight, kills a contender in the ring by accident but all the while as he, Sean Thornton, is pursuing money. So he quits the ring and journeys home to Ireland where his Mother was born.Later he falls in love with Mary Kate Danaher (O'Hara), sister of the ill-tempered Will Danaher and probably equally foul tempered. All is well. There is a certain lust in the air between Wayne and O'Hara, at least as much as you can imagine in the 1950's. Three second kisses and not many of them. That's until Will, the big oaf, refuses to give Mary Kate her dowery and without it, she comes to Sean with nothing and hates herself and him for it. But to fight someone for money, which is what Mary Kate wants her husband to do, brings back the haunting shame Duke feels for killing a man in the ring.All the good lines go to Fitzgerald who tells Mary Kate, ""Ay. You have the tongue of an Adder,"" and later, when he sees the broken marital bed not knowing that Sean threw Mary Kate in it and left in contempt of her mercenary wishes to sleep on the floor, Fitzgerald says, ""Homeric!""It's a great great movie that most of us have seen 25 times and still get a good feeling over. Don't believe the careful analysis and scrutiny of some reviewers. Well photographed, a lot of laughs, no sex and no killing. Can you believe it? 5 stars. See the ""Collector's Edition"" DVD (ASIN: B00006JMRD) for better color, no splotchieness and better printing overall. Larry Scantlebury"	5.0	Still an all-time great	2006-02-19	4	3	1
6302320488	The Quiet Man [VHS]	A4UZNZ53N91FQ	LauraAnn Cowan	This Wayne - O'Hara movie is a must-watch classic in our house, and has been for two decades.  The scenery, the townspeople, and the traditional Irish way-of-life transforms us all to the beautiful rolling green hills of our home country.	4.0	Always a St. Patrick's Day viewing for our family...	2014-03-19	0	0	0
6302320488	The Quiet Man [VHS]	A3G3FWQ45QLTI7	Lawrence A. Nelson	I've been waiting so long for a good copy of this film and finally it's here. I've seen this movie in every way from TV,VCR,DVD and it was all lacking of good resolution until now. This Blu-ray from Olive is 90% of what a Blu-ray could be but it is 300% better than any rendition done before. This is by far my favorite movie of all time and I couldn't be more satisfied. I am an avid collector of film from all decades(20's to 2013) and in my opinion there is no better movie. I've seen this movie 20 or more time and plan seeing it 20 or more before I die.	5.0	Olive Blu-ray 60th anniversary edition	2010-08-08	2	2	0
6302320488	The Quiet Man [VHS]	A1ME245UUIZ3A2	L.D.Black	I agree with others that this beloved movie, along with &quot;McClintock!&quot;, was transferred in *dreadful* manner to DVD, and would urge readers to keep or buy VHS (not Good Times version)instead of DVD. That said, I did love the special feature on &quot;Quiet Man&quot;, where they talk about the movie and people in it... it alone made &quot;QM&quot; worth it's $9.95 price I paid for it... so what did she whisper in his ear?  But am certianly glad I watched the DVD first, before I just went and threw out my VHS tape!	2.0	poor quality DVD	2004-06-21	10	8	2
6302320488	The Quiet Man [VHS]	A19MN5QRCE1SHU	LeAnn	I ordered this as a Christmas gift for my father as it is one of his favorite movies.  When we watched it, I was embarrassed to have given him a product of such poor quality.  The picture quality is horrendous - fuzzy, unclear, and dark all the way through the movie.  The sound skips repeatedly in the beginning of the film and toward the end, pink spots flashed on the screen in several places.  I could not have been more disappointed in the quality of this dvd and feel like the seller should be on the street hawking pirated wares.  They should be ashamed of charging ANY amount for this dvd.  I would NEVER recommend this product or this seller.	1.0	Very disappointed	2013-12-30	0	0	0
