asin	title	reviewer_id	reviewer_name	review_text	rating	summary	review_date	total_votes	helpful_votes	unhelpful_votes
6302320488	The Quiet Man [VHS]	A1RRZ1SHMWRSNM	dthardt	After reading the reviews I was skeptical about ordering it, but since it was my favorite movie I thought I would try it. I was surprised to find that the quality of the movie was much better than I thought. I enjoyed every minute and would recommend the blue ray dvd. The shipping was fast and hassle free.	5.0	The Quiet Man	2013-02-28	1	0	1
6302320488	The Quiet Man [VHS]	A3UC29EJF2ZQP5	Duckman	The Quiet Man is in every way a great film. Good script. Fine performances. Wit. Beautiful countryside. But this disc is absolutely dreadful. Poor color. Grainy image. I know of none worse.  SO disappointing!	1.0	A Great Movie - A Dreadful DVD	2009-06-05	1	0	1
6302320488	The Quiet Man [VHS]	A1OORFDEDLR91E	duncan k raymond	Nothing I write here would be news to anyone.  it's fun to watch and completely nonsensicle.  The best line of the movie is almost an aside: &#34;Incorrigible.&#34;	5.0	a good movie made better with Guiness	2014-06-10	1	1	0
6302320488	The Quiet Man [VHS]	A21MHTDV0JF8II	Dwayne Parsons	A classic to keep you watching year after year. Great story! Great price and the shipping was fast. I recommend this to anyone looking for a yearly rainy day story	3.0	John Wayne	2014-06-08	2	1	1
6302320488	The Quiet Man [VHS]	A1Q4MDF2BWZ2TX	"D. W. Osborne ""bored senior citizen"""	This may be the best movie they made together, Wayne and O'Hara.	5.0	The Quiet Man	2007-03-12	2	1	1
6302320488	The Quiet Man [VHS]	AMIAU78F3ZEQ1	"D. Youngberg ""Youngberg"""	Prompt delivery, satisfied with packaging.  This is a Christmas present so I am not able to review the movie yet!	5.0	Recent Order	2007-12-02	5	0	5
6302320488	The Quiet Man [VHS]	A1P4H8OWSS3ZP9	EBER SIMPSON	runs smoothly in all of my dvd players-steady color, a true classic of the screen, one of the Duke's best	5.0	classic	2013-10-04	1	0	1
6302320488	The Quiet Man [VHS]	A3M1EQ4DVV79LD	E. Conner	This is one of the best movies with 2 of the greatest actors together!  I love this movie its a most see.	5.0	Best Movie	2014-06-05	0	0	0
6302320488	The Quiet Man [VHS]	AR98DNZNXNF2R	"Ed Day ""amazon guru"""	Maureen O'Hara is the most beautiful. I have been to most all of Ireland. The people are fantastic, funny, & if & when I go back,{I am 75 yearsold} it would be most assuredly bed & breakfast. I read Maureen's book entitled Tis Herself & it was so straight forward. She is truly a fiesty lady.  Please give her my regards if you can.I love the Irish & would you believe I am of English  decent.Great movie! Good job, Amazon!	5.0	One of the 5 best movies II have ever seen!	2010-03-05	0	0	0
6302320488	The Quiet Man [VHS]	A2BM5O5F5V89DU	Ed	I had seen The Quiet Man some years ago. I loved it then and I do now. John Ford did a fantastic job with the dialogue and cast. John Wayne, Maureen O'Hara Victor Mclaglen,Ward Bond, Barry Fitzgerald all fit the characters perfectly. The Irish scenery around Cork was just stupendous.I plan to keep this so I can look at it again in March for St. Patrick's Day.	5.0	Fantastic!	2012-02-13	1	1	0
6302320488	The Quiet Man [VHS]	A2Z3SPX2Z4UCSR	Edith M North	One of my all time favorite movies, now in blu-ray, how could I go wrong?  Watched it as soon as it arrived.	5.0	Great Movie	2013-04-18	0	0	0
6302320488	The Quiet Man [VHS]	A2UXE3BFZC2PPF	edj@fishkind.com	Shame on Republic Studios for producing a sub-par DVD transfer on such a wonderful classic.  &quot;The Quiet Man&quot; deserved much better!If you already own the VHS copy don't waste your money on the DVD, unless  you're interested in Leonard Maltins' &quot;Making of the Quiet Man&quot;  featurette.	3.0	Great Film - Sub-Par DVD Quality	1999-04-15	3	3	0
6302320488	The Quiet Man [VHS]	A326Q6ZJBF34OU	"Edward J. Phelan ""Edd1gg"""	I have been looking for this item since the last one I had was borrowed and never returned. It is a classic film and timeless. A good wholesome story without the usual sex thrown in just for a shock factor.	5.0	The Quiet  Man	2007-09-26	2	1	1
6302320488	The Quiet Man [VHS]	A3KDBEPHBD5F4I	Edward P Pedersen	The re-mastering worked well on this classic movie.  Older DVD version has an interview with Maureen O'Hara that would have been nice in this version	5.0	Classic movie	2014-05-23	0	0	0
6302320488	The Quiet Man [VHS]	AU25FH3L5A7E0	elias	My favorite classic.	5.0	Five Stars	2014-07-02	0	0	0
6302320488	The Quiet Man [VHS]	A17BMUOBZ77ZBH	Elizabeth A. Tomlin	If you go to Ireland, the bride he sits on is still there!  This movie gets better each time you watch it.  The nuance and story are great.	5.0	It gets better each time you watch it	2013-12-30	0	0	0
6302320488	The Quiet Man [VHS]	A35EU2CBCOU8U0	Elizabeth Bradfield	Favorite John Wayne Movie...Look forward to this Irish classic for St. Patrick's Day and enjoy it every year.  Fabulous cast!	4.0	Yearly Ritual	2014-01-12	0	0	0
6302320488	The Quiet Man [VHS]	A3OG6E8HGPQGN5	Elizabeth Hargrove	Probably my favorite John Wayne movie. I understand that Ireland was not really like this but it is so entertaining.	5.0	John Wayne	2012-12-12	1	0	1
6302320488	The Quiet Man [VHS]	ARZFNDHI2NNMQ	Elizabeth Lennon	I did not realize it was in German, I thought it was in English, but apparently there was a code..  I could have returned it, but it would have cost me about $7 to return something I paid $13 for.	1.0	mistake to order	2012-11-29	3	0	3
6302320488	The Quiet Man [VHS]	ANW8FXY97FVAO	Ellen P. McGlynn	How can one resist this classic Irish tale?  This DVD is a must for every film collector's shelf.  A perfect way to celebrate St. Patrick's Day.	5.0	Classic	2013-05-05	0	0	0
6302320488	The Quiet Man [VHS]	A3QV9UY3RDCTIV	Ellina	My husband prefers the action/Western movies, but I love this one.  My copy was missing, and I don't know where it went!  So, buy a new one!	5.0	My personal favorite John Wayne movie.	2014-01-03	1	0	1
6302320488	The Quiet Man [VHS]	A34A09E5T6L9KM	Emmett Marrone	Amazon provides the movies without delay,technical quality is great, easy as 1,2,3.  If they have it, you got it. Fair price, great!	5.0	In my opinion this movie is one of his best	2014-03-02	0	0	0
6302320488	The Quiet Man [VHS]	A1ISY6ZI1JSSF2	"E. Ode ""pencil2paper"""	There are several &#34;What lousy image and sound reproduction&#34; quotes on this review list. They must be reviewing an earlier DVD version, because the quality of this release is terrific. We've watched and enjoyed the VHS version of The Quiet Man for years. It's a real treat to now see and hear so much we had been missing.	5.0	Terrific quality	2014-07-04	2	2	0
6302320488	The Quiet Man [VHS]	AO2D10XJ4KC9M	Eric	While it's a shame John Wayne didn't get nominated for his unforgettable performance in this film, it is without a doubt one of The Duke's greatest films and performances. Same could be said for director John Ford who utilizes Ireland's lush countryside to its full potential. A terrific film and one you must see before you die.	5.0	Another Duke Classic	2014-04-21	0	0	0
6302320488	The Quiet Man [VHS]	APM06HT7JIPZ5	"Erik Morton ""Erik Morton"""	"Well, here I go again, giving a less-than-ecstatic review for a renowned and beloved classic.  Now let it be stated outright that I am a lover of classic films (because, let's face it, movies used to be better . . . in most cases, a LOT better!), and I am a big fan of the filmographies of both John Wayne and John Ford.  But try as I might, I just couldn't get into 'The Quiet Man' as much as I had hoped.I'm not the sort of fellow who demands rapid-fire pacing in his movies, and I admire a film that has the confidence to take its time, but even so I found 'The Quiet Man' a little too slow-going for me.  The storyline was kind of repetitive, and only interesting for so long.  In a way, I don't think there was ENOUGH of a story.  Maybe the movie could have used a little trimming in the editing room, who knows, but I just thought the bizarre sexual politics between Wayne and Maureen O'Hara went on far too long, to the point where I was getting more frustrated than entertained.  And I realize that Ford may have very well intended for this to happen, to put the audience right alongside Wayne's character, who is a confused and bewildered by the customs of Irish marriage, dowry, etc., but again, it reached the point where I was no longer enjoying the movie so much.The best parts of the movie were the beautiful Irish countryside scenery and Maureen O'Hara.  As I read in another review of the film, in any other hands this character/film could have been a disaster, but she pulls it off, and it's a pleasure to hear her speak in her native Irish accent.  That said, her fine performance only carried the movie so far; after a while, her character dipped from complex woman set in her ways and conflicted by her feelings, to a shrill and irritating harpy.  As far as Wayne is concerned, this movie shows off both his strengths and weaknesses as an actor.  Sometimes he comes off as flat (which I must say, as much as I love the Duke, he was prone to do at times), and other times he conveys his emotions perfectly (like during his early courtings of O'Hara, or during the flashback boxing scene . . . the look on Wayne's face is heartbreaking).  Overall, it's not one of his better/best performances, but it's far from one of his worst.Ford once again fills his picture with a plethora of colorful supporting characters, but this time their antics only go so far to keep the film afloat.  And regarding ALL of the characters in the film, I may come off sounding a little dense here, but I found their motivations confusing.  I didn't understand why they did certain things, or acted certain ways (and it's not due to my relative unfamiliarity with Irish customs; I'd willingly admit if it was, but that has nothing to do with it).  I thought the movie was pretty weird, in this way.Now, up to this point I realize I've sounded quite harsh and negative towards this film.  But let me say that it's not a bad movie at all, far from it!  In fact, there are certain scenes in this movie that are so joyous, so wonderful, so thrillingly happy that I was almost moved to tears out of sheer delight (I'm thinking of the scene where Wayne and O'Hara steal away on a two-seated bicycle during their courting).  If the whole movie were like this, I'd give 'The Quiet Man' an easy 5 stars.  But as the movie goes on, the magic starts to dwindle.  And when people call this one of John Ford's best films (if not his VERY best), I can't help but scoff a little.  We're talking about the man who gave us 'My Darling Clementine,' 'She Wore A Yellow Ribbon,' 'The Searchers,' 'How Green Was My Valley,' and 'The Grapes of Wrath,' among many, many others.  'The Quiet Man' just doesn't compare.  And I'm not saying this because it's light-hearted entertainment (I'm not one of those snobs who thinks a movie can't be ""real art"" unless it's a seriouus, sober drama), I'm saying it because it's not as well-made a movie, plain and simple.In conclusion, 'The Quiet Man' is certainly worth seeing, and I of course acknowledge that it's one of those ""must-see"" films if you're a fan of either John Wayne or John Ford (or Maureen O'Hara, for that matter . . . dang, what a classy lady she was and is!)  What I DON'T recommend is going into it with the expectations you'd naturally acquire given the film's glowing reputation."	3.0	It's A Pleasant Enough Picture, But One Of Ford's Best?  No Way.	2010-07-15	7	1	6
6302320488	The Quiet Man [VHS]	AMMWUV6GR4FSA	Erin Harrison	Must see this film!  All-star cast and an one of the greatest directors of all time.  Simply cannot be improved upon!	5.0	CLASSIC!!	2014-04-22	0	0	0
6302320488	The Quiet Man [VHS]	A3PHTFPHX1HZIX	ERP	What can I say about one of my favorite movies? This tape played perfectly.Now I can watch The Quiet Man whenever I want to!	4.0	One of the Duke's finest movies	2014-04-23	0	0	0
6302320488	The Quiet Man [VHS]	A1B86SJOKGAZ3B	"E. Sadowski ""marine sis"""	"I just viewed this DVD and this beautiful film is truly restored in both picture and sound. I purchased this film directly from Olive Films after initially purchasing a different title from them. If you have the means to do so don't hesitate to purchase this film over the garish Artisan release with the colors bleeding and looking milky. Unfortunately, as others have mentioned Olive Films does not provide closed captioning for the hearing impaired. Aside from a booklet, the only other feature is a reycled ""Making of Quiet Man"" hosted by Maltin which I believe is from the Artisan release. Nevertheless, the booklet that is included gives some interesting information about John Ford and why he made this great film, that is, if you have a curiosity about film history."	5.0	Olive Films Truly Delivers!	2013-01-26	7	6	1
6302320488	The Quiet Man [VHS]	AUHVRUCP7PCFL	"Eugene Koh ""LA Reader"""	This movie was one of John Ford's most personal, and he struggled to find the funding to do it since the studios saw this as &quot;just another love story&quot;.  &quot;The Quiet Man&quot; is a fantastic love story, with wonderful scenes (the famous &quot;windy kiss&quot;), classic lines, and snappy humor.Be warned, however, that even in the &quot;Collector's Edition&quot; DVD, the picture quality is terrible, especially if compared with the restored &quot;Singin' in the Rain&quot;, which was released the same year.  It is grainy and sometimes blurry, and the color vacillates in intensity.  Compared with other Special or Collector's Edition DVDs of classic movies, this one was truly a disappointment.	3.0	Terrific movie, lousy picture quality	2003-06-13	17	14	3
6302320488	The Quiet Man [VHS]	AFN8UDLCSADQF	"FaeryTale ""Better shopper"""	It is a classic. Best John Wayne film in my opinion. I KNOW others will disagree. Still if you love John Wayne you should have this.	5.0	A must for anyone's DVD collection	2013-09-25	0	0	0
6302320488	The Quiet Man [VHS]	A38J5S8YUJ2TCS	Father Lonergan	We ordered this DVD after returning from a tour of Ireland where we visited the town of Cong where much of this movie was filmed. After the tour, the guide had some of the tour members dress up as characters in the film.  Having not seen this movie previously, we wanted to view the places we had seen as well as the plot and character development.	5.0	The Protestant Priest	2007-11-08	3	0	3
6302320488	The Quiet Man [VHS]	AF94NE6WRAWC7	"Felicia Christenson ""Fleabyte"""	This is my absolute favorite movie, Maureen O'Hara being the most gorgeous redhead on the big screen.  And John Wayne -- well!  Very funny, quite romantic, always good.	5.0	My favorite movie of all time	2006-01-28	1	0	1
6302320488	The Quiet Man [VHS]	A1OSORFH948MJ	F. Healy	Quite Man is by far one of my top-five films of all time.  I had the DVD versions and was disappointed in the soft picture, but adjusted to that and always loved watching the film.  When the Blu-ray was announced, I pre-ordered it and waited with great anticipation.  How disappointed I was with what came.... YES, the picture is sharper, but the colors just didn't come close to what the older soft DVD's had.  I know that virtually everyone who has the Blu-ray is terribly happy with it, but I'm not.	3.0	GREAT MOVIE !  So-so reproduction.	2014-02-09	1	1	0
6302320488	The Quiet Man [VHS]	A1P23YFEPWPUVU	"Film Score fan ""Al"""	I bought this blu-ray when I saw there was a restored and remastered version of the film available aside from the disasterous release from Artisan. I took the chance and bought this and the film looks fantastic. This DVD and Blu-Ray from Olive Films is a must have.	5.0	One of the greatest movies ever made in it's best transfer	2013-10-23	1	1	0
6302320488	The Quiet Man [VHS]	A28K1WWY0ML4ZV	FLHinWR	I saw this movie as a child at the theater with my parents and brother when it was first released.  It made an impression on the little boy then and continues to impress him as an adult.  The film is beautifully done on every level.  Acting, directing, photography, settings, costumes, and actually being partially filmed on location in Ireland only adds to its list of superlatives.  John Wayne fan or not....I think there is something for everyone in this wonderful film.....and Maureen OHara has never looked more beautiful.	5.0	Quiet Man One of Wayne's Best	2013-03-04	2	2	0
6302320488	The Quiet Man [VHS]	AX18FJVWPPBIN	flicka	Who hasn't seen this movie yet?  It's such a classic!  Wish they made more movies like this.  Hollywood's movies are terrible these days.  Loved the horse racing, the Irish pub scenes, the accents and of course, John Wayne always gets the girl.	5.0	Best Movie on Irish Soil	2014-02-24	0	0	0
6302320488	The Quiet Man [VHS]	ARDHQO0MLUCAR	"""floydianslipmsn"""	Very close to perfection except for the ill-considered scene in which non-diva Maureen O'Hara sings. AARRGGHH!! Aside from that bewildering moment, the remainder is nothing short of wonderful on all levels. The first kiss in Sean Thornton's cabin is quite simply one of the most singularly affecting visuals in the history of film. It is &quot;THE KISS&quot;. I have been puzzled for many years that that frame has not been commercially reproduced as a print to hang on living room walls in the homes of romantics everywhere.John Wayne's most important performance by a country-kilometre!One of my favourite quotations, &quot;Hope doesn't come from the way things are, or the way things could be--but from the way they SHOULD be&quot;, could have been used as a promotional blurb for this masterpiece.	5.0	In my &quot;top ten of all time&quot; list	2002-01-14	0	0	0
6302320488	The Quiet Man [VHS]	A2L08EO84H71T5	Fonda Mondoux	This was a very special gift for a friend and it was exactly what he wanted. He loved it. It is sometimes hard to get classics in such good condition.	5.0	gift for a friend	2014-02-14	0	0	0
6302320488	The Quiet Man [VHS]	AEXZYI9OA88VS	Forrest R. Martin	"The product is a direct copy of the VCR of this movie. Now because of this there are problems related to attempting to read it while on line. It constantly displaysan error of ""Disk not Found"". Once I did get it to work and read the disk correctly. Not sure why but it had something to do with a ""Blue Ray "" that was alreadybooted and running the movie related to that particular ""Blue ray"" disk. The final test was to see if I could read the ""Quiet Man"" from my off-line ""Blue Ray"" connected to my 50 inch screen. It booted quickly with no problems and I watched the movie. In short I have decided to keep "" Quiet Man"" as a backup to my original VCR of the ""Quiet Man"" They are of the same quality images. Simply a reproduction of the original.Forrest Martin(Not a purchase from Amazon)I suspect the problems reading the DVD were related to the software I was using. It works well with Windows media and Nero 12.Forrest Martin( I also own the VCR version that I intend to preserve.)A great picture!"	5.0	The quiet man from Amazon	2012-06-25	0	0	0
6302320488	The Quiet Man [VHS]	A3V1AHX8P4R839	"Forrest Wildwood ""Phil"""	Every St. Patrick's day this movie should be pulled out and played.  John Ford directed John Wayne and Maureen O'Hara in this romantic comedy.  Ford takes a sentimental trip down memory lane to his homeland and it never looked so green.  Barry Fitzgerald plays the impish..you'd swear he's a leprechaun..matchmaker to comic perfection.  Wayne plays Sean Thornton returning home to buy the old homestead and put down roots.  He meets the curious townspeople and awakens this sleepy hamlet by not always sticking to the 'proprieties'. Besides being American and new to town, this 'Wild Colonial Boy' has plans.  Buying 'White O'Mornin'..his old homestead..from the widow Tillane gets him in the book with Will Danaher (Victor Mclaglen) and soon the love of Mary Kate (Maureen O'Hara).  This eventually builds to the knock-down brawl that resolves all the issues.Ford used his stock players to round out this film...Ward Bond, Ken Curtis, etc.  This movie has many facets, and fortunately for us, Ford keeps it lively...he didn't delve too deeply into these.  There is the IRA, Catholics vs Protestants, and the mixture of a Gaelic patriarchal society.  These Sean has to face and adjust to in order to win his wife as well as his place in this society.There is a reason that this movie is on many lists of great films.  This is a well acted and directed movie.  One that deserve a place in any and all collections.	5.0	Happy Saint Patrick's Day..and no patty fingers if you please!	2006-03-17	3	3	0
6302320488	The Quiet Man [VHS]	AW003H7Z3OCHA	forrie	John Wayne and Maureen O'Hara provide with their best chemistry in this &quot;Irish&quot; John Ford classic film.The DVD is remastered and the colors are full.This film is skillfully cast with all familiar faces.  A nice story of a Yank (Wayne) who returns to his roots in Ireland to meet a beautiful spinster girl (O'Hara) while trying to be accepted by a not so friendly neighbor.  John Wayne pulls this comedy, love story brillantly do to his &amp; Maureen O'Hara larger than life personalities &amp; chemistry.  The climax of this 2 hour classic is the 8 minute tradtional John Wayne fist fight over Mary Kate (o'Hara).This is a classic movie to be enjoyed over and over.  Great value and fun to watch.	5.0	Wayne &amp; O'Hara at their best.  This a magical classic film!	2001-07-12	4	3	1
6302320488	The Quiet Man [VHS]	AW00OHXP7JPJF	Fort Knox	Considering my previous DVD copy looked like a 3rd generation VHS bootleg I am THRILLED the Quiet Man has finally been properly restored. BEAUTIFUL!  Thank you Olive Films for undertaking this task.Only downside is no subtitles.Note- This review is for the 60th Anniversary Special Edition. Avoid all other versions.	5.0	Finally a decent restoration	2013-04-28	0	0	0
6302320488	The Quiet Man [VHS]	A1G1UEVCSVL77L	Forty Ponce	I found the movie to be exactly what I remembered it to be.  I thoroughly enjoyed re-visiting an old favorite and a true classic work. I found it extremely easy to find what I was searching for and then to order same.  I had excellent follow up on the sale as I was told when it would ship, then when it did ship.  It was received on time, in good condition, which thououghly pleased me.	5.0	The Quiet Man	2012-09-10	0	0	0
6302320488	The Quiet Man [VHS]	ALV99ID3UKXF1	Francesco	I couldn't watch the whole thing.  It's just a mix of annoying characters, bad acting and dumb plot.  It just didn't do it for me...	2.0	Just bad cliches	2014-01-08	4	0	4
6302320488	The Quiet Man [VHS]	A1EMT1Q6WZ223A	Francoise Dubois	A wonderful movie. People in general don't know this side of John Wayne, but this is really a classic.	5.0	Five Stars	2014-06-30	0	0	0
6302320488	The Quiet Man [VHS]	A3BH49ZKESHDID	Fred Camfield	John Wayne started out with Stagecoach and ended his career with motion pictures like True Grit.  He is probably most strongly identified with westerns, and possibly with various war pictures made in between, but he also made this motion picture along the way.  It is a delightful motion picture about a man escaping from his past which he tried to keep secret, but finds himself wrapped into Irish customs to win the woman he loves.  His brother-in-law to be wants to fight him for the dowry.There were good performances all the way around, and some Irish scenery along the way.  It could give you an urge to move back to the Old Sod.In regard to the negative reviews, people should be careful of the source and the version.  There are a lot of cheap knockoffs for popular motion pictures, many manufactured overseas.  Amazon, unfortunately, lumps all the reviews together.	5.0	Something different from John Wayne	2010-08-17	1	0	1
6302320488	The Quiet Man [VHS]	A3JFDEHVXXNXM4	FredColo	This movie is one of John Wayne's best. With the feisty, beautiful Maureen and allthe great Irish characters.  One of John Fords best movies and a personal labor ofLove for his Ancestral Homeland. The movie is a 5 star on a 5 star rating.The quality is excellent, the best put out so far. I wish it were the whole original moviethough.	5.0	Great movie, good BluRay	2014-04-13	1	0	1
6302320488	The Quiet Man [VHS]	A3VKOE9NHRP2KI	Frederic Vatter	My family are big fans of John Wayne. I recieved a ton of cheers when I told them that the DVD had arrived.We had a great evening watching it.	5.0	Frederic Vatter	2011-10-25	0	0	0
6302320488	The Quiet Man [VHS]	AZ2FXSGN98MPA	"FredFloB ""me"""	love it on of my favorite movie, great color / I have to keep writing but what else can you say?	5.0	love it	2013-12-09	0	0	0
6302320488	The Quiet Man [VHS]	ALEL5356DKMTC	fred	This Blu ray is a NEW release of a classic movie. Don't confuse this with older Dvd releases. This has been remastered and the quality is excellent.	5.0	NEW	2013-01-24	11	11	0
6302320488	The Quiet Man [VHS]	A3TY4IEZC2RJ4U	Fred Henning	For years we had to put up with an extremely poor quality Quiet Man VHS and the DVD was no better.This Blu Ray is the movie, color, detail, sound.If you thought you liked the Quiet Man, as a movie, you need to see it as it was originally filmed.This Blu Ray version is the answer	5.0	finally we can see the REAL movie	2013-08-22	1	1	0
6302320488	The Quiet Man [VHS]	A3IPTK36H9HJI0	frpaho	Thank you Olive Films. Finally a perfect copy of John Ford's Quiet Man. The video is pristine, the audio is crisp and in sync. John Fordwould love it. Thanks again Olive Films, you made a longtime wish come true.	5.0	At last the Quiet Man as it should be seen.	2013-04-19	1	0	1
