asin	title	reviewer_id	reviewer_name	review_text	rating	summary	review_date	total_votes	helpful_votes	unhelpful_votes
6302320488	The Quiet Man [VHS]	A3RYKSD37T2RSU	Patty K.	Another great irish film. John Wayne, Maureen O'Hara at their best! Love the scenery, been to Ireland to see location shots, can't get enough. May have to see the film a few times to understand all the Irish humor! Thankfully watched it with my Irish born hubby, who explained all the little nuances!  Classic Movie!	5.0	Great actors, great scenery!	2014-02-06	0	0	0
6302320488	The Quiet Man [VHS]	A22NETJF86YHW7	Paul Herrera Jr.	I've loved this movie since the first time I saw it on tv so when I saw a copy of the Collectors Edition DVD, I bought it, boy was that a mistake.  The quality of the video and sound were horrible so when I saw the Blu Ray 60th Anniversary Special Edition, I was gun shy.  I finally broke down and purchased it and have kicked myself since because the visual quality is awesome and the sound seems improved.  If you love this movie, as I do, you owe it to yourself to buy this blu ray version.  You will not be disappointed.	5.0	Get the Blu Ray	2013-04-12	0	0	0
6302320488	The Quiet Man [VHS]	AC7MP9R2FKEAI	"Paul Miller ""___[_]D___"""	"John Ford's real name was Sean O'Feeney and this film set in Ireland is one of his best. Sean Thornton (John Wayne) returns to Ireland to live after living most of his life in the states. He sees Mary Kate (Maureen O'Hara) from a distance and is instantly smitten.  Later they marry and trouble brews when her brother refuses to pay the dowry. Sean doesn't care, but to Mary Kate it is a point of honor. While in the states Sean was known as Trooper Thornton a boxer who accidently killed a man in the ring. He would rather not fight the brother over the dowry ,but you guessed it, he does and it is one of the greatest fist fights on film. This film has great comedy scenes like the priest trying to land his great fish, Sean walking  Mary Kate home from the train station, and the old man,(Ford's brother), on his death bed leaping up when he hears the fight.Maureen O'Hara had family in Ireland and John Wayne brought his with him, in fact there were family all over the set with a few making it into the film as extras. Most of the actors had worked together a year earlier making ""Rio Grande"" with Ford because the studio wouldn't make ""The Quiet Man"" without a western that would make money first. All the film Studio executives felt ""The Quiet Man"" would never make money.The film won two oscars including best director and needless to say was a box office success."	5.0	Quiet Man	2004-03-14	4	2	2
6302320488	The Quiet Man [VHS]	A1EOHWOOB00TPS	Paul WA	This movie is a classic. The actors in the movie are all top rated actors. The story line is very good. This is a movie that you can sit down with children and watch. I would highly recommend it for their own collection. Movies of this quality are very few and far between.	5.0	The Quiet an DVD	2013-02-10	0	0	0
6302320488	The Quiet Man [VHS]	AG8RH9WMBWL3T	P. Blackwell	A different kind of John Wayne movie. Very good story with a great cast and wonderful locations! A must for John Wayne collectors!	5.0	John Wayne and Maureen O'Hara	2007-02-11	1	0	1
6302320488	The Quiet Man [VHS]	A26CJ89ET1JV7W	P. C. Davis	Watching this movie on St Patrick's day has become a tradition for me. It's a good old movie that puts you in the right mood.	5.0	Must watch on St Patrick's day	2014-03-21	0	0	0
6302320488	The Quiet Man [VHS]	APTK2UNJGPQEV	P. Clarke	I've been searching for a decent quality copy. This copy of the movie is the best I have found to date. The two releases I purchased, from different publishers, prior to this version were blurry and the colors were awful.  I'm very pleased with this edition.	5.0	Best Quality	2014-02-24	0	0	0
6302320488	The Quiet Man [VHS]	AIYR30N6DLWZ3	P. Damm	You know, you think it's so funny, you quote what they said in your own situation?  Really funny, romantic and a glimpse at life a long time ago.	5.0	When of those movies you'll quote from!	2014-01-28	0	0	0
6302320488	The Quiet Man [VHS]	AQXH3UEF9MV7A	pdiddle53	Best John Wayne movie ever.  Maureen O'Hara is a stunning beauty.  Irishmen dislike this film for the exact reasons I love it.  We all know it is over the top stereotyping, but that is the fun of it.  It makes me love Ireland even more.	5.0	Is this a courtin' or a donnybrook?	2013-12-24	1	1	0
6302320488	The Quiet Man [VHS]	A396N47M3RYBKI	Pen Name	Have loved this movie since first seeing it in highschool and now I'm super ecited to be sharing it with my husband - who's enjoying it as well.	5.0	Have loved this movie since first seeing it in highschool and ...	2014-07-11	0	0	0
6302320488	The Quiet Man [VHS]	A1T11F9D71S1QA	Peter Green	Being of Irish decent I wanted to watch this movie for years. It was great. Laughed so much through the entire movie I had to watch it twice.	5.0	best John Wayne movie ever	2013-10-28	0	0	0
6302320488	The Quiet Man [VHS]	A17BT73RVRQYSP	Peter Ingemi	That will be the result of seeing easily one of the top 5 movies John Wayne ever made.  The only gun is a starting pistol.  The horses are either drawing wagons or in the big race.The plot is simple John Wayne (Sean Thornton)returns from America where he was raised to settle back in his old home town in Ireland.  He runs afoul of Victor McLaughlin (Red Will Danaher) over a piece of land, but also falls for Danaher's sister Mary Kate (Maureen O'Hara).This simple plot is overshadowed by an event in Wayne's past that shapes and scars him.  It isn't introduced at first but soon takes over the picture propelling it to its climax.The supporting cast, many of which we have seen many times before together (McLaughlin, Natwick, Shields, Bond et/all) all give top notch performances as usual.  The subplot involving McLaughlin &amp; Natwick shines bright and Barry Fitsgerald adds the right bit of blarney to the package.What makes this very pleasant move even more appealing is the 2nd level of supporting players and the community (who doesn't know Wayne's secret) that they play.  That community opinion and its consequences steers the picture, but only by fleshing out that community can it work.  We care about what these people think becasue we like these people.  From the Bartender, to the Engineer to Father Paul we meet the people of this village.I think the appeal of this picture is that community.  The idea of everybody knowing everybody else.  It contributed to its success at the time of its release when it was the reality here to some degree.  It contributes to its success now as we miss that same security.You also can't go very wrong when you pair O'Hara the ultimate strong woman with Wayne the ultimate strong man.  Only Hepburn &amp; Tracy can equal them here.Whatever the reason this picture is worth your time and your money.	5.0	The wearing of the grin.	2002-02-10	11	9	2
6302320488	The Quiet Man [VHS]	A2HQSHQUYT80W6	peteydummy	Of course, this movie is an awesome, old-time family favorite.  The DVD version was frustrating; it was like watching a worn-out VHS tape on a HD screen.  Finally, you can appreciate the stunning scenery behind the characters.  When Trooper says, &#34;Is that real?&#34; I can see whom he is talking about, oh, and that white blur in the middle of a green blur was a cottage!  Only his life's ambition, I can actually tell what it is now when he points to it.	5.0	finally, I can see Ireland!	2014-06-28	1	1	0
6302320488	The Quiet Man [VHS]	A1D2Z6UOCT9456	"P. Ferrigno ""firehouse444"""	From all reports &quot;The Quiet Man&quot; was a very personal and passionate undertaking from director John Ford, and his company of players (most of Irish ancestry)....and what sweet fruit their passion bore...This is a film of such warmth, tenderness, humour and beauty that it just sparkles from beginning to end.Irish-born, American boxer Sean Thornton (John Wayne) returns to his place of birth after accidently killing another man in the ring. Seeking to find peace and happiness in the lush green country side, Sean is enraptured with the fiery Mary Kate Danaher (Maureen O'Hara in a wonderful performance) but incurs the wrath of her bully of a brother Red Will Danaher (Victor McLaglen) because of Thornton's purchase of local land.  Failing to abide by the customs of Irish courtship as advised by resident matchmaker Michaleen Flynn (Barry Fitzgerald) and Father Peter Lonergan (Ward Bond)...it's not long before the whole county is in a spin about this big Yank in their midst !!Amidst the lopsided courtship and Red Will's refusal to pay the dowry, Thornton &amp; Danaher square off in what must be the most entertaining and longest on screen fights in cinema history...much to the amusement of the entire town that turned out to watch !!&quot;The Quiet Man&quot; is such a wonderfully enchanting film, that it is as enjoyable for all ages today, as it was nearly 50 years ago. Truly, a film for those young at heart and those who can appreciate such a warm hearted and lovingly prepared ode to the magic of Ireland.	5.0	John Ford's gentle and loving salute to Ireland.......	2000-11-21	8	7	1
6302320488	The Quiet Man [VHS]	AYXC0BI77LVIT	Philipgstekel	If you're reading this review or any other for that matter; you must have seen (and probably loved) this movie. There are over 400 reviews of this movie and I won't waste anyone's time rehashing the plot, performances of this terrific labor of love shown by John Ford and his ensemble of actors/characters.For whatever the reason, no one seems to want to clean up this movie and bring it up to 2012 standards for picture and sound.  TCM (Turner Classic Movies) shows this movie on occasion and with all of the time and effort they put into restoring movies and then selling on DVD, the movie shown on their channel, is the same LOUSY print that has been available for sale for many years.Reviews from 2004-2012 have called for some kind of revamping of this movie and nothing is being done!!!  My guess: whoever owns the rights to this movie is not putting forth the effort and trust to allow anyone to redo this movie and give it the treatment it deserves.If you're thinking about buying a DVD version of this movie thinking that it will be of better quality.......FORGET IT !!!Wait for it to show on Turner Classic Movies and save yourself some $$$.Once this movie get transferred on DVD with the kind of treatment it deserves, then by all means.......buy it!!!  But in the meantime......save your money.I'm sorry to say that apparently restoration of this movie has fallen on deaf ears (and blind eyes).Too bad.......and sad.	5.0	Loved the movie...hate the transfer	2012-06-26	1	1	0
6302320488	The Quiet Man [VHS]	AO8OWTUTC0OPK	Philip Marlowe	The print here is really bad. The colors bleed and seem to change before your very eyes.  I don't know if the problem is with the original print or the transfer, but I can only imagine that the collector's edition will improve.	1.0	Wait for the new version	2002-09-18	18	16	2
6302320488	The Quiet Man [VHS]	A2XR3JNKBZITS1	Phillip	The movie is great, and the dvd transfer is mediocre to awful.................can we please get this movie on blu-ray asap??	5.0	Perfect candidate for blu-ray	2011-08-02	1	1	0
6302320488	The Quiet Man [VHS]	A1AHSVSHQ7MBO2	Phyllis Cragg	Liked the movie, however I do not like being told how many words to write.  That's why I don't do reviews often	5.0	NICE	2013-03-27	0	0	0
6302320488	The Quiet Man [VHS]	A1T3RM4UHLO3MM	P. Kenny	I bought the Collector's Edition 2 years ago for $10.99 and it was distributed by Artisan Home Entertainment.  I seen now the price is $21.99 and distributed by Paradise.  That is an awful big increase from two years ago.  Don't know anything about Paradise, but the distribution by Artisan was absolutely wonderful.	3.0	Price???	2012-06-16	0	0	0
6302320488	The Quiet Man [VHS]	A8QS9BTR7LTUM	P. Lowis	We will be taking a trip to Ireland in September and so thoughts of The Quiet Man movie came to mind.  We ordered it on Amazon.  The delivery was prompt and just as promised.  The product arrived in good shape and the quality was great.  The movie was just as good as we remembered.	5.0	Taking a trip down memory lane . . .	2011-12-07	3	1	2
6302320488	The Quiet Man [VHS]	A3GISRNT7BJEO8	"Pop ina Bottle ""Never argue with an idiot. th..."	This seems to be the only movie that the Duke made without being a western or war theme. it's a great movie filmed on location in Ireland. I really like the storyline and the acting is pretty good. There are violent scenes so may not be appropriate for the young, but teens on should enjoy this movie.	5.0	A classic movie...	2007-03-12	2	1	1
6302320488	The Quiet Man [VHS]	A1IG1ZWKQNTNUS	preacher_man_d	What a blessed joy to see this film with such clarity.  The original DVD version was blasphemous with its horrible quality.  However, with this Blue Ray edition, I can enjoy this rare gem of a movie with my children and relish in the nostalgic memories of watching it with my mother many years ago.	5.0	I didn't have to get my Shillelagh out	2013-06-14	2	2	0
6302320488	The Quiet Man [VHS]	AL6C4JU8AC1H2	Priscilla Savary	I love Ireland.  So I was bound to love this movie.  I have been in love with this movie for several decades now and enjoy it just as much today as I did the first time (okay, maybe the second time.  The first time is special.)	5.0	All Things Ireland	2014-01-14	0	0	0
6302320488	The Quiet Man [VHS]	A3POJJ7H47QUKY	Private	One of the greatest movies of all time (AFI and others agree), but ....The quality of ALL the existing DVD versions in the marketplace are far inferior to even the print used in repeated airings by Turner Classic Movies (TCM).Several years ago, the UCLA film restoration geniuses created a wonderful new print from the originals that has been seen in Los Angeles and Ireland.The ownership of the home video rights has passed through several corporate hands.  Right now, Lions Gate owns these rights.  Until such time as a Blu-Ray version comes out using the UCLA restoration, I would avoid buying this movie on DVD and simply watch the superior version shown by TCM.Updated 2013 -- the BluRay has finally been released.  Problems solved -- it is a HUGE improvement in picture quality.  Olive Films did a great job with the restoration.  Go with the Blu-Ray version (the dvd version is nearly unwatchable).	1.0	Wait for the UCLA restoration to be released	2008-07-15	11	9	2
6302320488	The Quiet Man [VHS]	AF3HN9UFXMKB2	"""pspa"""	For those of us whose image of John Wayne is the man delivering one liners such as &quot;You see them Indians across the hill, they ain't dressed for Halloween,&quot; be prepared for a shock.  In this epic movie about an American boxer who kills a man in the ring and goes to Ireland to find himself, Wayne delivers one of the great performances ever seen, displaying an astonishing range of emotion and acting ability as, despite his vow to renounce violence, he is inevitably forced to fight for his bride, the ravishing Maureen O'Hara, whose brother opposes her marriage and refuses to give her her inheritance.  Magnificent acting by all involved.  The fight scene between Wayne and Victor McLaglin and their ensuing reconciliation is sheer genius, and the movie also has wonderful moments of comedy provided by the great Barrie Fitzgerald.  I put this one in my all time top ten, and I am sure you will too.	5.0	John Wayne's greatest movie	2001-03-04	12	12	0
6302320488	The Quiet Man [VHS]	A2CZ1J9UULBEG0	Rainbow Angel	Quiet Man is my favorite John Wayne movie. It's a great love story, beautiful setting, well-written. The only slugfest is friendly. Other than the one scene with his saggy man-boobs, you don't really get the impression that John has aged much. I have quoted Little Michaeline Og Flynn (please accept my apologies if I've misspelled) many times. It's a friendly movie with a great cast. My husband is the consummate John Wayne fan, and he likes this movie, too.	5.0	Beautiful setting, well-built characters, fun family movie	2014-07-08	0	0	0
6302320488	The Quiet Man [VHS]	A5CU1N0KGG7HE	Randee Baty	Having just returned from a vacation in Ireland, we were anxious to watch The Quiet Man which my mother told me was one of my dad's favorite movies.  What a treat!  John Wayne is handsome and appealing, Maureen O'Hara is beautiful and tempestuous, the villagers are Irish to the core but it's the scenery that steals the show for me.  It's exactly what we saw in our week of driving around beautiful Ireland and brought back great memories.  Everything about this movie is fun.  Even the brawls are amusing to watch.  A true classic in the best sense of the word!	5.0	A pure delight!	2014-06-11	1	1	0
6302320488	The Quiet Man [VHS]	A2HY9KXPWJCVWO	Randy Emrick	I really enjoy breaking this movie out around St. Patrick's Day.  You don't have to be Irish to enjoy the excellent acting, beautiful scenery, and charming story lines.	5.0	A Favorite for St. Patrick's Day!	2013-01-06	0	0	0
6302320488	The Quiet Man [VHS]	A2YMQ1OE2NEY51	randy	This movie had everytning. Action, romance, comedy,dark moments. The supporting cast was fantastic.	5.0	This was the greatest Wayne movie ever made.	1999-11-16	2	2	0
6302320488	The Quiet Man [VHS]	A1SVXJZ3386U2D	Randy Keehn	When fans of John Ford debate his greatest film and when fans of John Wayne debate his greatest film, &quot;The Quiet Man&quot; is surely mentioned with prominance.  This movie is a terrific look at rural Ireland and its' archaic customs.  John Ford has never disguised his love of his ancestrial home and this movie is as good a testament to that love as any movie he has ever made.  It takes place in a small rural setting where a stranger (John Wayne) shows up one day.  The stanger reveals that he is Sean Thornton who has come home to his birth place.  He immediately falls for Mary Kate Danaher only to find that her brother, Will Danaher, is the town's tough man.  Sean also finds out that the ways of Ireland are not the ways of the USA where he was raised.  Sean has a secret that he keeps that he keeps to himself.  It is a secret that keeps him from fighting the assertive Will Danaher.  Through some conniving help from the local clergy, Sean is able to gain the hand of Mary Kate.  However, her expectations of Sean and his failure to deliver makes this a marriage in name only.  The only way to win her heart and solve his problems with his reputation is to fight his new brother-in-law.  What should he do?Each step of this story introduces us to characters, customs, music, and other aspects that bring out the Irish flavor.  We may not agree with the customs but we certainly have fun seeing how Sean Thornton is confounded by them.  Fans of Wayne will have a special appreciation of his outstanding preformance.  He is subdued but not beaten, confused but not lost.  He is excellently matched with Maureen O'Hara who brings a brilliant performance as Mary Kate Danaher.  She makes for a strong woman in a movie that demonstrates women's weak status in the culture.  Andrew McLaglen is also excellent as the imposing Will Danaher who takes a step back for no one.  One of the great qualities of a John Ford film is the stock acters that fill the many supporting roles.  In this movie we are treated to a number of great supporting preformances highlighted by the acting of Barry Fitzgerald, Arthur Shields, and Mildred Natwick.The cinematography is terrific, the scenery inviting, and the music is superb.  Lucky is the person who has the soundtrack of this movie.  The music is enchanting from the beginning to the end.Over the years I have met my share of John Wayne detractors.  As yet I have not met one who won't secretly acknowledge that they loved this film.  This is a movie that can be enjoyed by the whole family and it is one that can be watched over and over.	5.0	Outstanding!	2002-12-15	1	1	0
6302320488	The Quiet Man [VHS]	A2180F4F8WOX1X	"Ray L. Schwartz ""pathfinder -luke 3:5,6"""	i just purchased this and i guess they must have heard your reiviews because the picture quality was great .just got back from ireland and i visted cong the town that they filmed the quite man in , great place to visitvisit early the quite man house closes around 4pm	5.0	quality picture	2011-08-22	0	0	0
6302320488	The Quiet Man [VHS]	A1UK5F0GBM455H	Rayniece	I had read reviews forn others on the remake quality.  This version is much better than the other digital formatted special edition.  Shipping was very quick.	5.0	The Quiet Man	2013-06-03	0	0	0
6302320488	The Quiet Man [VHS]	A2JDG1XNDPU0UM	R. Bryant	The best John Wayne movie made. Great story line, outstanding group of supproting actors and fabulous music. One of those movies that you will enjoy watching over and over.	5.0	My Favorite Wayne Movie	2013-12-08	0	0	0
6302320488	The Quiet Man [VHS]	A3J5DQSG5ZXAII	Readingisgood	If you like Mclintock you will like this movie. Funny, Serious and fighting in this John Wayne Movie. I loved It and had a good laughs.	5.0	Great Movie	2014-06-07	1	1	0
6302320488	The Quiet Man [VHS]	AC5X6Z0WOEZFT	R. E. Crocker	"I understand there are so many old films literally falling apart because the film they are on is made of nitrocellulose which is only stable for a certain period ..... if I was rich, I would be involved with something like that. You would think that with a classic movie like this, someone would have done a digital touchup/remake but apparently not. The product reviews on Amazon of the anniversary edition and the blu-ray edition and in fact, all the editions from that one company, suggested that they were terrible and a sham. I will just have to keep my fingers crossed that someone will salvage it soon. I am a John Wayne fan. If you will read a little about the man, you will see that his father was a pharmacist ...... they had to move to California from a midwestern town due to the father having a lung condition. Wayne came from modest means. Playing football for USC, luck turned his way when Tom Mix got him a summer job as a prop man in exchange for some football tickets. He met John Ford (whose real name was Irish) and they hit it off. The rest is history. Many didn't like Wayne's conservative political stance, but my readings show him to be a generous man who told thetruth as he saw it. He didn't take himself too seriously. When asked to run for President of the US, he declined, sayin he didn't think the American people would take an actor too seriously. As for the characters he played, every actor has to have an identifiable and likable personality ...... a schtick as it were. Wayne's was forward and pushy but his roles called for ""hero types"" ........ not trembling cowards. I fought a 40 year addiction to cigarettes ...... when I came along, everybody smoked including my doctor. I'm glad the young people today know the perils of smoking and the officials of our country should never give up on emphasizing the negative effects of all drugs. Apparently,Wayne could not control the cigarettes and they are probably the cause of his death. Maureen O'Hara ........ I love women and I fell in love with her the first time I saw her ........ and I love redheads. I saw where she revisited Ireland a few years ago at the age of 90, I believe. She seemed afraid. I am in my 60's now and getting old sucks. Watching good people, ....... pretty people ...... people with manners and character, get old is like watching your parents or yourself getting old. Sad. The quality of this dvd is not up to a good VHS but its apparently all that is available. Chances are, it was copied from a VHS so if you can find it on a good condition VHS tape, you might be better off. Not much definition ........ you have to crank the volume up ....... and in a couple of places for a very short time, the characters move too fast like an old black and white Charley Chaplain film. Still, what are you going to do ? I love this movie so much, I would buy/watch it in almost any condition. This is a feel good movie ..... you feel better after you've watched it than you did before. Best wishes to everyone. .."	4.0	Waiting For A Digital Update	2014-01-19	2	2	0
6302320488	The Quiet Man [VHS]	AIBAYOIGYDQDZ	Redtop4656	Movie arrived quickly and in condition promised.  Will buy from this seller again!  Thanks so much!	5.0	Amazon	2009-11-29	0	0	0
6302320488	The Quiet Man [VHS]	A2TY359PR45ATP	"R. Edward Merrell, Jr. ""emerrell2"""	John Wayne as a romantic lead...and he handles it so well! The chemistry between Wayne and Maureen O'Hara as the female lead is palpable and their romance lights up the screen. O'Hara and Wayne appeared together in several films; this was their best collaboration...my opinion of course. The support cast, especially Ward Bond, Barry Fitzgerald and Victor McLaglen - McLaglen in particular - are superb. John Ford's direction is outstanding...this is one of his best films, especially outside the Western genre. If you've never seen John Wayne outside his usual western, military, he-man vehicle, you need to see this one. It will convince you I think, that Wayne's acting ability was so much more than one-dimensional, and so much more than he was ever given credit for...and Ford had a knack of bringing out the best in the Duke. This movie features one of Wayne's best performances...one of the best from the fiery Irish redhead too. You need to add it to your list of must-watch movies if you haven't seen it	5.0	John Wayne as a romantic lead!	2014-03-01	0	0	0
6302320488	The Quiet Man [VHS]	AOX03PELX0RQJ	R. E. Mayer	Another light-hearted movie that's super cute! My husband even liked it and he usually only watches action. Who doesn't love watching a husband getting all frustrated over his immature, naughty wife! And my does she get hers! lol	5.0	So funny!	2009-09-29	1	0	1
