asin	title	reviewer_id	reviewer_name	review_text	rating	summary	review_date	total_votes	helpful_votes	unhelpful_votes
6302320488	The Quiet Man [VHS]	A1R8EN6NXZWO55	"A. Bost ""Angie"""	This movie shows you a different John Wayne, not just a cowboy. I can watch it over and over	5.0	Favorite John Wayne Movie	2007-05-14	2	1	1
6302320488	The Quiet Man [VHS]	A3O7KHK3CJYU02	A Customer	If you want this DVD, get the VHS video. It is the same thing. Why they did not use widescreen, I do not know. The Irish scenery alone screams for widescreen. Production value is the same as the VHS. And the beautiful  soundtrack is in mono. There is no gain to go to DVD. It gets 2 stars  because of the two stars, no other reason.	2.0	Disappointing for DVD	1999-12-27	16	9	7
6302320488	The Quiet Man [VHS]	A1E0B8W1VT3FBB	a friend	Has always been a favorite of mine and now I can travel with it anywhere.  Good movie to lift the spirits.	5.0	The Quiet Man	2014-02-08	0	0	0
6302320488	The Quiet Man [VHS]	A3DE6AOGI4LY03	Agooddane	I'm not going to bang on about the movie..  It is great and speaks for itself.  But let's talk about the blu ray edition.  Amazing transfer quality of this movie left my amazed.  The definition is sharp and clear, and the colour, while appearing super-bright in the first few minutes due to memories of this movie viewed on TV over the years, soon becomes comfortable.  Watch the Extra feature doco for a bit of interesting history, but also to compare the old image quality.  It's a great classic movie, and it has now received the care it deserves to bring it to a new audience.	5.0	Review of blu ray edition - brilliant!	2013-12-06	1	1	0
6302320488	The Quiet Man [VHS]	A2JCC3T8LT6PGU	A Hatcher	Great picture BUT, Olive Films, which  produced this blue-ray version of the QUIET MAN, has NO regard for the hearing impaired or hard of hearing in that they fail to have closed caption capabilities. I have viewed many Olive Film movies and never do they consider the good people having hearing problems. Would not recommend it for that reason alone.	2.0	The Quiet Man  not for the Hearing Impaired.	2013-08-28	5	4	1
6302320488	The Quiet Man [VHS]	A16MHYWQ23GPHF	ajwa	It took sixty years but at last we have a beautifully presented copy of one of hollywoods best films.For years i have wasted money hoping to get a good print of this film,now thanks to olive films my quest has ended, from the wonderful cover art to the print itself this release is pretty near perfection .One of the delights of the film is the setting,now perfectly crisp and clear,you can see all the detail in glorious colour.Throw out all those other mediocre copies of this classic and enjoy this..you might however like to keep the disc that has the maureen ohara commentary,picture is terrible but she is great!	5.0	at last ,at last!!	2013-02-04	1	1	0
6302320488	The Quiet Man [VHS]	A3CSRP3P4U9HI	Alan R. Holyoak	It's amazing to me that John Wayne did what I would consider his best work not in westerns or  war movies, but in this romantic comedy set in Ireland.A yank former-boxer, John Wayne, meets  and is greatly impressed by the beautiful Irish country girl, Maureen  O'Hara, but he simply doesn't understand the traditional rules of courtship  and marriage in Ireland in the early 1900s.The casting is superb, and  the supporting actors make the whole thing come together.  O'Hara's  on-screen brother is a good match for Wayne during their monumental  scuffle.  There's nothing quite like a good old knock down drag out  Hollywood enhanced fist fight is there? And all for love, face, and  honor.Top-notch entertainment. An immensely watchable movie that  husbands, wives, and children can enjoy.5 stars all the way.Alan  Holyoak	5.0	John Wayne at his best!	2000-06-30	12	12	0
6302320488	The Quiet Man [VHS]	A27111MBYMB4MI	al arnold	my wife and i like to watch the quite man every st Patrick day , as we eat our corned beef and cabbage.	5.0	St. Patrick day tradition.	2014-04-14	0	0	0
6302320488	The Quiet Man [VHS]	A2NPWTSSJ083BI	Albright Arms	This movie is a must for the John Wayne enthusiast.  Set in the beautiful county of Ireland, with great across and actresses. A must watch.	5.0	a John Wayne must view---	2014-02-17	0	0	0
6302320488	The Quiet Man [VHS]	A2QASAMGT1UYZ3	Alexis_Ray	"*****5 stars for the filmHaunted by an incident that happened in the ring, American boxer Sean Thornton (John Wayne) returns to his Irish birthplace, seeking only his roots and a quiet, peaceful life.He soon falls in love with the beautiful, tempestuous Mary Kate (Maureen O'Hara). She is equally taken with him, but won't marry without the consent of her stubborn, blustering brother, Will (Victor McLaglen), who disapproves the match.With the help of a well-intentioned scheme arranged by their friends, Mary Kate gets her brother's permission and Sean and she wed. Relationships spoil soon after, however, when Will refuses to pay the rightful dowry. Sean doesn't care, but Mary Kate is outraged and wants Sean to have it out with Will.Time and again Sean backs down - determined not to use his fists - his inner tension building the whole while. But eventually he will have to decide between losing his wife's love and respect and facing his greatest fear.This was an important and personal project for John Ford (whose real name was Sean O'Feeney). That his heart and those of his cast members were in what they were doing shows through. The fact that much of the film was shot on location in Ireland (on location shoots were somewhat unusual at the time) also adds an authentic flavor.Barry Fitzgerald was at his comedic best here, and Ward Bond's performance as a priest has several simply unforgettable moments.The Quiet Man is a charming classic and among Ford's best (in fact, it won him an Oscar for Best Director). It's funny, romantic, and always entertaining. It also features an exuberant score (courtesy of Victor Young) and one of the longest and most memorable knock-down, drag-out fights ever committed to film.-DVD-Two different editions of this DVD have been released with almostidentical packaging. Be careful which one you buy! (I wish I'd known this).""John Wayne Collection"" edition (*1 star)This is the one I bought (ISBN 0-7820-1057-1, ASIN: B00000I1KV). It has ""John Wayne Collection"" printed on a green band at the top. Its special features include ""The Making of the Quiet Man"" documentary & the theatrical trailer. DON'T BUY THIS VERSION, PLEASE. The sound is decent, but the picture is absolutely terrible: blurry and full of splotches, almost unwatchable.""Collector's Edition""Apparently, the sound and picture quality are okay on the ""Collector's Edition"" DVD (ASIN: B00006JMRD), whose special features include Commentary by Maureen O'Hara, the theatrical trailer, ""The Joy of Ireland"" documentary with Maureen O'Hara, ""Remembering The Quiet Man"" Montage, and ""The Making of The Quiet Man."""	5.0	Wonderful Film - Be Careful Which DVD Edition You Get	2004-08-19	579	562	17
6302320488	The Quiet Man [VHS]	A3T0BA4P3G5JPG	Algernon Wentworth	The picture quality of this DVD transfer is such an absolute disaster that I feel I should be entitled to get my money back.I am not a rich man and so I don't like throwing my money away on garbage! I will never watch this DVD because it is an eye sore.	1.0	immensly dissatisfied	2003-04-19	16	13	3
6302320488	The Quiet Man [VHS]	A1FI7FIJIQXBOS	"Alice A. Chrisman ""Proud Nana"""	"My husband and I loved the movie ""The Quiet Man"" and were pleased that the used copy we purchased was in perfect condition. We've watched it over and over and looked for sights we saw when we visited Ireland."	5.0	Great movie	2007-01-17	1	0	1
6302320488	The Quiet Man [VHS]	A10G7EX57SQMZJ	aliciagelnett	Great movie.  We really enjoyed it. Fun to watch on St. Patrick's day for our Irish heritage!  Love both main actors as well.	5.0	Ireland forever!	2014-03-16	0	0	0
6302320488	The Quiet Man [VHS]	A1NCZ6O4GP210A	"ALK ""loves to learn"""	May seem corny - but it is wonderful.	5.0	Old time classic!	2014-07-01	0	0	0
6302320488	The Quiet Man [VHS]	A38EHQ7HD06G10	Allen Witbeck	The quality of this DVD does a huge disservice to the movie. The coler is too saturated, actually making John Wayne's gray hat look like a rainbow at times. Burn holes in the film and magenta tags in the corners were not  removed. If you must buy it, don't pay the full price.	3.0	Great movie - Terrible DVD	2000-01-07	15	13	2
6302320488	The Quiet Man [VHS]	AV0BE6LXTJ7UO	Amazon Customer	Best brawl scene ever filmed.  So much fun ro watch every St Patrick's Day or whenever! Definitely a must see with John Wayne and Maureen O'Hara and their cast of regulars (Ward Bond, Victor McLaglen,  plus  Barry Fitzgerald - what fun!)	5.0	St Patrick's Day tradition!	2014-03-25	0	0	0
6302320488	The Quiet Man [VHS]	A16BTOQ5L4FH3C	Amazon Customer	Bought this item as a gift. My husband and I love old movies. This one is one of his favs. Great product, price, fast shipping.	5.0	Quiet Man thumbs up	2014-01-21	0	0	0
6302320488	The Quiet Man [VHS]	A324EU0DXD8SRG	Amazon Customer	I don't care John Wayne's acting style, but this movie really shows his ability to do more than a good westerner. A bonus is that you can see that he truly could act. The story is delightful and the acting sublime. Enjoy around St. Patrick's Day or anytime for pure entertainment.	5.0	Don't Like John Wayne You Will In This Movie	2014-05-13	0	0	0
6302320488	The Quiet Man [VHS]	AZQTME5FRWK63	Amazon Customer	It was as good as the original. Wonderful movie. Dvd worked fine. Picture and sound were great.Glad I bought it	5.0	Awesome	2014-01-20	0	0	0
6302320488	The Quiet Man [VHS]	A347J4SA61HBIQ	Amazon Customer	John Wayne will always be remembered for this one. Funny, great entertainment, great characters, with laughable situations. One for the whole family!	5.0	No Explanation Required	2013-12-11	0	0	0
6302320488	The Quiet Man [VHS]	A1ZSKEBRPX9ZQV	Amazon Customer	One of my all time favorite movies and really good quality of film! Nice to be able to watch without needing a vcr!	5.0	oldie but goodie	2014-06-24	0	0	0
6302320488	The Quiet Man [VHS]	A226566N55UXK9	Amazon Customer	The 60th Anniversary Edition of John Ford's classic, The Quiet Man, entered with a soft whisper like the evening breeze in Innisfree. It is the delightfully pleasent story of an American come home to Ireland to forget his troubles. But he lands in more of them when he meets and marries Mary Kate!	5.0	The Quiet Man Quite a Success	2013-03-22	0	0	0
6302320488	The Quiet Man [VHS]	A3HDJDAVMS4CPJ	Amazon Customer	There's a reason this movie was nominated for several Oscars - its perfection from start to finish. A must see Classic.  What are you waiting for? WATCH IT NOW!	5.0	One of the best movies ever made!	2014-03-19	0	0	0
6302320488	The Quiet Man [VHS]	A3VNUVGMT4QKW5	Amazon Customer	This is my favorite movie of all time. I was delighted to find it. I have already enjoyed it several times.	5.0	I like it	2013-12-19	0	0	0
6302320488	The Quiet Man [VHS]	A30WAX1L1G81CY	Amazon Customer	This is one of my favorite movies and the HD is incredible.  Well worth the differential betweeh the Blu ray and standard version.  I also agree, the older reviews detailing the HD quality of a previous release should be taken down as they confuse the question.  There are no significant issues with the currently offered version ( Olive films 5/2014).	5.0	Blu ray quality was far better than I'd hoped	2014-05-12	0	0	0
6302320488	The Quiet Man [VHS]	ADXQB1XZMZL1J	Amazon Customer	"This was John Ford's personal pet project and he hired two of the greatest movie actors of the time to be in it.  The story is great and the scenery majestic.  Unfortunately, you would not be able to tell the later from the DVD.  The image quality is horrible as many other have mentioned, but to add insult to injury, I have not been able to get the Close-Captioning to work.  I've tried on multiple players and TVs and every time I get a ""Feature not available"" message, or some version thereof.  It is shocking to me in this day and age that a DVD would not have CC."	1.0	DVD Does Not Do Movie Justice	2012-03-04	0	0	0
6302320488	The Quiet Man [VHS]	A22NP9VAPBA8OC	Amazon Customer	Watching this in HD is a whole different movie. Wonderful. The Duke and Maureen O'Hara at their best. Timeless Irish humor.	5.0	Excellent Movie	2014-05-05	0	0	0
6302320488	The Quiet Man [VHS]	A2FBJTZVMM2SPR	Amazon Customer	By far one of john Wayne's beat movies	5.0	great movie	2014-07-09	1	0	1
6302320488	The Quiet Man [VHS]	AULVPU9J2YQJL	Amazon Customer	"For those who don't really dig John Wayne's ""shoot-em-up"" westerns, this is a refreshing drama which is set in Ireland.  The Irish charm of scenery and culture is breath-taking and touching.  Wayne plays a son of an Irish immigrant turned prize-fighter, who after accidentally killing a man in the boxing ring, gives up the fight-game and retires to his beloved birthplace which was evidently immortalized by his mother's continued remembrances of ""the old country"".  Maureen O'Hara plays the Irish lass who captures his heart and is just as tough and stubborn as he is.  They are a perfect match of which the entire village is in hearty agreement - except her brother.Feminists won't like this movie by director John Ford as there is old-world male dominance prevalent in this movie.  The fight scene at the end is probably the fist-fight of all time which ""wallers-down"" most of the countryside.  The ""Fighting Irish"" are reputed to love a good fist fight and here it is shown to be true by the fact that almost everyone in the village is at the event and even people from the surrounding villages are enroute by the bus-loads.Colorful characters, old-world charm, splendid and uplifting Irish folk songs, a great supporting cast, and romance decorate this 1952 favorite of mine.  Watch closely for the guy playing the accordion in the pub.  He is Ken Curtis who played, Festus, on the western TV Series, Gunsmoke.  He also sang with the Sons of the Pioneers way, way, back when - but he isn't even in the credits.Want to be taken back to yesteryear?  This is it - and you'll love it -- if you're not a feminist.I have had no problems with this DVD.  I'm sorry about the guy who got a dud.  He should have exchanged it."	5.0	John Wayne with a heart	2007-08-17	2	1	1
6302320488	The Quiet Man [VHS]	A2ATIIXNM1UKF4	Amazon Customer	This and Robin Hood were two of the very few films I've had an irrational desire to actually own rather than simply rent. I read the earlier reviews with care, and thought I was getting a good copy, but this Collector's Edition seems to have been the one copied from a poor VHS tape. I am perplexed how it can even be sold. Maybe one day it will come out in a revived copy, in which case I will buy it again.	1.0	The Quiet Man	2008-07-14	3	1	2
6302320488	The Quiet Man [VHS]	A3KAVP9JOM4P73	"Amazon Customer ""Movie Nut"""	I love this movie, plain & simple. I have been waiting for the blu-ray forever, but because they were too cheap to add subtitles I will not buy it no matter how good the picture quality is. Companies like Olive Films who discriminate against the hard of hearing & the deaf should be put out of business. This might sound harsh, but more & more it is becoming hard to find good movies & TV series that have caption or subtitles added. It's very frustrating to us.	1.0	No Subtitles, no money	2013-01-23	18	5	13
6302320488	The Quiet Man [VHS]	A3UXXMJO51KWAX	A. Mitchell	Found the picture for the most part was dark making it hard torecognize the players at times, especially in low light times.Other than that the sound was great.Although it was not the best quality picture, I decided to keepthe movie anyway.	2.0	The Quiet Man	2007-02-19	1	0	1
6302320488	The Quiet Man [VHS]	A1FHVNZSGULP8J	"&amp;#34;Cat&amp;#34;herine ""Kindle Addict"""	I love the film. I won't go into the film because I can't fault the film.  I CAN fault whoever transferred this film to DVD.  The picture quality is horrible.  I had to change the settings on my television just so the actors were in colors that are found in nature.  But the picture was blurry, there were skips and on occasion magenta splotches would show up, particularly in the portion leading up to the fight. I had a VHS edition that was better than this travesty.	1.0	Terrible DVD	2010-03-08	1	0	1
6302320488	The Quiet Man [VHS]	A1CEWA3OSCBSVC	A Music Fan	"This film by far is one of my all time favorites. Just simply put, a GREAT movie. There's been more than enough praise given to this movie, I just wanted to comment on the newly released blu-ray edition. After watching the blu-ray version and then comparing it to the Artisian dvd release, it makes you realize how bad the Artisian release really was visually. This movie now ""jumps"" off the screen with it's brilliant colors and detail. You can now clearly see such details as telephone wires, the nice tweed material of the Duke's jacket, rain drops on the faces of John Wayne and Maureen O'Hara, print in the newspaper, and the lines on the character's faces. A job well done by Olive. Unfortunately there aren't any new extras and even one seemed to get dropped all together (Maureen O'Hara interview). My only gripe is that I wish they could've come up with some new extra bonus material. A definte worth while upgrade of the movie. Highly recommended!!!!!"	5.0	New Blu-ray is finally here!!!!!	2013-01-24	10	9	1
6302320488	The Quiet Man [VHS]	A3CEDZIJ3A6RHF	Amy Preis	arrived quick and safely- the collector's edition packaging is great. One of my favorite movies ever and just in time for St Patty's day.Thank you!	5.0	will shop again	2014-03-17	0	0	0
6302320488	The Quiet Man [VHS]	A2U4UOBD0705V4	"AndrewCF ""Andy"""	Olive Films' release of John Ford's masterpiece, The Quiet Man, is a qualified success.  In comparison to the previous DVD release, there is nothing so annoying as to hamper anyone's enjoyment of the film.  In the previous version we had to deal with maddening scratches, reel change marks, and washed-out Technicolor.  If Technicolor is washed out in certain movies, it's done for aesthetic reasons (The Godfather, for example).  This new release displays on the whole brighter and more saturated color; it is unfortunate that the saturation comes at the cost of graininess, which is not a by-product of classic Technicolor processing.  While skies still look more pastel than deep blue, the improvement on the last version is palpable.  Of course, the &#34;risks&#34; of outdoor and/or location shooting include the capricious nature of the climate; Ireland is not immune to fogs, clouds, and rain. In such conditions, matching shots are especially difficult.  Take the horserace in this films, where wind and clouds threaten to limit takes and matching shots.  In the previous DVD, this scene is a nightmare: dark and light, sunny and cloudy. Carefully timed, the restorer can help mitigate extremes, but none of that is evident in the previous version.  Of course, for crucial scenes, Ford had to rely on matching the outdoor light in the studio, where he has optimum control.  One must remember that remastering is not the same thing as restoring.  A company like Criterion, working with universities and other organizations, must invest time and funding to accomplish the task of recreating the vision closest to the filmmakers.'  But I judge this present version a success, since it allows the view to enjoy the film without distractions.	5.0	Not perfection but closer	2013-04-27	1	1	0
6302320488	The Quiet Man [VHS]	A1X3JR9NE13YX8	AndyR	Buy the Blu Ray only. If you like the movie, as I do, you will not be disappointed. Note: All the reviews for VHS, DVD and Blu Ray are lumped together (same reviews, same number of reviews). Since the picture quality is the issue, they should be separate. In any case, I've owned the VHS, Collectors Edition and now the Blu Ray.  Surprisingly, the VHS was better than the Collector's Edition DVD but the Blu Ray is by far the best.	5.0	The Best Version Yet - Blu Ray - 60th Special Anniversary Edition	2013-04-09	0	0	0
6302320488	The Quiet Man [VHS]	A1MTDY860A2GWG	Angela Culloty	"This has to be my favorite John Wayne/Maureen O'Hara movies.  It has everything - comedy, drama, romance, music. The collector's edition is wodnerful because it has so many bonus features. There's a commentary with Maureen O'Hara, a documentary (""The Joy of Ireland""), theatrical trailers, ""The Making of The Quiet Man"", cast and crew information, and so much more! They actually filmed this on location in Ireland, which can only make the scenery more beautiful. The movie and the DVD are fantastic!"	5.0	Funny, Romantic, Enchanting - One of Ford's Best!	2004-11-17	6	4	2
6302320488	The Quiet Man [VHS]	A1F2DLM1AFKUT2	"Angela P. Deppeler ""emme"""	This is a classic. I love it and recommend it for anyone wanting to just enjoy a good, old fashioned movie.	5.0	i love this movie	2013-03-22	0	0	0
6302320488	The Quiet Man [VHS]	ABRQG5OBH6HVG	Angel M Gutierrez	After so many years of dissapointment, a great transfer is finally made of this great film. Kudos to Olive Films !	5.0	Finally a deserved excellent transfer of this great Masterpiece	2013-02-18	0	0	0
6302320488	The Quiet Man [VHS]	A3QUGLP4UYG9CG	Angie L	John Wayne and Maureen O'Hara,what a combination.They were so good opposite each other and I  have a few other movies that they had starred in together.	5.0	Brilliant twosome	2014-06-24	0	0	0
6302320488	The Quiet Man [VHS]	A3E7BUKS0X034Z	Anita Dalton	This story means so much me. I use to watch this every St Patrick's day with my late father. This movie makes me feel closer to my Father. I look forward to visiting Ireland.	5.0	CLASSIC LOVE	2014-04-15	1	0	1
6302320488	The Quiet Man [VHS]	A2KNG1EXQNDVMJ	Anita J.Fife	I ordered this for my husband.  I ended up watching it with him and we both enjoyed it very much.  He wanted to add it to his collection of VCR's of western movies and favorite actors.	5.0	John Wayne fan	2013-11-16	0	0	0
6302320488	The Quiet Man [VHS]	A28RQ4KQWJLSVG	Ann  Duncan	I can't be quiet about how much I love this film! I love John Wayne and Maureen O'Hara together, this dynamic duo out do themselves in this wonderful story about love and wanting to escape your past.	5.0	The Quiet Man	2014-05-12	0	0	0
6302320488	The Quiet Man [VHS]	AFG6XBWJAOZJ9	annepenkethman	Came broken.	1.0	One Star	2014-07-11	0	0	0
6302320488	The Quiet Man [VHS]	A2NW09CKM0K3W	Annette Stokes	Because I saw this movie years ago with my father and kit has been a favorite ecer since..This a lot better than  some of the movies they have nowadays.	5.0	The Quidet Man	2013-02-23	0	0	0
6302320488	The Quiet Man [VHS]	A1S2XP90G5ZT3M	Anne W	Great old John Wayne movie, perfect for curling up with a bowl of popcorn on a rainy afternoon. Pair with Darby O'Gill and The Little People for a quick Irish getaway :)	5.0	Classic John Wayne	2014-02-03	0	0	0
6302320488	The Quiet Man [VHS]	A2S6ATNLVXLWME	Anthony Duca	This one is a pure favorite, and can make anyone whose not Irish wish they were.  With Ford and Wayne's group of regular co-stars like Maureen O'Hara and Ward Bond, this movie just shines, and you'll be laughing at the end.  Get this one if you don't want to wait until the next St. Patrick's Day to see it on TV.	5.0	What can I say?  The greatest Wayne movie ever made.	2002-08-14	2	0	2
6302320488	The Quiet Man [VHS]	A1J3F6PS1T1OAU	Anthony Judice	John Wayne as a boxer come to visit his roots in Ireland??  One of the best movies and a must have for collectors - Irish or not.  Maureen O'Hara, Ward Bond, Victor McLaglen head up the stellar cast in a St. Paddy's Day classic.	5.0	A minor classic	2012-12-12	1	0	1
6302320488	The Quiet Man [VHS]	A3CMVSO5IUPY5K	Antoinette Marx	I never get tired of seeing Maureen OHara and, John Wayne as a duo in the movie.  They are such great actors.	5.0	My review	2014-01-23	0	0	0
6302320488	The Quiet Man [VHS]	A1DD15RXIXWENM	"Anton Beat Riess ""Toni Riess"""	I really would like to buy this movie but like all OLIVE released movies - they don't have any subtitles for hard/deaf hearing or foreign speaking people. A BIG shame in the 21th Century	1.0	Good movie, no subtitles	2013-01-21	23	7	16
6302320488	The Quiet Man [VHS]	A2F0FR99HMA9P6	appraiserdude	You can't go wrong with a wee bit of Irish philosophy and happiness.The on-screen chemistry between John Wayne and Maureen O'Hara is quite possibly unmatched by any other male/female duo in movie history.	5.0	An Irish Classic	2014-03-20	0	0	0
6302320488	The Quiet Man [VHS]	A38A18CWUATGT7	A Reader	"This review applies to the ""Collector's Edition DVD"": Four+ stars for the movie, which - while it has little to do with the Ireland of history, has much to do with the Ireland of fable. John Ford and his remarkable cast capture the spirit of that latter Ireland and spread it across the screen. Wayne and O'Hara are close to perfect, and the star-studded cast play their fabled Ireland beautifully. About the only quibble I have with the movie itself is that during the great donnybrook the film was speeded up to make the action faster, and it's pretty obvious.A star or so off for the DVD transfer, where the green and red saturation are a bit high, and a number of single-frame artifacts  were left in. The first can be controlled with a bit of video adjustment, and the second isn't all that distracting - but why not do it right?I'd stand in line for a newly-mastered DVD."	3.0	An Irish fable well told	2006-08-29	5	4	1
6302320488	The Quiet Man [VHS]	A16E372IF63EEB	armandcat	If its a &#34;special edition,&#34; then &#34;Special&#34; begins with video&sound reproduction. This copy is very far from being equal in quality to a &#34;movie&#34; it's not even as good as the original transfer. Feh!	3.0	Poor Vid Quality	2013-03-11	3	0	3
