asin	title	reviewer_id	reviewer_name	review_text	rating	summary	review_date	total_votes	helpful_votes	unhelpful_votes
0767002652	Upstairs Downstairs - The Premiere Season [VHS]	A13NO6KGWSFIGZ	"New Orleans Artist ""New Orleans Artist"""	I'm sorry, I just couldn't get too far into this.  It began with constant bickering of the kitchen staff and, for as long as I watched (which, admittedly was too long), that's all there was.  It annoyed me and I quit it.  Everyone talking at once, snapping at each other, is maybe real life 'downstairs', but I don't find it entertainment.	2.0	Too much chatter.	2014-01-15	0	0	0
0767002652	Upstairs Downstairs - The Premiere Season [VHS]	A2A8J1N23BUM70	New Yorker	I guess I should say right off that I didn't enjoy what I saw of the originalseries. But this sequel caught me from the first moments. It seems to have amuch wider range of personalities than the first series did, including a RoyalHighness and a Nazi bigwig. There's a very strange, comic, but also scaryepisode where the new tenant at the famous house needs to get the Nazi out ofa fancy party and the only thing they can think of is to have one of thefootmen drop a tray of drinks on him. Did they ever get that crazy in theolder Upstairs, Downstairs? And they really struck gold in letting Eileen Atkinsplay one of those meddling, decadent society dames who, oddly enough, alwaysmakes more sense than everyone else, in her dryly sarcastic way. The only problemwith this series is that it's too short. I could really have used an endlessmini-series approach. In short: witty, adventurous, and a trifle odd.	5.0	Classy, Fast-Moving, Fascinating	2012-01-13	0	0	0
0767002652	Upstairs Downstairs - The Premiere Season [VHS]	A3L1N36J3BOL9V	"Neysa Zurkammer ""Neysa Z"""	Love this series.  I had not seen it before and am really enjoying watching it with my Roku.  Looking forward to the rest of the seasons.	5.0	Upstairs, Downstairs	2013-12-28	0	0	0
0767002652	Upstairs Downstairs - The Premiere Season [VHS]	A9OA37A9MWNGL	nick atlas	Great series. Only thing I didn't like was that they got rid of a lot of characters pretty quickly...some without explanation (gap between season 1 &2)	4.0	Great series	2014-02-25	0	0	0
0767002652	Upstairs Downstairs - The Premiere Season [VHS]	ACRAUC7VMSCTB	nick	really enjoyed this series. looking forward to the next season. I would recommend this to others also. keep up the good work	5.0	love amazon prime	2013-09-25	1	0	1
0767002652	Upstairs Downstairs - The Premiere Season [VHS]	A2SW9Z1NGQ86BD	Nicky	For it's time, it looked at some unspoken rules, issues, taboos, and the social structure of the british patriarchy. A good trip down memory lane to watching with my mum while growing up.	3.0	Memory lane	2013-12-03	0	0	0
0767002652	Upstairs Downstairs - The Premiere Season [VHS]	AB0Y5GSW7NOFA	Nicola J Desmarais	Great episodes, great acting, great story lines! Upstairs Downstairs is a fun series for the whole family to watch because while teaching values, it is also put together extremely well.	5.0	Awesome!	2013-01-19	0	0	0
0767002652	Upstairs Downstairs - The Premiere Season [VHS]	A1G0PGVPGID7FL	"""nicoleck"""	This set is wonderful because it contains episodes that weren't originally shown on PBS and some of my favorites.  Upstairs, Downstairs is one of the  best TV dramas ever made. The writing, directing, and acting are amazing.  These episodes are early, but the themes, ideas, fascinating stories and  characters begin here.	5.0	Wonderful beginning to one of TV's greatest series	1999-10-30	8	7	1
0767002652	Upstairs Downstairs - The Premiere Season [VHS]	A1OHDOE9YGBRCL	Nicole T.	I started watching this because it was recommended since I love Downton Abbey. The concept is somewhat the same but the characters are flat and it's not as well written.	2.0	Ok	2014-01-30	0	0	0
0767002652	Upstairs Downstairs - The Premiere Season [VHS]	A3VF20ZD4K7JPZ	Nigel	This seems to be a spin of downton Abby but different enough not to get boring.  Strong cast of characters.  Shows a strength of the people during difficult times.	4.0	Good show	2014-03-28	0	0	0
0767002652	Upstairs Downstairs - The Premiere Season [VHS]	A3SY5I30FJ4ZBT	Nina	Looking for movies that compare with Downton Abbey and found this. Not as good as DowntonAbbey but it will work.	5.0	Good Movie	2014-02-17	0	0	0
0767002652	Upstairs Downstairs - The Premiere Season [VHS]	A1ZCQBXTIJS8H4	"Nita ""nita"""	These stories are wonderful...I can't get enough!  The story takes you into another time and place.It really is a classic.	5.0	This is a classic...	2013-05-25	0	0	0
0767002652	Upstairs Downstairs - The Premiere Season [VHS]	A36NORYLRIBXD0	NJ Bill	Very well done, but just too depressing. Every episode I've watched so far has been a real downer. Memo to John Hawkesworth: Good things do happen to people sometimes.	3.0	A Real Downer	2012-09-23	5	1	4
0767002652	Upstairs Downstairs - The Premiere Season [VHS]	ACOMLR6641TUH	Nnurmala	I can't stop watching this show its so interesting similar with dowton abbey in a different way !!All the drama and the character, nothing to complain about.	4.0	Love this show !	2013-06-20	0	0	0
0767002652	Upstairs Downstairs - The Premiere Season [VHS]	A15KDBQRMZKU34	"Noelle L. Lew ""Noelle18"""	Good show. Remembering .... It was around when there was not much else on the tube ... at least not in Europe .... Very British !	5.0	reminiscing .....	2013-03-24	0	0	0
0767002652	Upstairs Downstairs - The Premiere Season [VHS]	ANDN9BU8C5XWN	Noell Rose	I have not seen the earlier series but if, as many have said, it is better than this, I certainly plan to watch it. As such, I had no preconceived notions about what it should be but love British Period Drama and was not disappointed by this short series. It was interesting and adult-themed without being offensive. I look forward to the next season! Thank you, BBC!	5.0	Enjoyed it immensely.	2011-02-18	51	38	13
0767002652	Upstairs Downstairs - The Premiere Season [VHS]	A29X74IXF1A5B	NORA WENDEL	This miniseries so far has been good.  Good character developments and an interesting  story line.  A nice view of the how the two classes work together.	4.0	Pretty Good	2014-01-19	0	0	0
0767002652	Upstairs Downstairs - The Premiere Season [VHS]	A2K62IHNYD9CBR	norma jean kringer	I started out thinking this would be like Downton Abby and there were similarities, but, advancement in video and costumes have made Upstairs, Downstairs too dated to enjoy.	2.0	too old for me	2013-05-30	1	0	1
0767002652	Upstairs Downstairs - The Premiere Season [VHS]	A3O6I427WFHPUD	Nothing sound	Besides the story lines not necessary for this classic which ruined it for some and almost me, it captures the Chamberlain administration perfectly and the plight of Jews trying to escape in an understated manner. Why though every story line has to have a gay line to it is beyond me.	4.0	History within	2014-01-04	1	1	0
0767002652	Upstairs Downstairs - The Premiere Season [VHS]	AAG1S0Q51KNO3	noyindebbie	After hearing my coworkers rave about this show, and knowing how much I love BBC stuff I blindly bought this, even without reading one review. Lesson learned! 25 bucks for 3 episodes, really?I'm so irritated I spent the money on this crap. If the show would have been good, I  might have been able to let this go, but the show sucks. Maybe I have to high of expectations after Downton Abbey, I don't know, but this is a huge disappointment.	1.0	disappointment!!!	2012-10-26	3	2	1
0767002652	Upstairs Downstairs - The Premiere Season [VHS]	A21JQCOR51YX0E	Npolefox	acting is superb, characters may be rich Upstairs but not above the characters Downstairs.  Believable storytelling and constant great acting	5.0	Entertaining and fun!	2013-11-19	0	0	0
0767002652	Upstairs Downstairs - The Premiere Season [VHS]	A3N237JWF0ANNE	"NRNH ""Nancy in NH"""	This sequel was watchable and entertaining, but fell short of the original. I will say the production values are much better, since the original was done in the '70's. I'd recommend it to friends, though.	3.0	Not as good as original	2013-02-26	0	0	0
0767002652	Upstairs Downstairs - The Premiere Season [VHS]	A3D78WM9IRLY0C	N Turner	I should have done the research before I started watching this series.... apparently THIS is the last season as the BBC didn't renew the show for any more seasons after this one.  I very much enjoyed the series and am disappointed that this was the end.  It was an excellent filler for me in between seasons of Downton Abbey.I am happy to say though that with the end, it didn't really leave you with any cliff-hangers... it just left you with the option to make your own ending for each of the characters.	5.0	Don't get hooked!	2013-05-07	0	0	0
0767002652	Upstairs Downstairs - The Premiere Season [VHS]	A3PN1QUCSR586D	Nunya Bin-nes	Watched season 1 and 2 and then got the 2x4 across the forehead when we found out they discontinued the series.	5.0	The more the characters are developed the more you get sucked in.	2013-08-23	0	0	0
0767002652	Upstairs Downstairs - The Premiere Season [VHS]	A3FEWDKMOF9WCX	NYC Dubious	Upstairs Downstairs is an immensely absorbing soap-opera set in the declining decades of the British Empire. The original producers expent much effort on historical detail, regional accents, and such things, and the acting is superb. Really, it's a joy to have these episodes on tap in DVD form. But the Arts and &amp; Entertainment Television Network did very little work past transfering these shows to disk - there are no subtitles or chapter divisions, so you might as well be watching them on VCR.	5.0	(no title)	2002-05-23	3	3	0
0767002652	Upstairs Downstairs - The Premiere Season [VHS]	A697WSC7EN7VH	"O. Hassanain ""meems"""	despite some of the negative reviews her, I do have to say that I enjoyed every minute of this series. The actors are fabulous and the story is magnificant. If you love period pieces then you'll surely love this one.	5.0	new and improved	2011-12-04	5	5	0
0767002652	Upstairs Downstairs - The Premiere Season [VHS]	A1RN7EXKP3CPPD	okeemom	The characters seem so real.  You keep watching to see what happens next. I highly recommend this show to everyone!	4.0	Keeps you coming back for more	2014-03-25	0	0	0
0767002652	Upstairs Downstairs - The Premiere Season [VHS]	A1OJ4DT82V6EJ9	Organgrinder1010	This season offered quite a few changes from the original. The acting &#8212; for the most part &#8212; is very good. The sets are lavish and slavishly of the period represented. It appears that no expense was too great for the producers. The plots, however, are the weakest link, implausible and rather off-the-wall. As soon as I began to care for a character some twist rolled in that strained credulity to the breaking point, destroying the totally-involved mood I enjoy with truly great dramatic productions. Nonetheless I like the series enough to have watched it twice &#8212; the second time a binge-watch of the entire production over the time span of two evenings. And I may yet return for a third visit, at least to some episodes.	4.0	Distinctly different from the earlier series	2014-06-05	0	0	0
0767002652	Upstairs Downstairs - The Premiere Season [VHS]	A2H650P49NTKMR	"Orville B. Jenkins ""Research Guy"""	I liked the attention to historical details, as it brings to life the era between the World Wars.  The story starts slowly and it was hard to maintain focus.  Compared to Downton Abbey, it lacked energy and pace.  The characters do develop fairly well and have sufficient depth, but I had trouble become enthusiastic about the series.	4.0	A bit slow, but well-defined historically.	2013-07-30	0	0	0
0767002652	Upstairs Downstairs - The Premiere Season [VHS]	A3BY87Z1Y8JC2N	P4E	I loved this show.  The only reason I gave it four stars is because I was really disappointed in some of the things that happened but I can't say what those were without revealing, however DO watch this I don't think you will be disappointed with the show overall!!	4.0	Addicted	2014-02-18	0	0	0
0767002652	Upstairs Downstairs - The Premiere Season [VHS]	A2NSIJY1WFA7HP	P.A.	Wonderful characters; perfectly cast; precisely drawn story lines. Art direction, costumes, sets, all are remarkably lovely and true to the time.	5.0	Excellant up date of the classci	2013-05-26	0	0	0
0767002652	Upstairs Downstairs - The Premiere Season [VHS]	A3AXHL45L9D3VP	Paja	This is a very entertaining I would recommend this movie, it is very well acted and the cast works well together.	4.0	Upstairs Downstairs	2014-04-30	1	0	1
0767002652	Upstairs Downstairs - The Premiere Season [VHS]	A1JWF924XB02X	Pam Cornett	While the first few episodes seem to lack any real drama, by the middle of the season I was hooked.	4.0	Season 1	2013-06-26	0	0	0
0767002652	Upstairs Downstairs - The Premiere Season [VHS]	A34UNFLGK72Q4J	Pamela Pellegrino	Flawless acting and lots of fun watching fashions, furnishings, and technology of England pre-WWII. I would highly recommend this series.	5.0	Watched it twice. Great weaving of story lines and history.	2013-06-20	0	0	0
0767002652	Upstairs Downstairs - The Premiere Season [VHS]	A2LJQ2Q1SLA3I7	Pam Spradlin	Not surprising- -I'm a big Downton Abbey fan, so I was pleasantly surprised with this series.  Good story lines.  Just wish there were going to be more episodes.	5.0	Pleasant surprise	2013-08-14	1	1	0
0767002652	Upstairs Downstairs - The Premiere Season [VHS]	A2XI9BIAN2DK3Q	"Papergirl ""Cathy Hickson"""	I used to listen at it on the radio with my mom as a little girl, but I was way too young to appreciate it. I had to watch the series back to back. I couldn't get enough.	5.0	Terrific.	2013-04-11	0	0	0
0767002652	Upstairs Downstairs - The Premiere Season [VHS]	A1SB3Z6OBEPZJM	Pat Garner	I am afraid I had never watched this series when it came out.  Watching it now after viewing Downton Abbey was disappointing from the acting, to the darkness of the production and hokey scenery. Won't be finishing the series.	3.0	Surprisingly boring	2013-04-04	2	0	2
0767002652	Upstairs Downstairs - The Premiere Season [VHS]	A36U9CYT1B93WY	Pat G.	I would recommend this drama series - it's interesting and the characters are believable. It's set at the beginning of World War 2.	4.0	I like period dramas, and the interaction between the aristocrats upstairs and the housekeepers downstairs.	2013-06-26	0	0	0
0767002652	Upstairs Downstairs - The Premiere Season [VHS]	AYZL65HEV4HQU	Pat	I spent a whole weekend glued to my iPad watching this. I don't know why I did not catch the series on TV. So glad I was able to catch up.	5.0	Don't start watching if you are short on time.	2013-04-28	0	0	0
0767002652	Upstairs Downstairs - The Premiere Season [VHS]	A1DY3GPEMZKQC1	pat mcleod	I really liked the SEASON 1 .  I am looking forward to Season 2  I like the mystery of the story as it unfolds.  of the  thinkinwith the actors.  The thinking of the rich and the poor.	5.0	Upstairs Downstairs Season 1	2014-04-07	0	0	0
0767002652	Upstairs Downstairs - The Premiere Season [VHS]	A1FTS2OWH3HZ9S	Patricia Allen	A little hard to understand the thick British accents but I love the story line. It really accentuates the issues of that time period.	4.0	i like it	2013-07-14	0	0	0
0767002652	Upstairs Downstairs - The Premiere Season [VHS]	AXXZ9633ZL2S5	Patricia B.	I have only seen the first show so not really sure about it.  It seems like it will be good.  I did enjoy the first show.	4.0	Upstairs/downstairs	2013-05-04	1	1	0
0767002652	Upstairs Downstairs - The Premiere Season [VHS]	A1SL8DQQXKTJZU	Patricia	Enjoy the series a great deal and very much-excellent!Great cast and acting.Streaming quality is just wonderful with no interruptions.	5.0	Excellent-wonderful epic series	2013-03-24	0	0	0
0767002652	Upstairs Downstairs - The Premiere Season [VHS]	ATUNWD17I237L	Patricia	Loved the old Upstairs Downstairs and I love the new one, too. Too bad they ended it after only three seasons. Not quite the caliber of Downton Abbey, but great just the same!	5.0	Loved the old Upstairs Downstairs...	2013-02-26	0	0	0
0767002652	Upstairs Downstairs - The Premiere Season [VHS]	AWXZHL3L1KY1H	Patricia Maynard	After thoroughly enjoying Downton Abbey I was looking for something similar.  It was exactly what I hoped for.  After watching both seasons I wish there were a third.  I am currently enjoying the original series.	5.0	Perfect for Downton Abbey enthusiasts	2014-02-05	0	0	0
0767002652	Upstairs Downstairs - The Premiere Season [VHS]	A2YJU1CVH3WH23	Patricia Tank	Loved it.  What I hate is how the price goes way up for each continuing season once we are hooked:(	3.0	Loved it...but	2014-03-27	0	0	0
0767002652	Upstairs Downstairs - The Premiere Season [VHS]	AMTUTIAI5SXVW	Patrick D. Haney	The shows are pretty good but there are a lot of time gaps between episodes and the characters are not as likeable as &#34;Cousin Matthew&#34; or &#34;Lady Marry.&#34;  I enjoyed every show but I would not put it on my top priority list.	4.0	Not as good as Downtown Abby	2013-09-15	0	0	0
0767002652	Upstairs Downstairs - The Premiere Season [VHS]	A7FIJG9N9TT0U	Patscats	I loved the remake of this great series. Although I did not see the original back in the 70's I was able to watch the entire series on Amazon. The remake is true to the feel of the original but brings a new and timely telling of the story. Great acting and wonderful episodes.	5.0	Upstairs Downstairs Season 1	2013-05-29	0	0	0
0767002652	Upstairs Downstairs - The Premiere Season [VHS]	AWKESG2XCZBI6	patti busse	Great show - wish there were more episodes! Love the story line and the attention to detail that these British shows provide.	5.0	Upstairs/Downstairs	2014-01-22	0	0	0
0767002652	Upstairs Downstairs - The Premiere Season [VHS]	A1DMEO1SDEKW4G	Patty R. Foil	Loved it!It doesn't matter if you ever saw the original series on Masterpiece Theater years ago. this one is beautifully written to be a companion piece. All but a few new characters and all superb. It should win awards in all categories! Looking forward to the next installments!!	5.0	Upstairs Downstairs	2011-07-23	2	2	0
0767002652	Upstairs Downstairs - The Premiere Season [VHS]	A21NGQXCU01U9B	"Paula Crandall ""Paula Crandall"""	I had high hopes for this show after the first episode, but before #2 was done, I shut if off.  They changed a character so drastically from what he was, or ever would have been, that I coudln't deal with it.Maybe I'm spoiled by Downton Abbey because of its high quality, but I will not be following this show.	2.0	Upstairs Downstairs should be dropped to the dungeon	2014-06-29	0	0	0
0767002652	Upstairs Downstairs - The Premiere Season [VHS]	AMK7P4GEUT8AP	"Paul E. Leitzelar ""Paulito"""	I can't seem to find the right words that accurately express how much I liked this series. I was afraid since this was a reproduction of a previous highly thought of series, it would fall short. However, I think that it has great entertainment value and proved its worth. Very glad that I chose to make the purchase.	5.0	Liked it very much.	2011-08-04	7	5	2
0767002652	Upstairs Downstairs - The Premiere Season [VHS]	A13H2RKO2SEOL1	Pauline A. Nissen	This period series was a favorite when it first came out. I am thrilled to be able to see it again. Love seeing history unfold through the eyes of this household	5.0	Better the second time around	2013-03-24	0	0	0
0767002652	Upstairs Downstairs - The Premiere Season [VHS]	AJ412CIM1850S	Paul V. Condie	No question, the theme and excellent casting is world class. Even after 40+ years since its debut, it still tugs at the hearts strings. Love those characters...	5.0	A must see for Victorian aficionados.	2014-05-19	0	0	0
0767002652	Upstairs Downstairs - The Premiere Season [VHS]	A23J4S3ZHX48AU	Pearlie	I started watching Upstairs Downstairs on PBS years ago and continued to do so on BBC America.  I was happy when they did a remake. If you enjoyed Upstairs Downstairs in the past, you will love this remake.	5.0	Great DVD	2014-02-06	0	0	0
0767002652	Upstairs Downstairs - The Premiere Season [VHS]	AL6C1XUKLN80F	Peggy	Upstairs, Downstairs is the saga of the Bellamy family and their household staff in the early 20th century. Throughout the series their lives, loves, tragedies and triumphs are portrayed. This set of 13 episodes includes the COMPLETE first season as seen in Britain, including some black and white episodes never seen on tv in the US. In the first episode we are introduced to the colorful Sarah (Pauline Collins), in the second (B&amp;W episode) Lady Marjorie has her portrait painted only to discover at the Royal Academy Show that the artist has also painted two half-naked maids in an attic room (possibly Bellamy maids?). In episodes 3 and 4 (B&amp;W) we are introduced to the children, James and Elizabeth Bellamy. Episodes 5 and 6 show us the romance between Elizabeth Bellamy and a German Baron (and it's dark underside), and the pregnancy of the new maid, Mary. More familiar episodes to the US audience come in #7 and #8, Lady Marjorie is spellbound with a young army captain who is friends with her son James, and Emily (the annoying kitchen maid) falls for a neighboring family's footman, with disastrous results. Episodes 9 and 10 have Mrs. Bridges, the cook, behaving in a most improper way and stealing a baby, and the erstwhile Sarah returns with a new plan to improve her social standing. The two penultimate episodes in this set include the further adventures of Sarah the housemaid with a Swedish valet, and the further adventures of the Bellamy's daughter, Elizabeth, with a group of young Socialists. Finally we are left with the now estranged Elizabeth Bellamy and her relationship with a leftist poet, Lawrence Kirbridge--and a great eagerness to own the next 13 episodes, now also available.Upstairs, Downstairs is the classic &quot;Masterpiece Theater&quot; series, with costumes, drama, comedy, and riveting characters that we take to our hearts. If you are a fan of more recent costume dramas on A&amp;E and PBS, you will very much enjoy this early series which holds up remarkably well, after nearly two decades.We completed the First Season last night and I'm hooked. The writing is terrific and all the performances are enchanting. My particular favorites are Mr. Hudson, the butler, and Rose, played by the gifted and gorgeous Jean Marsh.The print quality of the videos is excellent overall, but I know that I shall be buying the series again when it comes out on DVD, as I'm sure some jerking of the picture (mostly in the credits, never in the performance itself) and other flaws will be removed as far as possible.The social structures of both the wealthy class and the servant class are jarring, especially to an early 21st-century viewer. We have come quite a long way from that time when a servant must &quot;know his place&quot;. Yet, it wasn't just they who had to know who they were and what place they occupied in the world: in many ways, the wealthy were just as trapped in their positions - if not moreso - than the servants who ran their lives. And make no mistake - the servants DID run things if this series is to be believed.	5.0	The best ever made	2004-11-01	10	10	0
0767002652	Upstairs Downstairs - The Premiere Season [VHS]	A2WAVGAXTBFK5G	Pen Name	This is a great show similar to Downton Abbey with the stories of the rich and those that serve them.	4.0	great show	2014-01-14	0	0	0
0767002652	Upstairs Downstairs - The Premiere Season [VHS]	A1HTSDX3VN5H39	Pen Name	This season of Upstairs/Downstairs takes you by a rather pleasant surprise. The plot thickens as the brink of war approaches and things are shaken not stirred at 165 Eaton Place. I recommend this series to anyone who enjoys classic tales of love, war, and the classes.	5.0	Classic Drama	2013-08-22	0	0	0
0767002652	Upstairs Downstairs - The Premiere Season [VHS]	AWILIQJ87TBAV	penny j talbert	Love the Show! The characters are all good and each with their own story,,,The writing is awesome and I love the shows like these. So glad there is more to see!	5.0	Great	2013-10-14	1	0	1
0767002652	Upstairs Downstairs - The Premiere Season [VHS]	A2G2MP8VLLATOR	"Peter Lake ""Mustache Pete"""	Clearly a sequel years later to the original Upstairs Downstairs was going to face a formidably heavy lift to match the class and addictive absorption of viewers to the life of the Bellamys above and below stairs. Another problem was the number of viewers who actually remembered the seventies series and came to love it who are still around and who would compare it to the original vs. the new viewers who had no prior knowledge of the series. And thats why I think it was a great effort by the producers to take both audiences into consideration. By making Rose the fulcrum of the story they had the connective tissue to the original.And Jane Marsh was great as usual. The young Bellamys and the turbulent /30's were all a wise choice. Acting great, sets remarkable, intrusions of the drums of war and torment for Britain very well integrated. Most of all terrific entertainment which had much of the addictive qualities of the original. Strongly recommend.	4.0	A worthy follow up	2014-06-12	0	0	0
0767002652	Upstairs Downstairs - The Premiere Season [VHS]	A2NWFMCS4DS4OY	Peyton	I am enthralled by the atmosphere of a bygone age.  The clothes & charm of the upper class is very well represented as well as the vasts differences in below stairs personnel.  I started watching Upstairs, Downstairs in 1972 in the original version when Jean Marsh was a young lady & parlor maid;  this takes up where the other left off 40 years later... awesome!	5.0	Love this series	2014-02-07	0	0	0
0767002652	Upstairs Downstairs - The Premiere Season [VHS]	A3295AMKK6LUCY	P Harris	I love this show, all the characters. I so wish there were more shows shown on tv!!  Thank you PBS/Masterpiece theater!!	5.0	Well done and clean show	2014-01-09	0	0	0
