asin	title	reviewer_id	reviewer_name	review_text	rating	summary	review_date	total_votes	helpful_votes	unhelpful_votes
6301996135	The Civil War - A Film by Ken Burns (Boxed Set) [VHS]	ABY7ITDWUJK8	dkaneshi	It was well written and very informative. I am a very interested in history and I found the series to be very engaging.	5.0	Excellent History Series	2013-12-23	0	0	0
6301996135	The Civil War - A Film by Ken Burns (Boxed Set) [VHS]	A24GQAASJGVGRO	"D. Kohler ""Kilowattman"""	Good content and need to watch again, part of my family is from NC and PA and would like to find out more.....	5.0	Is there any more like this????	2013-07-09	0	0	0
6301996135	The Civil War - A Film by Ken Burns (Boxed Set) [VHS]	A2VT4JJV6CH8OF	DLM	Fascinating presentation. Compelling and informative. Balanced perspective from all points of view.  Interesting use of historical pictures and narrative to tell the story of our nation.	5.0	Ken Burns Civil War	2013-09-29	0	0	0
6301996135	The Civil War - A Film by Ken Burns (Boxed Set) [VHS]	A2NVAGB5ZV1QH7	D. Lyda	this series is very educational for anyone needing to understand the struggle and hardship that these men and women went through and how they overcame and came back as a healed nation.	5.0	good film	2013-09-14	0	0	0
6301996135	The Civil War - A Film by Ken Burns (Boxed Set) [VHS]	AQG17PM1H2CBP	D. McDougall	Watched Civil War series for second time, after seeing 2013 Lincoln movie about 13th amendment.  Documentayr series has incredible pictures, good commentary, and I learned much more this time watching it.  Could have been a couple of hours shorter without taking away from the content.  All in all, very good.	4.0	Second Time Around	2013-07-21	1	1	0
6301996135	The Civil War - A Film by Ken Burns (Boxed Set) [VHS]	A2073ATAE8WTNW	D. McIntosh	I was very happy with this dvd set. I replaced my VHS set with it.-Dave	5.0	Completely Satisfied	2009-02-07	0	0	0
6301996135	The Civil War - A Film by Ken Burns (Boxed Set) [VHS]	A6YQ6FW9R97WJ	"D. Nelson ""Seldom Buy"""	The item arrived on time and the packaging was in great shape. I have watched a couple of the DVDs and the presentation is exactly what I expected.	5.0	The Civil War	2011-06-02	2	1	1
6301996135	The Civil War - A Film by Ken Burns (Boxed Set) [VHS]	A2SAAKPLFD008U	Doc. John	A very well done documentary. While I may have some problems with some of the statements made by some of the modern &#34;experts&#34; in the film, from a historic standpoint, the film is first rate.Great choices made with the photos, and the people reading the historical records and diary entries could not be better.As a collector of Civil War antiques, my only complaint is that the increased interest that Mr. Burns brought to this important part of our Nations history ( in itself a good thing ) drove up the prices that I have to pay to add to my collection.I enjoyed the film when first seen on PBS, I enjoyed it on VHS, and it looks and sounds even better on disk.	5.0	Great.	2014-02-08	0	0	0
6301996135	The Civil War - A Film by Ken Burns (Boxed Set) [VHS]	A4SA30ZS9YU4D	docster	Watched about a quarter of the series around five years ago, and recently decided &#8212; having read over half of the first book in Shelby Foote's three-volume Civil War narrative &#8212; to watch Burns' documentary from the beginning.  Very glad I did, for I find Burns' and Foote's works to be a fantastic educational companions.  Not only do I have a better sense of the chronology of the war, but I understand more of the impact the war had on the nation at the time, including the ways the conflict affected the rest of the world of the mid-19th century.  Found also that the movies, &#34;The Conspirator&#34; and &#34;Lincoln&#34;, had more meaning to me.	5.0	Excellent	2014-05-12	0	0	0
6301996135	The Civil War - A Film by Ken Burns (Boxed Set) [VHS]	A509W6VID719P	"Donad E. Myers ""skyjacker"""	If there was a 6 star rating, I would give it that. I saw bits and pieces of this series, and decided to get the whole series. I live close to the Lincoln museum and library, and have a special interest in the Civil War. Ken Burns did a GREAT job of describing the causes and trials of the war. Would recommend it to anyone even remotely interested in this subject.	5.0	Absolutley Fantastic	2008-08-13	0	0	0
6301996135	The Civil War - A Film by Ken Burns (Boxed Set) [VHS]	A23I152X4N77CR	Donald D. Evans	The Best	5.0	Five Stars	2014-07-06	0	0	0
6301996135	The Civil War - A Film by Ken Burns (Boxed Set) [VHS]	A8RGRFX7O37MA	Donald J. Kerns	"This set the standard for modern television documentaries. Ken Burns covers high command, combat troops, auxiliary units, medical personnel, and the families waiting at home in a way that makes one feel a true part of the experience. Visually detailed, well-chosen narrative, and the strains of "" Ashoken Farewell"" leave the viewer with vivid memories. An understanding of this era explains so much of the America we see today."	5.0	History Every American Should See	2013-07-07	0	0	0
6301996135	The Civil War - A Film by Ken Burns (Boxed Set) [VHS]	A2N5HIXTEWU3RS	Dona's	This is an awesomely done series full of fascinating facts that transported me back to that heartbreaking time in America's history.	5.0	Wonderful Series	2013-09-03	0	0	0
6301996135	The Civil War - A Film by Ken Burns (Boxed Set) [VHS]	A223ENB9CEF1RL	Don & Jan	this program was great when it first came out, and still great the second (or third) time viewing it.  brings in original materials, letters, photos, and war strategy facts.  excellent, also the music.  Very sad time in American history.	5.0	very good true histury program	2014-04-13	0	0	0
6301996135	The Civil War - A Film by Ken Burns (Boxed Set) [VHS]	A2UMJKB5JGEEYG	Donna S.	I have watched it several times.  I love history.  It is very well done.  Ken Burn always does a great job.	5.0	Great job.	2013-10-22	0	0	0
6301996135	The Civil War - A Film by Ken Burns (Boxed Set) [VHS]	A21OT9Y4UAN1GK	"Doser ""Angry Movie Watchers"""	Great detail! A video series that should be seen by all to understand the character of Americans at our countries defining moment.	5.0	Astounding documentary of the Civil War	2013-11-23	0	0	0
6301996135	The Civil War - A Film by Ken Burns (Boxed Set) [VHS]	AYUBU1MUK60A7	"Dot ""crocheting grandma"""	One of the best films I have watch.  I plan to watch it again with my spouse.  I recommend it to everyone interested in stories about the Civil War.	5.0	The Civil War by Ken Burns	2013-10-05	0	0	0
6301996135	The Civil War - A Film by Ken Burns (Boxed Set) [VHS]	A2BNXJZHXMQC8	Doug Fiske	Without a doubt the most enlightening series ever made. I feel every American should watch this, at lest once in their lifetime. Stunning!	5.0	Life changing	2013-10-26	0	0	0
6301996135	The Civil War - A Film by Ken Burns (Boxed Set) [VHS]	A1PJ3JAXLN08V3	Douglas N. Musurlian	I loved both.  I am a Vietnam Veteran and that DVD was perfect.I was a History major in college and both DVD's were great.	5.0	Great DVD's	2013-09-23	0	0	0
6301996135	The Civil War - A Film by Ken Burns (Boxed Set) [VHS]	A3HUSSSCCD1JDM	"Douglas O. Proctor ""Doogie"""	The Civil War series is the quintessential presentation of the most important historical period in our history since the revolution. Everyone should see this masterpiece by Ken Burns.	5.0	Must See!	2014-02-22	0	0	0
6301996135	The Civil War - A Film by Ken Burns (Boxed Set) [VHS]	A1WJCJCZIN1BJZ	Douglas Torborg	Great photos and voices tell the story. And has beautiful Civil War era music. It's a must purchase for anyone who is into history. And when I viewed it being into Civil War History. And also viiewing it wirh my family. They now understand what I have been telling them about the war. They came away with allot more knowledge about the war and want to watch it again soon. And now want to see the sights that were in the movie,,,,,,,,	5.0	ONE OF THE BEST WAYS GTO LEARN ABOUT THE CIVIL WAR	2013-09-03	0	0	0
6301996135	The Civil War - A Film by Ken Burns (Boxed Set) [VHS]	A1UB50RRUS87H3	Doug Miller	I viewed The Civil War on PBS and was amazed at the detail, photograhs and straight-forward manner in which Mr. Burns presented the subject. As a result, my interest in the Civil War has increased tremendously and I now intend to make a trip to a number of the battlefields. The American public has a great history and it is unfortunate that our schools do not seem to share the passion of Ken Burns in telling this historic story.	5.0	The Civil War - a Film by Ken Burns	2002-12-15	1	0	1
6301996135	The Civil War - A Film by Ken Burns (Boxed Set) [VHS]	AXH4S7ASMTEX1	"D. Paulsrud ""Avidreader"""	This is the definitive documentary on the Civil War. In order to understand how our country got to where it is today you really need to have an understanding of the Civil War, why it was fought, how it was fought, the mind sets of both sides, etc.... I highly recommend this for use in U.S. History classes and really like how it is broken down into sections. You can pick and choose what sections to use or you can watch the entire series. It will create some very good discussions with your students.	5.0	Outstanding!	2014-01-01	0	0	0
6301996135	The Civil War - A Film by Ken Burns (Boxed Set) [VHS]	A2XERMZ736CBO0	D. Perelman	Ken Burns brings the Civil War to life in pictures and by the wonderful words of the actual participants. It makes you long for a more literate America...the simplest foot soldier is more eloquent than most statesmen of today... truly a masterpiece that should be required viewing in all schools.	5.0	Absoloutly Wonderful	2005-01-21	25	23	2
6301996135	The Civil War - A Film by Ken Burns (Boxed Set) [VHS]	A2W80IEM7F8ITZ	Drags	I never knew this much about the civil war. We experienced more death in our own country than many of the current wars. It was a very sad time in our history.	5.0	great history and information	2014-04-10	0	0	0
6301996135	The Civil War - A Film by Ken Burns (Boxed Set) [VHS]	A1KXU0T416V0WF	Dr. Carlito Vice	"Towards the beginning of this warm, milquetoast documentary (for a PBS production, it's not nearly as anti-South as it should be, and it could do without the love letters), there is, in the form of a painting, a revelatory moment. Lincoln has just been elected, and the South has officially launched its war for slavery (known as ""The Lost Cause"" among the toothless and inbred). A pack of yokels has gathered at the town square in Charleston, South Carolina, to rejoice, all of them yelpin' and hollerin' and just generally acting like a bunch of liquored-up jackals. By itself, this wouldn't warrant any notice (just another Sunday afternoon for your average Confederate), except that these reactionary ""rebels"" wield a curious implement: a yellow flag with a coiled snake on it accompanied by the words ""don't tread on me"" beneath it. As they wave their anti-government merit badge of hickdom from the tops of statues and buildings, undoubtedly drunk on moonshine, it dawns on you: the proud imbecility and backward provincialism of the Confederacy is still very much alive today, only now dispersed across the continent and concentrated in the suburbs of the major metropolitan (read, enlightened) areas. Maybe Ken Burns and his corporate backers didn't intend on highlighting this reality, but there it is. If you want to find the modern Confederacy, just follow the dumb yellow flags."	3.0	The South Shall Tantrum Again	2014-06-20	3	1	2
6301996135	The Civil War - A Film by Ken Burns (Boxed Set) [VHS]	A1VWU58O9VNG5Z	DReese	For what is included, this documentary is good. The music is great, the stories by historians and authors, especially Shelby Foote, are wonderful, and the images are often haunting.My big problem with this, however, is the limited scope. Considering the length, I was expecting so much more. After watching this long documentary, one would believe that Americans fought each other in Virginia, Maryland, and Pennsylvannia over whether or not to free the slaves. For shame! The civil war is so much more. Burns focuses primarily on the Armies of the Potomac and Northern Virginia, while in reality the war was won in the west. Battles of the east were the biggest in terms of numbers but the battles in the west, discussed but practically ignored, were more important. Ft. Donelson, Shiloh, Vicksburg, Chattanooga, and Atlanta are in there, but not given their proper due. Not a word is said about battles west of the Mississippi, the complicated issues of European involvement are ignored, the importance of blockade-running dismmissed, technological advanced glossed over, anti-war movements in North and South forgotten, and the causes of the war are treated with all the complexity of a fourth grade book report. Any cause not not DIRECTLY related to the abolition movement is completely ignored (but what would you expect from PBS).That all being said, I really enjoy watching this dvd. I just remember that it is VERY imcomplete.I once heard it said that a person's enjoyment of this series was inversely related to how much one knows of the Civil War. I found this to be true. As I study the war in greater detail, my tolerance for this documentary has declined.	3.0	Very good but limited	2003-08-15	18	15	3
6301996135	The Civil War - A Film by Ken Burns (Boxed Set) [VHS]	A2X85W07R97YI1	Dr. George E. Goldman	For those who are unfamiliar with this series, simply stated this is the  FINEST  television ever produced.  For those  who are Civil Was buffs  this is  a wonderful and  incitive review of  our  country's nightmare.  ENJOY !!!!George E Goldman, M.D.Akron, OH	5.0	Ken Burn's The  Civil War	2009-03-22	1	1	0
6301996135	The Civil War - A Film by Ken Burns (Boxed Set) [VHS]	ADTXEJBR01MKW	"Dr. R.P. Forsberg ""country philosopher"""	What's to say here?  We;ll reviewed, considered a masterpiece and it is.  For Civil War buffs an essential MUST see; and who doesn't know this?	5.0	A Classic	2014-02-09	0	0	0
6301996135	The Civil War - A Film by Ken Burns (Boxed Set) [VHS]	A3N27L13CWJ9HY	D. R. Smith	"After watching over half of this movie all they were talking about was slavery, hence my title declaring the title of the movie false. When the title is ""The Civil War"" It should be about the civil war. To make a movie about the civil war would also require it to be a series as there were so many different battles and strategies in play by both sides. This is straight up false advertizing and not worth your time to watch if you want to see a movie or documentary about the Civil War. If you want to watch a documentary that gives basically the unions side of what starts the Civil War, then watch this. This is only about an hour and forty minutes long, and there is no way possible to describe the plight of the slaves, the issue of states rights, the secession of the southern states, the beginning of the war and all the battles that occurred and how they came to be battles and how they ended. The different strategies employed by both sides, the prisoner of war camps and the mistreatment of the prisoners on both sides. The Emancipation Proclamation and it's effects. The plight of the just freed slaves leaving the south and thinking everything was going to be all hunky dory when they made it across the Mason Dixon line, and finding out that the people of the north didn't really want them up there with them. They just wanted them freed from southern slave holders and expected them to stay in the south to make their living. Racism of course reared it's ugly head when Democrats, in the south mainly, started the KKK after the war and started killing republicans, both black and white. The story of the Civil War, and its ramifications, cannot be told in a mere hour and forty minutes. This just shows Ken Burn's view on slavery back in Civil War times. There are far better movies and documentaries, and also books, which do the Civil War far more justice. To give such a short sighted view of The War Between The States, is a grave injustice to the 600,000 men and women who died in this most terrible war in our nations short history."	1.0	Title is false	2013-01-21	45	7	38
6301996135	The Civil War - A Film by Ken Burns (Boxed Set) [VHS]	A17D77DFID0GZG	"dsrussell ""greyhater"""	"I could kick myself for not recording this PBS special when it aired almost ten years ago.  Luckily, I was able to purchase this magnificent documentary, and I can tell you all that it is well worth the steep  purchase price.Ken Burns' artistic creation seems to be the standard by  which all other documentary films are judged.  It was a landmark film  disecting a very complex subject.  Using actors to read actual letters and  quoting dialog from the war's participants, while showing the viewer  startling photographs from the war, was a brilliant stroke.  And the  commentaries sprinkled throughout by the historians, especially Foote,  gleaned an insight not often found in documentary films, and brought  vividly to life the great battles and the terrible human cost that the  people of the era (both male and female / north and south) had  suffered.If one wants to see how our nation grew up and is the country  we have today, look no further than this epic as a starting point.  I would  also recommend the four-hour movie ""Gettysburg"", taken almost word-for-word  from the late Michael Shaara's pulitzer prize novel ""The Killer Angels"", as  a fine companion piece.""The Civil War"" documentary (nine video  tapes--approximately 15 hours of viewing time) is a fine beginning for  anyone thirsting for knowledge about our history.  Those interested in the  ""Old West"" may also get an insight, or at least an understanding, of where  some of the most notorious outlaws and lawmen sprang, and possibly why they  felt human life was so dirt-cheap.Between 1 and 10, ""The Civil War""  rates the highest level possible.  If films like these were available when  I was going to school, maybe I wouldn't have napped so often in history  class."	5.0	A must for anyone&#65533;s video collection.	2000-05-09	37	36	1
6301996135	The Civil War - A Film by Ken Burns (Boxed Set) [VHS]	A2TXR85WQLE32N	D. S. Thurlow	"Ken Burns' absolutely superb documentary ""The Civil War"" may have been public television's finest broadcasting hours, now available in a DVD set.  Burns' unique mixture of photographs, period music, interviews with various historians, voiceover narrative by David McCullough, and excerpts from period letters and speeches creates a spell-binding effect for the viewer, whether dedicated student of history or general viewer.Burns takes the war chronologically, as a festering debate over the future of slavery becomes a civil war between the American states and a total war for the future of the country.  Although the series covers the fighting from Fort Sumpter to Appomattox, it is less a battle history than the story of nation undergoing a primal shaping event.  In Burns' hands, this catastrophic event becomes almost a lyrical epic poem, touching everything from high strategy to the impact of war on individual homes North and South.  A particular highlight is the commentary by Civil War historian Shelby Foote, whose wry observations provide perspective on the war.  Extra features in the DVD set detail the making of the documentary, along with some additional commentary.  Originally broadcast in 1990, the content of the documentary generally holds up pretty well.This DVD set is very highly recommended as superb entertainment and education."	5.0	Public Television's Finest Hours....	2008-03-17	3	3	0
6301996135	The Civil War - A Film by Ken Burns (Boxed Set) [VHS]	A29A7L54GB08CL	Duke	Excellent work, needed it fast and the price was best I could find in short time that I had to look...Documentary is Excellent too, recommend to all...This our History.	5.0	Excellent	2012-01-09	0	0	0
6301996135	The Civil War - A Film by Ken Burns (Boxed Set) [VHS]	A2Y4TBJAHK1LRU	Dylan's Dad	Even though we live in the heart of Civil War country (near Richmond,VA) and are aware of the historically significant sites nearby, nothing has ever resonated like this series. It has put in context so much of the past and the present. This is a must watch for all citizens.	5.0	Best History Lesson EVER	2013-04-28	0	0	0
6301996135	The Civil War - A Film by Ken Burns (Boxed Set) [VHS]	A6WYLA5ZTMFCR	Eagle Eye	"This documentary emphasizes why America's Civil War was also its most significant: it was a war of national self-definition.  We were fighting to define who we were and who we would be.The devastation of the war, with 600,000 Americans dead, the use of repeating guns and ironclad boats, and the Holocaust-like conditions at the Confederacy's ""Andersonville"" POW camp were some of the precursors to the horror of modern warfare.  It was total warfare, extending to civilians as Sherman's brutal march to the sea made clear.One weakness of this production is that it does not make the causes of the war explicit enough, and make clear that slavery on its own did not cause the war.  Abraham Lincoln himself had said at the beginning that if he could preserve the Union and free no slaves, he would do it.  Robert E. Lee did not support the institution of slavery, though he believed that whites were a superior race.  At the beginning, slavery was more a touchstone to conflict, an issue where deep-seated differences between north and south came to a head.  It was probably inevitable that northern society with its industrial base and ""classless"" society would clash with the agrarian South, which was built on a hierarchy of privilege, with white plantation owners at the top and black slaves and poor whites and the bottom.  With the North's economic progress came southern anxieties about the growth in the federal government's power and what that meant.  Could the federal government override the ability of new states to decide if they were to be free or slave states?  The states that would make up the Confederacy said no.The profiles of the major players in the war, Lincoln, Lee, Grant, McClellan, Sherman, Stonewall Jackson and others, as well as the correspondence of rank and file soldiers, brings out the humanity of the conflict.Its wounds remain.  I once knew a descendent of Robert E. Lee, who carried himself with a sense of honor and grace that seems to have almost completely disappeared from our national life.  He'd get choked up talking about the ""War between the States.""  It is hard to understand how Robert E. Lee, someone of such outstanding character, could allow himself to be so blind to racial injustice.  But that famous Mathew Brady photograph of him standing outside Appomatox Courthouse after the surrender, depicted in this documentary,  shows his noble bearing.  In his own way, Lee depicted those qualities so lacking in our political and social life these days:  duty and honor.This documentary brought home the Civil War's devastation.  It helped me understand more about who we are as Americans."	5.0	A War to Define Ourselves	2006-08-14	19	17	2
6301996135	The Civil War - A Film by Ken Burns (Boxed Set) [VHS]	A44FOGG9FM7OK	E. A. Lehwald	If this isn't the best Ken Burns documentary, it's certainly one of his best. His editing and pacing is top-notch. As an introduction to the Civil War and its military, social and economic issues, you can't beat Ken Burns.The Civil War: A Narrative (3 Vol. Set)	5.0	One of his best	2009-12-15	1	1	0
6301996135	The Civil War - A Film by Ken Burns (Boxed Set) [VHS]	A3VJG08JLOS9Y5	E. Calhoun	No matter how many times we watch this, we are always deeply moved by the visual imagery, the evocative words, and the beautiful music.  We think this is Ken Burns' best.	5.0	Beautifully told history....	2014-07-08	0	0	0
6301996135	The Civil War - A Film by Ken Burns (Boxed Set) [VHS]	AQFWG04726AG9	"Edward A. Sweezey ""eas"""	Excellent order of civil war History. Educational, and entertaining, You will watch several times,unique storys and bit of information.&#34;Shelby Foote&#34; does excellent job of objectivity and perspective of both sides. 5 stars	5.0	Education  entertaing  unique	2014-04-02	0	0	0
6301996135	The Civil War - A Film by Ken Burns (Boxed Set) [VHS]	A1FME6CHXPBDD7	Edward F. Bryan	Ken Burns is one of the best documentarians in 20 years or so.  He always does an excellent job in any area of endeavor.  The Civil War series, his first, is arguably his best of the genre.	5.0	Civil War	2014-02-14	0	0	0
6301996135	The Civil War - A Film by Ken Burns (Boxed Set) [VHS]	ASQ506TGU86EE	Edward	This is a great historical piece of work by Ken Burns. It's significance can stand along side any history book. The depth of the personal stories makes you feel the suffering and triumphs that happened. The photos almost come to life as the narrator progresses through the timeline. Unbelievably ponient. A masterpiece.	5.0	Incredible work!	2014-02-11	0	0	0
6301996135	The Civil War - A Film by Ken Burns (Boxed Set) [VHS]	AOG975LXYLX3D	Edward Kirven	Great and wonderful look at the historical events and people like Grante, Lee and Lincoln that had their important part in the Civil War.	5.0	Great	2014-06-19	0	0	0
