asin	title	reviewer_id	reviewer_name	review_text	rating	summary	review_date	total_votes	helpful_votes	unhelpful_votes
6301996135	The Civil War - A Film by Ken Burns (Boxed Set) [VHS]	A1Y330CFP4332P	kam	Great series for enthusiast of the  Civil War. Enjoy the pictures and letters from the men and women in the war.	5.0	Great Series	2013-07-30	0	0	0
6301996135	The Civil War - A Film by Ken Burns (Boxed Set) [VHS]	A4YC9ZCD49J90	K. Angst	Well researched containing a wealth of little known information along with excellent photography.  I first viewed this on telivision when it was released in the early 1990's and have wanted to own a copy since then.  The re-issued DVD version appears to be of even better quality.History can be a dull subject unless taught by a good teacher.  I would highly recommend the use of this video as an aid to to teaching U.S. History or the Civil War.This rates as well as Ken Burns excellent recent film, The War, released in late 2007.	5.0	The Civil War	2008-02-05	1	1	0
6301996135	The Civil War - A Film by Ken Burns (Boxed Set) [VHS]	A3HHTC95EZ630V	Karen Moore	I enjoyed this extremely well done Civil War film by Ken Burns. Best narration by a landslide.  Worth every penny.	5.0	This is awesome.	2014-03-30	0	0	0
6301996135	The Civil War - A Film by Ken Burns (Boxed Set) [VHS]	A2MV945MY8Y2Y0	"Karen Wilson ""KEW"""	This is a must for any history buff not to mention someone needing the last word about the most definning moment in our nations history.  This documentory is full of true stories about great battles, suprising heroism as well as small personnal stories that make this important conflict real.  I cannot recommend this enough for teachers who wish to use this to enhance their classes or anyone who would like to see our nation nearly destroy itself for an idea.	5.0	the civil war by ken burns	2009-04-09	0	0	0
6301996135	The Civil War - A Film by Ken Burns (Boxed Set) [VHS]	A3SA5W6UEFYHMT	Karl R. Staehlin	All cds were somewhat repetitious with the long intros, etc. but the meat of the documentaries were very moving and accurate.	5.0	Great expo of life during Civil War times	2013-11-01	0	0	0
6301996135	The Civil War - A Film by Ken Burns (Boxed Set) [VHS]	A2PWQHANBFL6CV	Kathleen Easter	I bought this DVD series for my husband who is a Civil War buff.  I am very pleased with the price and speed in receiving this item.	5.0	Civil War DVD by PBS	2009-06-23	0	0	0
6301996135	The Civil War - A Film by Ken Burns (Boxed Set) [VHS]	AJTS883JCSVE5	Kathy Jewell Firth	Ken Burns and Shelby Foote did an amazing job portraying a very hard time in our history.  I highly recommend to everyone and feel it should be part of the curriculums in school.	5.0	Wonderful series!	2013-08-31	0	0	0
6301996135	The Civil War - A Film by Ken Burns (Boxed Set) [VHS]	A25K4GEVBKZMIK	Katie N.	Withstands the ages and still as relevant today as when it was made. Worth watching over and aver again. Thank you.	4.0	Very good	2013-03-28	0	0	0
6301996135	The Civil War - A Film by Ken Burns (Boxed Set) [VHS]	A1D4L16UXXXPTR	Kay Gray	This was the first of Ken Burns' productions I saw and is still a favorite.  The moving love letter from a soldier to his wife before he goes into battle still brings tears to my eyes.  Being from the South, I appreciate the way Burns treats their cause with dignity and understanding.  There is no gloating over a defeated half of a nation who believed in secession from the union.  This is a difficult subject, but Burns handled it about as well as it can be done.  Whether you are from the North or South, you will learn something about how this tragedy happened and what it cost our ancestors.  There is no glamor in war.  It is brutal and ugly.  Every generation must learn it's lessons and recover from grievous losses.  May we never repeat the same mistake twice!	5.0	The Civil War	2013-06-20	0	0	0
6301996135	The Civil War - A Film by Ken Burns (Boxed Set) [VHS]	A2MPQHYMT258ZV	"KD ""KD"""	"Background:  I have enjoyed this documentary set for as long as I can remember.  Back in 1990, I taped it of PBS and didn't hesitate to purchase it on DVD as soon as it was available.This ""new"" (2004) DVD package seems to be physically different than the ""old"" (2002) DVD package that I bought.  Mine has (had) a gold banner on the top where it says ""PBS Home Video"", while this one is silver.  I'm thinking that they changed this because the gold flakes off very easy.  Other than that, I'm happy with my ""old"" DVD package.With one small exception, that is.The ""wobble"" that many reviews talk about.  Recently, I looked back on my old VHS tapes and the ""wobble"" didn't appear to be as pronounced as it does on the DVD package.  It is only a minor annoyance, but it would've been nice if they had done something about it.Something else that I was thinking:  In the ""Re-Making of the Civil War"" documentary in the ""Special Features"" section, they say that they ran the old film through a datacine and captured the film at ""5 to 6 times"" that of 480 (original telecine).  They went on to say that it was datacined down to ""film granual level"" and showed a demonstration.  Each frame, taken from original film, would be between 2,000 and 2,400 lines!  Each frame was also, as they said, 14MB!  Did they digitize the entire series at once or did they just do a little bit at a time?  If they did it all at once, that is an insane amount of data.  14MB * 24 (frames per second) * 60 (minute) * 60 (hour) * (Entire hour length).  You get the idea.This is what I am getting at:  If they still have all this datacined data, then shouldn't it be pretty trivial to re-release the series on Blu-Ray?  Would 1080p be worth it since it is just still pictures?  Can they fix the ""wobble"" problem in the process?  Finally, figure out a way to get it neatly in 16:9.  I'll re-buy the set for $200 for all the above."	4.0	Do they still have the digital master?	2008-03-12	13	10	3
6301996135	The Civil War - A Film by Ken Burns (Boxed Set) [VHS]	A2CO786A832TC3	ke4vvy@worldnet.att.net	Ken Burns has compiled an incredible selection of photos, letters, and historical narratives of the Civil War.  The films offer an open-minded view of the war, from the very beginning, through all the major battles,  all the way to the tragic end of the war.  Spellbound, watchers will wait  on the edge of their seats to reach the end of each tape and move on to the  next.	5.0	Eye-opening truth of the senseless tragedy of the civil war	1998-11-20	1	0	1
6301996135	The Civil War - A Film by Ken Burns (Boxed Set) [VHS]	A3I30NDP2U455F	keeper	This film is the first and foremost of it's kind and all the others are trying to be like it!	5.0	The Best !!!	2014-07-07	0	0	0
6301996135	The Civil War - A Film by Ken Burns (Boxed Set) [VHS]	A15AMY1ZTYNFB4	"Kees van Beelen ""Kees"""	how about a more permanent record of this fine documentary.....on DV	5.0	excellent	1999-10-06	15	8	7
6301996135	The Civil War - A Film by Ken Burns (Boxed Set) [VHS]	A11HM8MQKO9KQI	Keith B. Glenn	Beautifully produced film about &quot;The War Between the States&quot; or &quot;The Civil War&quot;, with details and information most would have never known about prior to viewing.  Mr. Burns or those who distribute the boxed set should strongly consider producing and releasing a DVD version of the entire series, my VHS tapes are starting to loose their quality from several viewings.	5.0	Excellent Film, Everyone Should Watch This Film!	2001-02-09	3	3	0
6301996135	The Civil War - A Film by Ken Burns (Boxed Set) [VHS]	A19G8E0JDRYDAT	Kelly Raynor	Ken Burns Civil War Documentary is a masterpiece. This is a brilliant accounting of the chronology and causality of the greatest conflict this nation has ever encountered.	5.0	The Civil War Documentary by Ken Burns	2013-09-21	0	0	0
6301996135	The Civil War - A Film by Ken Burns (Boxed Set) [VHS]	A13EUSV15UDAUG	"kennedy19 ""kennedy19"""	"There's no denying that Ken Burns' sweeping documentary of the American Civil War is a success. Through photographs, modern footage of the places in question, period music, and voices reading primary source documents of the time, Burns conjures up the conflict in all its thrilling drama, bloody tragedy, dark humor, and stirring nobility. Personal and engaging, this film brought a new awareness of American history to millions of viewers. It should be noted that a huge topic such as the Civil War cannot be entirely crammed into one film, however long; this is necessarily an overview, though an excellent and detailed one. (At least the Civil War had a compact number of years to it; Burns subsequently took on huger topics still such as Baseball and Jazz, with less success. His finite films like this one and ""Lewis and Clark"" are easier to see as a whole.) I have one quibble with this show - I think it oversimplifies the causes of the war. To be specific, it sees only one cause - slavery - and pays no attention to states' rights or economic issues. This is no surprise; his other films have shown us that Burns sees race as the defining issue of our country. Whether you entirely agree with this idea or not, you are sure to enjoy and learn from this epic documentary."	5.0	Fine Film	2002-09-23	10	6	4
6301996135	The Civil War - A Film by Ken Burns (Boxed Set) [VHS]	A3QZMXQXLULLOV	Kenneth A. Klomhaus	I remember watching this when it first came out on TV years ago.  As a big Civil War History buff, I find this to be one of the finest if not the best telling of this time in our history as a nation.  It is something everyone should watch even if they are not interested in the Civil War since it is such a turning point in the history of our great nation.	5.0	This is the best Civil War Documentary ever.	2014-04-06	0	0	0
6301996135	The Civil War - A Film by Ken Burns (Boxed Set) [VHS]	A362QP1G931H2A	Kenneth L. Habegger	This series is a enlightening summary of the atmosphere that lead to the civil war and the brutality of the battles.  Both sides expected the conflict to last only about 90 days, but decisions and events prolonged the war for four years.  I had not realized that Robert E. Lee was offered command of the Union forces by President Lincoln, but declined and remained loyal to his home state of Virginia.  Abraham Lincoln initially was not against slavery, but his goal as to same the union.  Later the Emancipation Proclamation raised the mission of the war from one of saving the union to one of saving the state of mind for mankind which gave the cause honor.  I was awed by the fact that on many occasions the war could likely have been won by the North and been shortened to a year or two, but for the decisions made by the Union generals, particularly George McClellan.  However, the South was the winner in many of the early battles and had opportunities to become the ultimate victor as well.  England and France were being affected by the war due to the loss of cotton trade with the South and attempted to procure an armistice between the parties to restore trade.  I still have a few episodes to watch.	5.0	Extraordimary events revealed that I had not known	2014-01-22	0	0	0
6301996135	The Civil War - A Film by Ken Burns (Boxed Set) [VHS]	A1X9AMDRSQVHJ9	Ken Thomas	I have to imagine it is excellent, it being a birthday present to my ex. She has a number of Video collections, but not this one.	5.0	Birthday present for my ex-wife who is a history buff	2013-11-24	0	0	0
6301996135	The Civil War - A Film by Ken Burns (Boxed Set) [VHS]	A311GKVQNN9DJE	Kent Wiedel	Great production.  I like the old photos and quotes	5.0	Great Civil War show	2014-07-06	0	0	0
6301996135	The Civil War - A Film by Ken Burns (Boxed Set) [VHS]	A1ZGAZLH9K711I	Keonyn	One of the most memorable and well done documentaries of our day. Ken Burns mastery of storytelling using little more than authentic still photography and camera panning and voice overs has given us an 11 hour documentary on the definitive war of our country that has remained unsurpassed for nearly 20 years.The film uses a great deal of authentic photography from the war and excerpts from journals and letters written during the war read by a cast of amazing voice actors who sound so authentic in the language of the day and emotion that you'll swear you were hearing the voices of the real people from beyond the grave. David McCullough lends his voice to the narration of the documentary and does it as well or better than any other narrator I've heard in either film or documentary.The series covers nearly every relevant part of the war from the years leading up to it to the years following it. By using journals and letters written by people from that era it gives you a great insight in to how people saw the war and how it impacted their lives. The series isn't completely analytical so you won't find a step by step analysis of every battle fought, frankly, that would get a little dull anyhow. It does cover the key events of the war and then some though it does leave out a few, most notably the secession of West Virginia from the confederacy which doesn't even get a mention.It's few faults hardly drag it down though as it did so much so well. This series provides an unsurpassed insight in to this great war and really examines the human element to it while still providing a decent tactical analysis as well. It's an amazing piece that manages to provide 11+ hours of interesting footage despite relying on still photos, interviews and voice actors reading material from the period. This is a must have for any Civil War buff or fan of documentaries.	5.0	A masterpiece of simplicity	2008-02-15	2	2	0
6301996135	The Civil War - A Film by Ken Burns (Boxed Set) [VHS]	A3ASRZSJQP7J0J	Kerry Simpson	Perfect for any Civil War buff. He can watch it over and over again. Makes it come to life after visiting Gettysberg.	5.0	Awesome	2013-10-18	0	0	0
6301996135	The Civil War - A Film by Ken Burns (Boxed Set) [VHS]	A8A7P7B1T33EY	Kevin C. Siqveland	If you have not seen this, see it. Becuase once you see it, you will want to own it, and then own a bunch of other Ken Burn's stuff.	5.0	Best Documentray of the Civil War EVER!!!	2003-09-04	7	0	7
6301996135	The Civil War - A Film by Ken Burns (Boxed Set) [VHS]	A1NXMFNATC8PUC	Kevin M. House	The Civil War series was the greatest documentary of our day telling the story of America through archival footage. Great story.	5.0	Civil war	2013-05-11	0	0	0
6301996135	The Civil War - A Film by Ken Burns (Boxed Set) [VHS]	A2I4XTWSQI730R	Kevin Olson	If you haven't seen this documentary series before, do yourself a favor and sit down and  watch it.  Informative and entertaining.	5.0	Obviously excellent	2014-03-02	0	0	0
6301996135	The Civil War - A Film by Ken Burns (Boxed Set) [VHS]	A3CPWE00CC6Q1B	KFL	I have seen the critical remarks regarding this film.  True, not all material could be included...unless filmakers wanted to exceed the 11 hours that this documentary already comprises.  This is a stirring masterwork which features master historians with the powers of captivating story -- Shelby Foote, Ed Bearss, and others.  Giving renewed life and voice to those who have passed on, the drama of this timescape is carefully unfolded.  It is filled with struggle, humanity, and grace.  If I could afford the collector's box set, I'd own it...but it's a tad expensive.  If you can afford it, buy it -- it will be a set that you often revisit.  If you can *really* afford it, buy me a copy.  :)	5.0	Shelby Foote and Ken Burns Resurrect the Dead	2006-04-17	14	11	3
6301996135	The Civil War - A Film by Ken Burns (Boxed Set) [VHS]	AUP28B029RT6A	kickns	Should be required viewing in all American high schools.  It is worth watching just to see Shelby Foote.  His anecdotes helped make events of 150 years ago seem as if they happened yesterday.	5.0	Required Viewing	2013-07-14	0	0	0
6301996135	The Civil War - A Film by Ken Burns (Boxed Set) [VHS]	A16ZB0PR9V6TJ8	kikeo58	Ken and Rick Burns created a new genre of documentary film making starting with this award winning series. It is amazing.There is so much to say about the story that was told about the civil war.  It continues hour after hour watching this sad drama unfold.If I would summarize it in a too short statement,I would quote Robert Kenney who in turned told us a quote,  &#34;My favorite poet was Aeschylus. He wrote: 'In our sleep, pain which cannot forget falls drop by drop upon the heart until, in our own despair, against our will, comes wisdom through the awful grace of God.'&#34;That applies in too many places in our history.	5.0	History making history.	2013-09-14	0	0	0
6301996135	The Civil War - A Film by Ken Burns (Boxed Set) [VHS]	A3E7FRLYDAN9QK	Kim	My husband is a Civil War buff and Ken Burns does such a great job in his film making and this one is excellent.  We are very happy with this DVD set.  Price was reasonable.	5.0	Great documentary	2013-01-10	0	0	0
6301996135	The Civil War - A Film by Ken Burns (Boxed Set) [VHS]	A2QOW5INFXEGX1	"Kimi & Steve's Mom ""stillsexy50"""	I love this set! Even though they did not cover ALL the battles as completely as I think they should have. I mean it IS a documentary. And this was an important part of American history.  There was no mention about the battles west of the Mississippi. Or if there was, they were quickly dismissed. The issues of European involvement were ignored. The importance of blockade-running was not given much time. The almost one-sided technological advancements made during this war barely mentioned. The anti-war movements in North and the South forgotten. But the music....so moving. The letters and still photos used to give you a sense of the battles and the feelings and thoughts of the soldiers and civilians caught up in such a terrible time makes this worth watching. If you are looking for a faultless complete telling of the Civil War you will be disappointed. But I still recommend this set.	5.0	An Emotionally Moving Documentary	2013-09-22	0	0	0
6301996135	The Civil War - A Film by Ken Burns (Boxed Set) [VHS]	A2Y17GY5DLL4N7	Kim Petrie	Ken Burns' Civil War, tells the story of this tumultuousness time in our history via the voices of those that lived it with the wisdom only the space of time and analysis can provide.  A masterpiece.	5.0	History as told by our families	2011-05-24	0	0	0
6301996135	The Civil War - A Film by Ken Burns (Boxed Set) [VHS]	A346S9BAWOXJDH	K. Jacob	I have see the entire series 4 times. Expertly documented with photography and richly crafted letters from those experiencing the war first hand. Can I say more...	5.0	Best war documentary ever	2013-03-07	0	0	0
6301996135	The Civil War - A Film by Ken Burns (Boxed Set) [VHS]	A1QJHZUUMKZYZG	"K. J. Bryant ""peachycream"""	...but I have seen better. Mr. Burns' contributions to helping the public understand the Civil War cannot be measured. He has taken this war and broken it down in the simplest forms. He has put faces on the faceless. He has told the stories of the nameless fighting men. He has helped us understand the famous figues of the War (such as Grant, Lee, Jackson, Sherman, Lincoln and Douglass).However, Burns is one-sided in telling the whole story. He is more interested in the events that happened in the East (example Gettysburg). However, events that happened in the West is just as important. I wanted to learn more about Grant's success in the West and the fall of Vicksburg. I wanted to learn about the Generals of the West, such as Thomas, Johnston, Hardee, Howard and even the folliest of generals Braxton Braggs and John Bell Hood.This documentary is a great start, but I suggest looking into other Civil War films that tells the complete story from BOTH fronts.	5.0	Excellent Documentary....	2008-03-09	3	2	1
6301996135	The Civil War - A Film by Ken Burns (Boxed Set) [VHS]	A32B2H022Y6DRR	"K. J. Fry ""Inverness"""	I had this set on Laser Disc some years back and now have bought the series on R2 DVD. I now wish I had bought the R1 version as this has many extras spread over 5 DVDs.This would have cost a lot more than the 23.00 I bought it for but if your a fan then it would be worth it.	5.0	The Best of American Television.	2010-07-25	2	1	1
6301996135	The Civil War - A Film by Ken Burns (Boxed Set) [VHS]	AR1J19NKQB7HT	K. Kane	My husband and I have been watching this with our almost 8-year old son.  We learn more everytime we watch it.  It is so well written, filmed, and acted.  Having interviews with Shelby Foote is worth the price of admission alone!	5.0	Truly the best Civil War documentary	2014-06-25	0	0	0
6301996135	The Civil War - A Film by Ken Burns (Boxed Set) [VHS]	A2L15YC7QA7MQ8	"KKB54 ""Keith B"""	Makes one appreciate the growing pains of our Nation. It shows the strength of the fabric of our people and the suffering it took to be the country we are today. This is why we can be &#34;Proud to be Americans&#34;	5.0	Our Country History	2013-09-04	0	0	0
6301996135	The Civil War - A Film by Ken Burns (Boxed Set) [VHS]	A1V4KP2TYXHLEY	Kleiber1	This is a classic.  Balanced but with an emotional content and plenty of information about the Civil War that you thought you knew but didn't.  I still love watching this masterpiece!	5.0	Every American Needs To Watch This	2013-05-29	1	1	0
6301996135	The Civil War - A Film by Ken Burns (Boxed Set) [VHS]	A1SVH87LULFM3L	Kman	Anyone who watches this will have the level of their patriotism tripled. Those who don't like it should be deported.	5.0	Required viewing	2013-08-25	0	0	0
6301996135	The Civil War - A Film by Ken Burns (Boxed Set) [VHS]	A3UT8IDC5GQ07P	"Kristin Pike ""App State Alumni"""	Ken Burns' The Civil War is one of the best documentary series around. It does an amazing job of covering what led up to the war, the war years and what followed immediately after. The music is outstanding and the David McCullough is superb as always.	5.0	Among the best	2011-05-12	2	1	1
6301996135	The Civil War - A Film by Ken Burns (Boxed Set) [VHS]	A1HCV3MXY5QJGM	K. Sargis	I'm a changed person after learning more about this part of our country's past. Gut wrenching, inspiring, I was moved to tears many times.  Americans fighting Americans.  No wonder it went on so long, neither willing to give up what they believed in.	5.0	We'll worth it...	2014-01-03	0	0	0
6301996135	The Civil War - A Film by Ken Burns (Boxed Set) [VHS]	A14BTJRH9VNLJJ	Kurt A. Johnson	"This is without a doubt the best documentary on the Civil War that I have ever seen! It is divided into nine episodes, which cover the war from its root causes, through the war years, and on to the aftermath of the war. Along the way, the viewer is treated to many interesting interviews, wonderful music, and interesting quotes from the era, voiced by a wide arrange of voice talents.Overall, I found this a fascinating and moving documentary. Indeed, it is so well done that I have no trouble describing it as a ""viewing experience."" I liked every part of it, especially the music and the interesting voices that populate it.If you are at all interested in the American Civil War, then I am very confident that you will like this documentary. Whatever you do, make sure that you see Ken Burns' Civil War!"	5.0	A viewing experience	2013-07-16	1	1	0
6301996135	The Civil War - A Film by Ken Burns (Boxed Set) [VHS]	AEMMMXWT8L8I5	kurt	I Love every second of  Ken Burns work he is by far the best documentary producer ever. Thanks very much.	5.0	great	2013-10-17	0	0	0
6301996135	The Civil War - A Film by Ken Burns (Boxed Set) [VHS]	A261Y7KB3MYE3B	K. Vanaria	Outstanding series.  Very well done, not overly-Hollywood.  It is a favorite of our family and one we would recommend to others.	5.0	Another Ken Burns Classic	2013-03-24	0	0	0
6301996135	The Civil War - A Film by Ken Burns (Boxed Set) [VHS]	A2G3TTE78B0KM4	kwrin1	I've seen this film before but this time was able to see it without waiting a week in between.  It was a wonderful film and helped me understand what happened during the civil war.	5.0	Great film	2013-03-20	0	0	0
6301996135	The Civil War - A Film by Ken Burns (Boxed Set) [VHS]	A3UUGLHF18RD08	Kyle Stephenson	kens burns the civil war should be a manditory view for all young americans.the most entertaining and informational documentry i have ever seen.	5.0	ken burns civil war	2009-05-20	0	0	0
6301996135	The Civil War - A Film by Ken Burns (Boxed Set) [VHS]	A3UFBY71WMQ3ZZ	KZ	great historic presentation.  rather long, but worth the time.  I live in the area, where some of the battles occurred and as I pass by the sites, I remember the suffering and death that occurred and the great human loss on both sides.	5.0	phenomenal	2013-05-22	0	0	0
6301996135	The Civil War - A Film by Ken Burns (Boxed Set) [VHS]	A1KB5A2ZEMT8H3	Lana Larue	This documentary is fabulous.  Unfortunately, the quality of the instant video is frustrating.  The audio and video freeze both alternately and at times together.  If you can be patient, it is definitely worth it.	5.0	Trouble with video streaming	2013-07-19	1	1	0
6301996135	The Civil War - A Film by Ken Burns (Boxed Set) [VHS]	AY3QMFN1FNHJL	Lance Hebert	Great film by a great filmmaker. I loved the way that the music was so well incorporated into the movie.	5.0	Great Film!!	2013-07-24	1	1	0
6301996135	The Civil War - A Film by Ken Burns (Boxed Set) [VHS]	A3SNXONBX91DQ	Lan	This is an excellent series and I enjoy watching it on Prime!! I highly recommend it. It is factual and very interesting!	5.0	Civil War Series	2014-01-08	0	0	0
