asin	title	reviewer_id	reviewer_name	review_text	rating	summary	review_date	total_votes	helpful_votes	unhelpful_votes
6301996135	The Civil War - A Film by Ken Burns (Boxed Set) [VHS]	A3CEC4N9P7346K	"70's teen ""a fan"""	It covers everything from the military to the social to the political aspects of the war. It also relates much about the individuals involved, both famous and lowly.  Highly recommended!	5.0	Balanced and Comprehensive	2013-06-13	0	0	0
6301996135	The Civil War - A Film by Ken Burns (Boxed Set) [VHS]	AE0PNM6ULGPIG	"Ababykitty ""ababykitty"""	This is THE best documentary I have EVER seen! It's a must have for everyone!It is not just for Civil War buffs.	5.0	OUTSTANDING DOCUMENTARY	2009-06-15	0	0	0
6301996135	The Civil War - A Film by Ken Burns (Boxed Set) [VHS]	A2Y2M2QJE065RG	abrems	Very good work by Burns I recommend it to anyone wanting to know more about the Civil War, it would have been better if it showed the after effects  of the war	4.0	Very Good	2014-02-02	0	0	0
6301996135	The Civil War - A Film by Ken Burns (Boxed Set) [VHS]	AOCR7ALLAGGI3	A. Chapa	The Civil War: A Film By Ken Burns is an essential must watch. A very insightful series that balances the brutality of war and the immoralities of slavery in a story telling narrative.	5.0	Favorite Ken Burns series	2013-09-06	0	0	0
6301996135	The Civil War - A Film by Ken Burns (Boxed Set) [VHS]	A3JBU5HTNR52FI	A Customer	not an excellent movie ok to watch onc.e	3.0	The Civil War - A Film by Ken Burns	2005-02-08	217	8	209
6301996135	The Civil War - A Film by Ken Burns (Boxed Set) [VHS]	A3HQ5CWXZJXF8J	Adam Platts	"""The Civil War - A Film by Ken Burns"" ranks right up there among the best documentaries of all time.  Years after its initial release, the images, music, and voices still tell one of the most powerful American tales of civil discord and strife in US history.  The film can be utilized in a variety of educational settings ranging from classroom instruction to personal interest.  All Americans should know the story of how the US was divided over the issue of slavery, of how so many died fighting for what they believed in, and of how the Republic continued to stand as the last best hope of Earth.Review by: Adam Platts"	5.0	The Civil War - an excellent documentary.  Review by: Adam Platts	2007-01-11	5	4	1
6301996135	The Civil War - A Film by Ken Burns (Boxed Set) [VHS]	A2560TI104JMNG	Adrienne Moira	a slow walk through the civil war that leaves the viewer with an understanding of the enormity of the stakes, the costs and the sacrifices that were paid by all.	5.0	beautifully detailed...	2013-07-16	0	0	0
6301996135	The Civil War - A Film by Ken Burns (Boxed Set) [VHS]	A181YNRHCHJ46Z	AEB	He made the history very compelling and interesting. I would recommend this to anyone wanting a more intimate glimpse at this time period.	5.0	A personal perspective on the Civil War	2013-09-05	0	0	0
6301996135	The Civil War - A Film by Ken Burns (Boxed Set) [VHS]	A1Y72YN5TCS8VM	Airedale73	Ken Burns is an incredible filmmaker.....The Civil War is by far the greatest program I have seen regarding America's struggle against slavery, state's rights, and the insurmountable sacrifice taken to preserve the freedom of all men and the unity of this great country. It is, in my opinion, the Titanic of all American Civil War documentaries.	5.0	Filmmaking at its Best!!!	2013-09-15	0	0	0
6301996135	The Civil War - A Film by Ken Burns (Boxed Set) [VHS]	A3BWVS6VS7MXB3	"A. J. Vivolo ""A.J."""	"This particular series follows the civil war mainly from the perspective of the southern historian Shelby Foote. Mr. Foote has written extensively on the civil war, but has gone to great lengths to present the civil war as a conflict between ""states rights versus federal rights"" rather than the conflict between the economic model of southern plantation slavery versus northern wage workers. Great lengths are taken to white wash slavery and the extreme poverty of most southern whites. Battles and anecdotal stories are focused upon rather than the events that actually pertained to and promoted the conflict. Most of what made the civil war actually happen is not discussed. As with most histories that follow the lead of Mr. Foote, great lengths are taken to justify southern succession and uphold the southern way of life and southern slavery as some how noble."	2.0	Lacking in Depth	2013-08-02	3	0	3
6301996135	The Civil War - A Film by Ken Burns (Boxed Set) [VHS]	AAZRWLML88IZK	A kids review	An absolute must, Ken Burns's The Civil War is one of the greatest historical documentaries ever done, and should be seen by one and all.	5.0	Ken Burns: The Civil War	2011-11-13	0	0	0
6301996135	The Civil War - A Film by Ken Burns (Boxed Set) [VHS]	ABNTPQ26GQH85	alana scearce	II have enjoyed this series since it came out in the 90s and I continue to do so.  The photography is excellent,  the interviews are helpful and it makes one realize how horrific it all was.	5.0	I love it.	2013-03-05	0	0	0
6301996135	The Civil War - A Film by Ken Burns (Boxed Set) [VHS]	A1R6E20VJSJRFB	Albert C	I am not through it yet. I set time aside to watching this and I really enjoy it. It puts me there and gets me thinking how it was back then. I look at how things are today and the &#34;reasons&#34; we have conflicts and go to war. Back at that time, this country did establish itself and must have given hope to many around the world that people and governments can set things straight when they go off their original set of good goals and purpose. This country is or can be a good one again. We need take a look at what is the greatest good for all and work towards that. Then everyone, or most, around the world will benefit from it. What I mean is that every people should find what is right for them and work towards it but keep in mind that there are others out there and they should have that same right. The greatest good for the greatest number is what we all should work towards. We are capable  of doing that and we should.	5.0	This is how to tell history.	2013-06-26	0	0	0
6301996135	The Civil War - A Film by Ken Burns (Boxed Set) [VHS]	A1SIAYBACOZ0P9	albert ratzlaff	I first viewed this series on PBS and thought it was great.  I love having the complete set on DVD and this way I can view it anytime.  This is possibly the best documentary on the Civil War out there.  Highly recommended.	5.0	Best documentary on Civil War	2013-01-30	0	0	0
6301996135	The Civil War - A Film by Ken Burns (Boxed Set) [VHS]	A1VH489II5LUHI	Alfred Peter John Barr	Ken Burns documentry is a fantastic effort in research- use of lot of photos with Words and details of eventsof those years. A sad time in American History.  A job well done Ken Burns  Kindest Regards A Peter J Barr	5.0	CIVIL WAR	2014-01-22	0	0	0
6301996135	The Civil War - A Film by Ken Burns (Boxed Set) [VHS]	A3DQDXWLYKHPEZ	Alice M. Andolina	I ordered this for a birthday gift for my daughter in law who is a history major. I Just now got around to watching it, and it is corrupted. I wasted my money. I will not purchase from this person again.	1.0	poor	2012-08-09	32	1	31
6301996135	The Civil War - A Film by Ken Burns (Boxed Set) [VHS]	A2V40R97RU5NAB	Allan W. Goodall	Ken Burns' Civil War is an excellent introduction to the period, told well with style. It's a documentary, not a history book. It is, however, far more accurate and balanced than other Civil War documentaries (such as the History Channel's Civil War Journal).To hit on a couple of criticisms in other reviews, slavery as a cause of the Civil War is an argument bordering on the level of a holy war, itself. Recent magazine articles and essays have done a good job of discussing it. The result is that both Burns' view and the &quot;Burns' is wrong, it was all about states rights&quot; views are both simplistic. Burns' documentary does a good job of capturing the Southern view of slavery and abolition but he does over state the view of the north as abolitionist. While there were Southern abolitionists and Southern soldiers who didn't care one way or another, Burns shows quite well that without slavery there would have been no war. (The statement that the South only fought for &quot;states rights&quot; was actually championed in the 1880s. If states rights were the only reason for fighting the war, why did the Confederate Constitution prevent any Confederate state from passing a law against slavery, even if that state wanted to abolish it?)To the point of Grant being the first Lt. General since Washington, Burns is both right and wrong. Winfield Scott was made Lt. General, but it was a brevet (something a little more than honorary) rank. It was a brevet specifically so that Washington would be the only man to have officially held that rank. This changed when Grant was given the rank.	5.0	Excellent Introduction	2001-10-31	7	3	4
6301996135	The Civil War - A Film by Ken Burns (Boxed Set) [VHS]	A3E8WIQ3T6FYCH	Alyssa J.	This series is the perfect gift for any Civil War fan! The documentary is informative, entertaining, and will appeal to any history buff!	5.0	The perfect gift	2012-06-16	2	1	1
6301996135	The Civil War - A Film by Ken Burns (Boxed Set) [VHS]	A19EIEZUMSLTG7	"Amazon Customer ""bluegoose@thespark.com"""	Watched this when originally aired on PBS.  Even better the second time around.  Brilliant images and stories of the war years.	5.0	True Masterpiece	2014-07-11	0	0	0
6301996135	The Civil War - A Film by Ken Burns (Boxed Set) [VHS]	A2X231MN6QRVPZ	"Amazon Customer ""finnwolf308"""	A must have for any one interested in the Civil War.The photo's,music and commentary are some of the best.	5.0	The Civil War by Ken Burns	2002-11-25	3	0	3
6301996135	The Civil War - A Film by Ken Burns (Boxed Set) [VHS]	A28QXXPIGR7OQT	"Amazon Customer ""Happy Lady"""	Very educational and informative.  I am watching it again after seeing the movie Lincoln to get more background information. I like the commentary of the experts, particularly Mr. Shelby Foote.  He obviously has studied the period and provides great antedotes.	5.0	Best documentary.	2013-04-09	0	0	0
6301996135	The Civil War - A Film by Ken Burns (Boxed Set) [VHS]	A8Z9PDIAFAHN0	Amazon Customer	An amazing presentation of history, in a way that evokes the spirits of the people who lived through that time.  Every American should watch this at some time in their life.	5.0	An amazing presentation of history	2014-07-07	0	0	0
6301996135	The Civil War - A Film by Ken Burns (Boxed Set) [VHS]	AC2FUKTLQSSHB	Amazon Customer	Breathtaking, if you only ever watch one civil war documentary make this the one. Brilliantly researched and presented, will watch it again and again.	5.0	Magnificent Series!	2013-04-17	0	0	0
6301996135	The Civil War - A Film by Ken Burns (Boxed Set) [VHS]	A380LE7DEMPSFT	Amazon Customer	I love American history. This was, and will always be, important in understanding America.  The documentary humanized this very well.	5.0	ver Enjoyable and Engaging	2013-08-17	0	0	0
6301996135	The Civil War - A Film by Ken Burns (Boxed Set) [VHS]	A25V91I4ATXUHJ	Amazon Customer	I love it	5.0	Five Stars	2014-07-09	0	0	0
6301996135	The Civil War - A Film by Ken Burns (Boxed Set) [VHS]	ATMW94KKUDUVO	Amazon Customer	Ken Burns documentaries are the standard by which all documentaries should be measured!  The film is endlessly fascinating!  I would highly recommend it!	5.0	Great Movie!	2014-03-20	0	0	0
6301996135	The Civil War - A Film by Ken Burns (Boxed Set) [VHS]	A1RZS71WR8M0ZM	Amazon Customer	Lack of special effects but this is what put Ken & Company on the map. Treatments of Grant and Lee are especially well done, Worthwhile  and educational.	5.0	Outstanding!	2014-05-30	0	0	0
6301996135	The Civil War - A Film by Ken Burns (Boxed Set) [VHS]	A19D5QX33M48NU	Amazon Customer	This is one of the best accounts of the Civil War I have ever seen. If you want an interesting and informative account of the people and events of the Civil War, this series is for you.	5.0	Great documentary	2013-12-07	0	0	0
6301996135	The Civil War - A Film by Ken Burns (Boxed Set) [VHS]	AH7H9NL7K0VW5	Amazon Customer	This is one of the best and most important TV series ever!  Lest we forget the sacrifices made by previous generation of Americans who risk everything for a noble cause.	5.0	Maybe the best and most important TV ever!	2014-02-02	0	0	0
6301996135	The Civil War - A Film by Ken Burns (Boxed Set) [VHS]	A2AYFVAXG7K21U	Amazon Customer	This series covers everything and is much more than I ever learned in school history. Gives a more in depth look at what was making Lincoln tick. Covers the human aspect of war well.	5.0	Great series	2014-06-27	0	0	0
6301996135	The Civil War - A Film by Ken Burns (Boxed Set) [VHS]	APJR86X6IB4QV	Amazon Customer	This set of DVD's bring history to life through the lives of those who lived it. Every student should view this in school, too.	5.0	Fantastic	2013-12-07	0	0	0
6301996135	The Civil War - A Film by Ken Burns (Boxed Set) [VHS]	A3E6Z2V1PZ5W31	Amazon Customer	This was a gift to someone who loves history and heard about Ken Burns projects. Put a big smile on the face and was ready to watch it!	5.0	History buff	2012-12-28	0	0	0
6301996135	The Civil War - A Film by Ken Burns (Boxed Set) [VHS]	A2A8CSDY94ZERA	Amazon Customer	Ken Burns Civil War special is the best, most riveting documentary I have ever watched on TV.  This is where all the meaningful intellectual TV shows come from - PBS.	5.0	To all you naysayers - This is why Public TV should exist	2011-03-27	1	1	0
6301996135	The Civil War - A Film by Ken Burns (Boxed Set) [VHS]	A21IDSK9RSLEHT	Amazon Customer	Even if you turned down the sound and just watched the pictures for 10 hours, this would still be the best documentary ever made about the Civil War.  The photographs that Ken Burns has found and the way he uses them tell the stories in ways never done before.  Add to that superb narration, excellent voice acting (including Sam Waterston, Morgan Freeman, Jason Robards, and many more), engaging historians, and a perfect soundtrack and this series is a must see.  This is Ken Burns at his best.  It's not perfect, and there are a few inaccuracies, but the power and emotion that is drawn out through this series is something everyone should experience.	5.0	The Absolute Best Civil War Documentary	2011-06-05	9	8	1
6301996135	The Civil War - A Film by Ken Burns (Boxed Set) [VHS]	A1UN7T6NTARY43	"Amazon Customer ""John J."""	The best. I think he out did himself this time! A great account of the Civil War battles and history.	5.0	the best of Ken Burns	2013-10-24	0	0	0
6301996135	The Civil War - A Film by Ken Burns (Boxed Set) [VHS]	A28HR4HEPIWGCA	"Amazon Customer ""tienandtu"""	Was glued to my TV as a kid when this first aired.  It's revisit it after all these years.  Still great and a must watch for history buffs.	5.0	Amazing documentary	2014-04-10	0	0	0
6301996135	The Civil War - A Film by Ken Burns (Boxed Set) [VHS]	AKCA7PSZ6UEOW	amazon	Have always enjoyed the documentaries produced by Ken Burns; this epic saga on the Civil War is detailed, yet not drawn out and boring.  Very educational and thought-provoking.	5.0	awesome	2013-06-24	0	0	0
6301996135	The Civil War - A Film by Ken Burns (Boxed Set) [VHS]	A2M0JOQWQ0KAJO	"Amazon Reviewer ""David"""	I have owned this product since its initial offering.  Just purchased this one as a Christmas gift for my Son-in-Law who requested it.  He enjoys it now as much as we do.  Great piece of history that we should continually review so we don't head down the same slippery slope of repeating ourselves.	5.0	David	2012-02-27	4	4	0
6301996135	The Civil War - A Film by Ken Burns (Boxed Set) [VHS]	AJUX18TV7KTNX	"Amber M. Johnson ""amber"""	It got to me in about a week from ordering it, my boyfried alrady has the WAR and is obsessed with it and he wanted the Civil war so i got it for him for christmas :)	5.0	christmas present!	2009-12-11	1	0	1
6301996135	The Civil War - A Film by Ken Burns (Boxed Set) [VHS]	AQZUULF5AVUI5	"AmFan ""Theresa"""	I've seen other shows about our Civil War, but this is very well done and is the best one I've had the pleasure of viewing. Ken Burns combines narrator, historians, writers, music, and photos very effectively to keep it interesting. Episode 5 had Daisy Turner, who is the daughter of freed slaves, reciting poems!I learned a great deal from this series and I would strongly recommend this series for anyone interested in American history.Watched this through my Roku2 XS (purchased on sale at Amazon about a year ago) on my Amazon Prime. What a convenient set up!	5.0	Best series about The Civil War	2013-05-10	0	0	0
6301996135	The Civil War - A Film by Ken Burns (Boxed Set) [VHS]	A2LSSXQTJL5ITH	A mom	I read killer angels and watched this.  It helped clarify things.  I really liked it, it seemed to be unbiased and just facts.  Great history.	5.0	Very insightful	2013-10-30	0	0	0
6301996135	The Civil War - A Film by Ken Burns (Boxed Set) [VHS]	A1C7K2DBBK8X4L	Andrea Ebert	I received this order very quickly and enjoyed it very much.  Ken Burns really knows how to tell the story.  It is very enlightening and extremely well done.  Anyone interested in the how and why of the Civil War should see this brilliantly done documentary.  I especially liked listening to Shelby Foote, a writer, whose insight and knowledge of the time is outstanding.  I am so glad to have purchased this film.	5.0	LOVE IT!	2013-05-28	1	1	0
6301996135	The Civil War - A Film by Ken Burns (Boxed Set) [VHS]	ACBI3EFZ3S1K8	Andre Landrum	An excellent style of documentary of a tragic time in U.S. history. However many details are lacking. Just as a for instance, the details about the battle of Culp's Hill and also Picket's charge at Gettysburg and what about the where abouts and movements of general J.E.B. Stuart at that time. I jut feel that more time should have been given to this pivotal battle epic that lasted for several days. ALso if it had not been for the outstanding comentary contributions of Shelby Foote, this entire series would have fallen flat on its face. Foote did an outstanding job and made the series MUCH more enjoyable.	5.0	Excellent documentary presentation wise, yet missing many details	2013-07-27	1	0	1
6301996135	The Civil War - A Film by Ken Burns (Boxed Set) [VHS]	A172CYZLP7ETSP	"Andy Morrison ""A2Video.com"""	Amazon Prime is poorly organized and it's tough for me to find this, but when I do I enjoy it.  I wish they were more like Netflix and brought up previously viewed series, to make it easier for me.Oh well.	5.0	This is great if you can find it	2014-02-18	0	0	0
6301996135	The Civil War - A Film by Ken Burns (Boxed Set) [VHS]	A3QNV0PQN7AOBP	AngelofMercy	I have seen this series at least six times. Each time I watch I am just awestruck by the quality of these films. The narration and the photography has taught me more than any book I've read or course I've taken on American history and the Civil War. I am no scholar on the Civil War, just an ordinary person who has an extraordinary interest in the time period.	5.0	A truly epic series	2010-02-01	1	1	0
6301996135	The Civil War - A Film by Ken Burns (Boxed Set) [VHS]	A1CVYEE9L7FVAK	Anita	excellent presentation. I do not consider myself having an interest in history but this changed my mind and held my attention.	5.0	excellent presentation. I do not consider myself having an ...	2014-07-06	0	0	0
6301996135	The Civil War - A Film by Ken Burns (Boxed Set) [VHS]	A1SNAGLEXC46EZ	anm108km	This is a great presentation.  It's a vivid memoir of a nation divided and of the events that took place 150 years ago that effect us all yet today.	5.0	The CIvil War DVD	2011-02-02	0	0	0
6301996135	The Civil War - A Film by Ken Burns (Boxed Set) [VHS]	A2TJFCE6INWTKD	Anne	I've tried to read several books about the Civil War to no avail.  They didn't engage me and I soon abandoned reading. This series of documentaries was exciting, informative and I couldn't wait to advance to the next one.	5.0	Most comprehensive Civil War history	2013-09-06	0	0	0
6301996135	The Civil War - A Film by Ken Burns (Boxed Set) [VHS]	A1X5KR9MNTZTLT	Ann Harrell	It is a compelling and detailed account of the Civil War Battles. You do not want to stop watching it. The music feels as if you are transported back in time stirring up  such deep emotions within yourself and engages you in a way as if you are there in that moment of time.	5.0	Stirs up deep emotions and engages you with that momen	2013-12-13	0	0	0
6301996135	The Civil War - A Film by Ken Burns (Boxed Set) [VHS]	AFINXGXJVOKYG	annie	How can war justify death, carnage, and humiliation? When will we find ways to resolve conflicts without resorting to violence?Both North and South voiced cause for their point of view and held firmly to them regardless of the consequences. How can revered men of worthy principles be so blind and unyielding? How can military genius's be so ignorant? How can elected politicians be so heartless? I found this historical account of our 'bloodiest war' to be well produced and narrated without prejudice. But it only reminds me of the more recent history and current events that have led us back into the abyss of darkness. Let it end now.	5.0	War no more	2014-07-04	0	0	0
6301996135	The Civil War - A Film by Ken Burns (Boxed Set) [VHS]	A3HTVK5NUEP1IX	Ann Junor	One of the best documentaries ever. We saw it when it was first made and loved it and of course the music too.	5.0	Wonderful personalised account of a tragic war.	2012-12-21	0	0	0
6301996135	The Civil War - A Film by Ken Burns (Boxed Set) [VHS]	A3FC29N63XEK5U	anonymous	Just another brilliant piece of work from Ken Burns.  I've watched the documentary through several times and no doubt will watch it through several more times in the future.	5.0	Brilliant	2014-04-24	0	0	0
6301996135	The Civil War - A Film by Ken Burns (Boxed Set) [VHS]	A3LEHWTLKBNVOP	anonymous	Very gripping and informative. Nothing overlooked and a perfect guide to learning about the Civil War thru the eyes of the soldiers, their letters and other sources during this most terrible and historic time in US history. Definitely a keeper to save for when the kids grow up and learn about this war during high school.	5.0	By far the best all around Civil War documentary.	2007-10-25	0	0	0
6301996135	The Civil War - A Film by Ken Burns (Boxed Set) [VHS]	A2YJPMB4ORMIKP	arizona	I had wanted this series since it first came out and was very pleased with it. The only drawback was having 2 episodes on each DVD, which was a little annoying to keep your place in the series.	5.0	civil war	2013-01-16	1	1	0
6301996135	The Civil War - A Film by Ken Burns (Boxed Set) [VHS]	A1KWKQ3C2VD3VJ	Arla Sage	This is fantastic as it was when I saw it when it first aired. An enthusiastic two thumbs up!! Watch it!	5.0	Civil War....you are there	2013-05-17	0	0	0
6301996135	The Civil War - A Film by Ken Burns (Boxed Set) [VHS]	A3KP81PWE0JH5E	ARMOND	WHAT MORE CAN BE SAID ABOUT THIS CIVIL WAR DOCUMENTARY.  THIS IS THE KIND OF MOVIE THAT COULD TAKE A PERSON WITH NO INTEREST IN THE CIVIL WAR AND TURN THEM INTO CIVIL WAR ENTHUSIASTS.  IT IS SO GOOD I WOULD RECOMMEND GETTING TWO OF THEM(IN CASE SOMETHING HAPPENS TO YOUR FIRST ONE).  GOD BLESS YOU MR. KEN BURNS FOR A WONDERFUL DOCUMENTARY!	5.0	ARMOND	2010-11-15	0	0	0
6301996135	The Civil War - A Film by Ken Burns (Boxed Set) [VHS]	A34YAJI41IJ4ZX	Arnold D Olson	Was more complete than expected. Nice to have the full version. Will look for more videos that meet our interests.Thank you.	4.0	Ken Burns Civil War	2013-01-23	1	1	0
6301996135	The Civil War - A Film by Ken Burns (Boxed Set) [VHS]	AFDYHKAH8AJDT	A. Sloan	"I used to watch documentaries with my dad when I was growing up from time to time.  Being African American and from the deep deep South (both parents from the Atlanta area) we never really watched the ones having to do with the Civil War or Black perspective because they tended to be slanted one way or the other.  I never wanted to see those kind of documentaries and my parents had such pained expressions on their faces whenever something of that nature was on tv it just wasn't worth it to me.  Seeing as my parents lived such trying times day to day when they were growing up, I guess they could never be interested in other's views since they lived it.Both my parents passed unexpectedly 2 months apart from each other my mother dying after my father. (This documentary originally aired literally days after my fathers passing.)  I know I was in shock from his loss at that time otherwise I never would have watched, but since it reminded me of watching documentaries with my him I watched it.....then I became captivated.The presentation rang so true, because it wasn't just opinion from the modern viewpoint feeding us information from their own perspective. There were period photos, correspondence, diaries from actual people and Good Lord...the MUSIC was wonderful.  Things from North and South, White and Black woven throughout giving authenticity to the series. It was like a tapestry.  ALL sides were never ever presented as a whole to see why things were as they were.  Especially in such an eloquent manner. Although I in no way agree with why any Southern slave holders (not just White,  but there were Native American and Black as well) felt the way they did, I began to understand that this was all they knew since the time this country began. Slavery was not aggressively addressed then because it was too divisive.Because slavery was too painful to speak of it was never examined in my household. It truly changed me, I HAD to know more.  Then when the movie ""Glory"" came out on video shortly afterwards I was a goner.  I became a true Civil War buff.  This is honestly a truly perfect documentary that should have been named ""The Real Civil War"" God Bless you Ken Burns."	5.0	"""The Real Civil War"" !  Thank you Ken!"	2005-06-29	61	59	2
