asin	title	reviewer_id	reviewer_name	review_text	rating	summary	review_date	total_votes	helpful_votes	unhelpful_votes
0767002652	Upstairs Downstairs - The Premiere Season [VHS]	A242WNGLDEVNCB	Joan E	I really like it. Downtown abbey is a favorite and am enjoying this one as much. I am a fan of English series  and appreciate being able to have them streamed to my kindle fire.	5.0	really enjoying it.	2013-09-13	0	0	0
0767002652	Upstairs Downstairs - The Premiere Season [VHS]	A16NN8Q2MN97DY	joan l. samtmann	Had a wonderful time reliving watching the series years ago. Amazon video enabled my daughter to watch it, a grown woman watching it under the covers so as not to disturb her husband.then her generation got to enjoy Downton Abby. A young generation enjoying the past...a time gone by ... Never to return.	5.0	Thoughts about the series.	2014-03-25	0	0	0
0767002652	Upstairs Downstairs - The Premiere Season [VHS]	A1IU7S4HCK1XK0	Joanna Daneman	The story of 165 Eaton Place continues in the early 30's. The house has been inherited by Lord Hallam Holland and he moves in with his wife Lady Agnes. Rose Buck, who now runs a small domestic hiring service, staffs the downstairs and becomes housekeeper. The upstairs dramas include a tyrannical and eccentric mother (Eileen Atkins), an out-of-control sister and glimpses into the life of a foreign office diplomat. Downstairs, there are quite as many intrigues, and when the upstairs and downstairs mix, there are the predictable problems.The scenery is lush, each character is cast with care; in particular, Ed Stoppard (son of dramatist Tom Stoppard) is mesmerizing as the stiff-upper-lip husband and diplomat. But every cast member has plenty of lines and a back story, which makes this an engaging series. The second season, on the cusp of World War II, is even better.It's a shame that Jean Marsh's illness and disagreements about the direction of the scripts (that Eileen Atkins was consulting on, as one of the original developers of Upstairs, Downstairs) ended up with the series cancelled after the second season. The last episode of Season 2 had many threads hanging that could have made a long and satisfying drama series. We'll just have to imagine them. But even though this is a brief series, it is produced with fastidious care and it's a worthy successor to the original.	5.0	Another great British tv drama	2013-08-15	3	3	0
0767002652	Upstairs Downstairs - The Premiere Season [VHS]	A3VOZ5RTAL9VPU	"Jo-ann Albano ""Jodelpa3"""	Since Downton Abbey was on break, I was looking something similar.  I can't say I love it as much.  It looks like a good series but I think maybe the accents are too heavy for me to understand.	3.0	Not Downton Abbey	2013-03-20	2	0	2
0767002652	Upstairs Downstairs - The Premiere Season [VHS]	A3QM4TIDJGA073	Joanne Coolbaugh	This program is amazing.  The characters become a part of your life almost from the beginning.  They bring you into their lives.  The Grand Lady is my favorite.  Her expressions and her witty comebacks are so well done you believe she made the lines up herself.  My heart broke over the losses and I was angry with the meaness of two characters, I'm hoping the one will get hers yet.  Can't wait until I can watch the 4th season!!! I miss this family and its only been a couple of weeks since I finished binge watching the first 3.	5.0	Awsome program	2014-03-20	0	0	0
0767002652	Upstairs Downstairs - The Premiere Season [VHS]	A3HJ0F5C67Q0SO	Joanne Panettieri	I have been watching the new version of Upstairs, Downstairs and wanted to see what started it all!  So far I have only watched one episode, but it looks like it's going to be good!  A little over acted, but I think that was the style they were aiming for.	4.0	A Classic Must-see!	2014-04-11	0	0	0
0767002652	Upstairs Downstairs - The Premiere Season [VHS]	A3BS19W7601PA9	Joanne Petrella	A smaller version but the same human dynamics.  Wonderful acting and sets.  The sound leaves something to be desired and I certainly wish it could be closed captioned or subtitled but definitely one of my favorite British series.	5.0	Same social dynamics as Downton Abby	2014-01-16	0	0	0
0767002652	Upstairs Downstairs - The Premiere Season [VHS]	AOTH7NE9HQEXC	Joann Gilliland	Liked everything!  Story line was well written and casted perfectly.  Hope their are many many seasons.  Cannot wait for new episodes.	5.0	wondeful story line	2013-04-28	0	0	0
0767002652	Upstairs Downstairs - The Premiere Season [VHS]	A3LG4Z2EAE3BO2	Jo Ann Massaro	I had first started to watch an older version of this story and was not a fan. I stumbled upon this newer version and loved it from the very beginning. The characters are interesting and provide good back ground for what is to become. Some lie, some cheat, some are naive for a time. Learning some history is a bonus. There are so many parts of history that are fascinating and yet rarely talked about. Appearance for appearance sake is always a theme in life, especially for the well known and well off.	5.0	A joy to watch.	2013-11-13	0	0	0
0767002652	Upstairs Downstairs - The Premiere Season [VHS]	AYYZAETIQ9FZ	Joan Osborn	I rewatched the old series recently.  It was great to see the house carry on and Miss Rose become a part ofit's new story.	5.0	Great update of the original.	2013-08-30	0	0	0
0767002652	Upstairs Downstairs - The Premiere Season [VHS]	ABM6TR5VFM6Q2	joc	I loved this series and cannot believe it was discontinued! I am so disappointed there was not more seasons! Downton Abbey has many similarities so I cannot imagine not having more in this series!	5.0	Beautiful and great story! NEED ANOTHER SEASON&lt; PLEASE!!!	2013-01-17	0	0	0
0767002652	Upstairs Downstairs - The Premiere Season [VHS]	A5782N7LOHBJ2	Joe Nizolak	We are really enjoying this updated version of UD - far better than the 70's version.  It's unfortunate that the BBC canceled it after Season 2.	5.0	Really unhappy that the BBC canceled this show	2014-01-16	0	0	0
0767002652	Upstairs Downstairs - The Premiere Season [VHS]	A2L003N5U9AQTJ	John A. Burdsal	A little slow to get started, but enough to watch the second episode. I like how similar to Downton Abbey it incorporates the historical events & stories of the time.	3.0	Interesting	2014-01-11	0	0	0
0767002652	Upstairs Downstairs - The Premiere Season [VHS]	A30YZ9RTEDHNDQ	John Bickmore	Of course it doesn't quite compare to classics such as Red Dwarf and Top Gear. But in its own way, it is a great show.  My wife absolutely loves it.	4.0	Not a bad show	2014-04-07	0	0	0
0767002652	Upstairs Downstairs - The Premiere Season [VHS]	A2TUA4VWCMNXI	John D. Cofield	This is the first series of Upstairs, Downstairs.  Chronicling the lives of masters and servants in a Belgravia townhouse, Updown, as it is affectionately known, covers about twentyfive years.  The first series lasts from about 1903 to 1908.  It introduces most of the main characters of the entire chronicle, barring a few later additions to the caste.  Most of this first series concerns the career of Sarah, who has the impertinence to come to the front door when she applies for the position of parlormaid in the first episode.  We also see the early stages of the career of Elizabeth Bellamy, daughter of the house, as she rebels against the path her life is expected to take by her parents.  Some of the episodes in this first series were filmed in black and white, due to a cameramen's strike.  I find these particularly effective in portraying the barrenness of life below stairs.  Some of the episodes are a bit off target, especially The Swedish Tiger, which is just plain weird, but remember the series had not yet reached classic status when these episodes were filmed.  The first series is a great way to start your acquaintance with the residents of 165 Eaton Place.	5.0	A Great Beginning to a Great Series	2002-09-22	30	30	0
0767002652	Upstairs Downstairs - The Premiere Season [VHS]	AJETRPDO2155A	John Friend	Very well written! Highly recommended..especially if you are a fan of Downton Abbey! Worth checking out! Wish they never canceled it.	4.0	Well written!	2013-06-14	0	0	0
0767002652	Upstairs Downstairs - The Premiere Season [VHS]	AMMXHQFE8YIRI	John I. Oines	The original &#34;Upstairs - Downstairs&#34; was much better.  The staff behavior 'downstairs' is not believable, in my opinion.  The cook behaved slovenly.  Depression era people would have been much more grateful for their positions or should have been 'sacked' by Rose (Jean Marsh).	2.0	Does not measure up.	2014-04-06	0	0	0
0767002652	Upstairs Downstairs - The Premiere Season [VHS]	A3QXE8X4XF1F93	"John J ""Irish"""	A classic PBS/BBC joint venture. The original Masterpiece Theatre in all of it's glory. It has stood the test of time and is as entertaining today as it was over 40 years ago. Jean Marsh and the ensemble cast are magnificent!!!	5.0	Stands the Test of Time!!	2013-11-04	1	1	0
0767002652	Upstairs Downstairs - The Premiere Season [VHS]	A1G6H11G2X0YYU	john prpich	A wonderful cast and quite an intriguing story of the separation of classes.  Rich or poor, it seems people have drama in their lives regardless of their stature.	5.0	Classic Television	2014-03-25	0	0	0
0767002652	Upstairs Downstairs - The Premiere Season [VHS]	A3ONCCR9BAW21L	John R	the acting is superb as is the writing! I would recommend the series to anyone wishing to step back in the history of that peroid.	5.0	civil discouse	2014-02-07	0	0	0
0767002652	Upstairs Downstairs - The Premiere Season [VHS]	A2V8KTMDIT3ZX6	John Schweger	After Downton Abbey, to return to this production does reveal some seams. Not bad for being the first of its kind.	4.0	Old Downton Abbey	2013-12-07	0	0	0
0767002652	Upstairs Downstairs - The Premiere Season [VHS]	A1MD169D4PMA37	John Walters	I was delighted to hear that they decided to continue with the series and the fact that Jean Marsh was reprising her role as Rose.  It was a little sad to see her sitting in her employment agency selecting the staff that would ultimately replace the characters that we've all come to love, but the new lady of the house finally comes to the correct decision to utilize the best asset she has at her disposal and hires Rose as Housekeeper.Rose seems a little rusty in getting back into the swing of things but soon after a few tricky situations, we see that she has learned quite a lot from Mr. Hudson and the standards of 165 are in good hands.All in all, it's a brief mixture of nostalgia and a larger portion of time marching on into the troubling times of World War II.There's plenty of political intrigue and we're reminded of the importance of this beautiful home whose inhabitants have been involved in many historic events.Now that we're in between seasons of Downton Abbey, again, this is a great substitute for getting your English soap opera fix.	4.0	It's not the original, but it's damn good	2014-02-27	0	0	0
0767002652	Upstairs Downstairs - The Premiere Season [VHS]	A3L21UP1HUR3CP	John W. Herd	I would like to see this series continue , so sorry they have cancelled it .  The actors are great and the story is just getting started again with WWII. Bring back Upstairs Downstairs. Please.	5.0	Bring back Upstairs Downstair	2014-02-09	0	0	0
0767002652	Upstairs Downstairs - The Premiere Season [VHS]	AW5EOGQMIVUDF	john zubritsky	Although I have see only one episode, I think the acting and the period atmosphere make it a worthy successor to the original production.	4.0	The New Upstairs Downstairs a Hit	2013-07-22	0	0	0
0767002652	Upstairs Downstairs - The Premiere Season [VHS]	A26WHDHAHS979L	joleo	I really liked this show.  It kept you looking forward to the next episode.  It shows people are people no matter what your station in life is.	5.0	Realistic	2013-12-18	0	0	0
0767002652	Upstairs Downstairs - The Premiere Season [VHS]	A193FY57M0YWPP	JollyBengali	It's a very good production, but I couldn't get over the fact that Downtown Abbey has the same theme and has done it much better.	3.0	Downton Abbey lite	2011-06-12	0	0	0
0767002652	Upstairs Downstairs - The Premiere Season [VHS]	ARR9L0Z7ZZAFT	Jonet454748	If you love Downton Abbey, you will love this as well.  Can't wait to see more!  I would highly recommend this series.	5.0	Love this first season of Upstairs Downstairs	2014-06-24	0	0	0
0767002652	Upstairs Downstairs - The Premiere Season [VHS]	A6HYPTD5X4GQZ	Joni Ward	Probably a great show in its day but Downton Abbey is the new standard for these period series and Upstairs, Downstairs falls short in almost every way.	3.0	Upstaged by Downton Abbey	2014-01-15	1	0	1
0767002652	Upstairs Downstairs - The Premiere Season [VHS]	A3AOOUUCCSEO5	Jon  P	Not many episodes.  Overpriced for con taint.  I have all of the original Up/down on tape ( yes I have working VCR's).The original gets  5 stars, this 2 and a half!	3.0	It's not like the original Up/down.	2013-01-19	0	0	0
0767002652	Upstairs Downstairs - The Premiere Season [VHS]	A2WZAKU3NFO0OY	"JorDanee S Key ""JKey"""	This show has its good and not so good moments. The characters development is a bit rough, the plot line all over the place, and in general the acting seems forced. Couldn't make it past the first half of season 1.	2.0	Even if you don't compare it to Downton Abbey	2013-08-03	0	0	0
0767002652	Upstairs Downstairs - The Premiere Season [VHS]	A311626XD2C4T2	JordanJasper	One has to assume that the producers and writers and other industry executives who participated in a contemporary remake of the legendary 1970s U/D realized they would never surpass the original. Yes, there is a great deal of value (both artistic and nostalgic) in having the magnificent Jean Marsh return to 165 Eaton Place as now-elderly housekeeper Rose Buck, providing viewers with a bridge strong and authentic enough to span almost any gap in credibility between the series' two incarnations. Despite the uniformly competent acting, lavish sets, and fine camera-work, however, the new U/D is merely quaint as a stand-alone project, and not nearly as compelling as its predecessor, much less its contemporaneous rival, Downton Abbey.That being said, &#34;quaint&#34; is hardly a thing to sniff-at in a television landscape littered with mountains of garbage, so in this respect the series is satisfying, in a visual &#34;comfort-food&#34; sort of way. The plot is essentially the same as it always was, though there's a whole new family of quasi-aristocrats in Belgravia. These are largely stock characterizations. Testy and eccentric mother-in-law? Check. Brooding Lord of the manor? Check. Insecure wife? Check. Troublesome, sexy ingenue? Yep. Downstairs we find the same lovably predictable types: proud, moralizing butler; crotchety old cook; flirty, common-as-muck parlor maid, etc. The storylines are crisp, economic, and convincing, if utterly derivative, and the proceedings are helped immensely by the pre-WWII historical setting. The folks above and below benefit by sharing a common anxiety on the eve of ruin, one that drives and underpins these six episodes, which might otherwise have gone completely off the boil.If you like English period dramas, sitting-room contretemps dramas, and the like, put some popcorn in the microwave, get in your jammies, and watch Series One in its entirety on some rainy Sunday. You could do a lot worse, entertainment-wise. Special kudos go to Eileen Atkins, co-creator of the original series, in her savvy turn as the meddling Mother-in-Law, and to see Jean Marsh in any scene here is nothing short of pure joy. In fact, her participation is worth the price of admission all by itself.	3.0	A Fitting -- If Creatively Inferior -- Reboot	2014-06-19	0	0	0
0767002652	Upstairs Downstairs - The Premiere Season [VHS]	A2YTOKOIDOM8O1	"Jose F. Penaloza ""JosOza"""	If you like Great Performances from PBS, then you'll enjoy Upstairs Downstairs. This series is an enchanting look at the British elite lifestyle in the 40's. Enjoy!	4.0	Great Performance	2012-08-08	0	0	0
0767002652	Upstairs Downstairs - The Premiere Season [VHS]	AN45W0IMCC6P2	joseph a .labarbera	Now that I bought these my wife would like complete set .iam so glad that found them . What a great show.Can't wait for next christmas	4.0	The perfect gift	2012-01-14	0	0	0
0767002652	Upstairs Downstairs - The Premiere Season [VHS]	A1R2OBIEASC68N	Josette Simpson	Season one story line started off a bit slow, it did get better by season 2.  At first i thought the characters were a bit uninteresting especially the role of the husband. The characters improved by season 2.	5.0	slow starting	2013-11-01	0	0	0
0767002652	Upstairs Downstairs - The Premiere Season [VHS]	A3SLA4ADDSYZJ2	Josh Hitchens	This is the first season of UPSTAIRS, DOWNSTAIRS, possibly the best loved drama series ever made. The quality of this boxed set is wonderful, and the first thirteen episodes do a first rate job in setting up the plots and  characters. We see the Bellamy family and their loyal servants from  November 1903 to June 1909 in all their triumphs and tragedies. Of the 13  episodes, my personal favorites are THE MISTRESS AND THE MAIDS, BOARD  WAGES, and A CRY FOR HELP. Ironically, these are of the five black and  white episodes that have never been shown on American television. The  Second and Third seasons are also on video, and I highly recommend them.  Unfortunately, the Fourth season that dealt with World War One, and the  Fifth Season, which was the last, are not yet available. I hope they come  out soon. Finally, Upstairs Downstairs: The Premiere Season is excellent,  collect the whole series!	5.0	Upstairs Downstairs: The Premiere Season	1999-12-12	29	28	1
0767002652	Upstairs Downstairs - The Premiere Season [VHS]	AUBA9AT6E7L7A	"Joy ""AZ Consumer"""	I love this series and wish there was more of it. Very well acted and the various characters and subplots kept my interest.	5.0	Sad that there are only 2 seasons of this	2014-01-08	0	0	0
0767002652	Upstairs Downstairs - The Premiere Season [VHS]	A10OOHQ2AFH40S	JOY HODGE	I did not order this I have free prime - why did you charge me for this - remove me from this account immediately	1.0	rip off - why am i being charged for a movie when i have free prime	2014-01-05	2	0	2
0767002652	Upstairs Downstairs - The Premiere Season [VHS]	A3CPJ8W6Z20H0U	"Joy Johnson ""Joy"""	The story had the past blended into the new story very nicely. I'm looking forward to watching the rest of the series.	5.0	Liked the new season.	2013-11-17	0	0	0
0767002652	Upstairs Downstairs - The Premiere Season [VHS]	A3GATKRNKH3Z56	Joy Perkins	it reminds me of Downton Abbey.  Very British.  love being able to get it on the Kindle.  nice clean story	4.0	like it	2013-05-25	0	0	0
0767002652	Upstairs Downstairs - The Premiere Season [VHS]	A3P27QHH05LT04	JPJ	I love the 'old' British shows and Upstairs Downstairs fits the bill. Can't wait to move on to Season 2.	5.0	Great Show	2013-09-06	0	0	0
0767002652	Upstairs Downstairs - The Premiere Season [VHS]	A1QI4OF6TXDE6	jradler9121	I have only watched episodes 1 and 2, but so far I am really not enjoying this series; I haven't decided if I will watch the rest.  I love Downton Abbey, so I thought perhaps I would enjoy this too.  This is a far cry from Downton abbey...which could mean that my opinion is totally biased and unfair.  Maybe I will give episode 3 a chance...	2.0	Not so good	2013-04-09	1	1	0
0767002652	Upstairs Downstairs - The Premiere Season [VHS]	A327UUWVZ4BHVH	jrandall	Excellent presentation! Absolutely correct in costuming and setting.  The writing and acting are superb continuation of the 30 year old masterpiece	5.0	Excelent	2013-12-17	0	0	0
0767002652	Upstairs Downstairs - The Premiere Season [VHS]	A184HYGNQCOZR4	JRD	Very good.  Not as good as Downton Abbey but still good.  I enjoy these kind os shows very much. Yea!	4.0	Upstairs Downstairs	2014-03-21	0	0	0
0767002652	Upstairs Downstairs - The Premiere Season [VHS]	AWTCA4XTS3EQ2	"J. Robbins ""Golden Boy"""	Beautiful show- slow and building. I'm still in the first season, but it is filling my &#34;Downton Abbey&#34; void. I cannot wait to watch this after work; it's like going into the past.	5.0	Simply Elegant	2014-06-01	0	0	0
0767002652	Upstairs Downstairs - The Premiere Season [VHS]	A2LS100EMAUCEY	J. Rowland	Love all the characters!  If you Downton Abbey, you will love this. My only complaint is that the season is so short.	5.0	Great Period Drama	2014-01-10	0	0	0
0767002652	Upstairs Downstairs - The Premiere Season [VHS]	A6IG4Q1GS9RY4	J Sakai	Another series that I just absolutely love. The characters were easy to get to know and love right away. I feel all the ups and downs right along with them, So happy there are many more seasons to watch.	5.0	It just keep getting better!	2013-09-27	0	0	0
0767002652	Upstairs Downstairs - The Premiere Season [VHS]	A3FYQ0FAJOP573	J Simmons	Its like everyday life in our world today. You have a life of romance, scandal, and some amusing events. There is secrecy and of course lies.  The elegant furnishings, clothes, hair styles, are very primm and proper for that era. Also its like the haves and have nots. Of course there is always factional scheming for power. Lots of excitment.	5.0	Busy Life	2011-06-04	2	0	2
0767002652	Upstairs Downstairs - The Premiere Season [VHS]	A1KRPXO60X6FO6	J. Tryk	but I'm glad I stuck with it for the next season, since I think it picked up considerably.  I found it to be a combination of the old &#34;U/D&#34; (and not nearly enough of that) and the plots of Downton Abbey.  But it found it's own way, eventually, and I became caught up in a different pre-war perspective.	3.0	I thought it was a slow start...	2014-06-04	0	0	0
0767002652	Upstairs Downstairs - The Premiere Season [VHS]	AGD1FJOO3TYBF	Judith K. Johnson	Wish it had gone on and continued into a series.  Disappointed that it didn't continue and the death of the aunt and monkey should never have been allowed to occur.  The aunt really drove the series with her &#34;auntics.&#34;	4.0	Much Better Than the Original	2014-03-08	0	0	0
0767002652	Upstairs Downstairs - The Premiere Season [VHS]	A3QX1F4FM9SZGS	Judy A. Booher	This series in interesting but I didn't care much for most of the actors - If the seasons continued I would watch it but hope they would add more interesting people and sub-plots.	4.0	INTERESTING	2013-07-09	0	0	0
0767002652	Upstairs Downstairs - The Premiere Season [VHS]	AL9DCI2U5Z3TL	Judy Anne Snell	For a show filmed in the 70's, this is wonderful.  I enjoyed it along with the following seasons.  I would recommend it to everyone.  Learned quite a lot about WW1.	5.0	Ageless	2013-09-07	0	0	0
0767002652	Upstairs Downstairs - The Premiere Season [VHS]	A38JHR6MIOZP62	"Judy ""Bravehrt"""	I found this series while in Downton Abbey withdrawal. I found most episodes as riveting as DA. I was shocked to learn only two seasons were produced. I can only imagine that it was due to the cost of production because the plot twist and story lines were poised to go much longer.	5.0	Engaging characters set against a beautiful set and historically important time period	2014-04-01	0	0	0
0767002652	Upstairs Downstairs - The Premiere Season [VHS]	A1TP23LBUS8HQJ	judyd	The original Upstairs Downstairs was filled with characters you could care about, and it had all kinds of  true-to-life stories that involved the characters. The character development and acting was superb.However, the new version is a huge disappointment. The characters are shallow and don't make me care about them at all. Even Rose, the excellent parlor-maid in the original series, is a disappointment. Her acting is stiff and her character is just plain uninteresting. The same with the other actors..stiff and boring.After the second episode, I have no desire to see the rest!	2.0	Very Disappointing! Sequel!!	2011-04-18	23	16	7
0767002652	Upstairs Downstairs - The Premiere Season [VHS]	A2UVYAW23KGI7K	Judy Gilliard	You must watch the Upstairs Downstairs series from the 1970...the whole thing ties in so well and very interesting bit of history	5.0	Interesting bit of history	2013-06-16	0	0	0
0767002652	Upstairs Downstairs - The Premiere Season [VHS]	A2L5PK46CFFHWF	Judy Leslie	I expected a much better series, realize it is an older production and just could not relate to the characters.	2.0	Let down after watching Downton Abbey	2014-03-04	0	0	0
0767002652	Upstairs Downstairs - The Premiere Season [VHS]	AQBQUSAP8AFTL	Judy Richonne	I'm hoping Julian Fellowes was part of this, too! It seems very familiar. Only 3 episodes, or am I missing something?	5.0	Downton Abbey??	2013-07-28	0	0	0
0767002652	Upstairs Downstairs - The Premiere Season [VHS]	AEVD9NNCRF8ON	judy wilkosz	I really love this show. The characters are really engaging. And the story is addictive. If you like Downton Abby you'll like this.	5.0	Great , not enough episodes	2013-06-08	0	0	0
0767002652	Upstairs Downstairs - The Premiere Season [VHS]	A2WP3ND226OX7E	Julianna Swanson Peacock	Compared to downton, this is terrible.Compared to the original upstairs downstairs - this is terrible.BUT, compared to most of the reality junk on TV today, this is GREAT!  ha ha ha.	3.0	tries too hard but I still enjoyed watching it	2013-03-12	1	1	0
0767002652	Upstairs Downstairs - The Premiere Season [VHS]	A1TFCJBBLDWXHU	julie	After watching only Episode 1, Season 1. Entertaining and aesthetically pleasing. Love Elaine Atkins. One can't help but compare to Downton Abbey. You just don't care about these characters as much. However, it does avoid a level of melodrama that DA descends too, which is a relief. It also has the promise of dealing with racial issues, which will be interesting to watch play out.	4.0	Stylish but lacking heart	2013-09-06	0	0	0
