asin	title	reviewer_id	reviewer_name	review_text	rating	summary	review_date	total_votes	helpful_votes	unhelpful_votes
6301996135	The Civil War - A Film by Ken Burns (Boxed Set) [VHS]	A2S3E0AGUM2KDR	"R. Frantz ""Tough Sell"""	What more can one ask of a series that explains in a such a graphic manner the reasons behind the greatest domestic war this country has ever experienced? The insights into the military successes and blunders on both sides fills-in any gaps in the historic information the viewer has ever had about this terrible war. This series takes you there with insightful commentary and photos that reveal the outward character of the important people in charge and their involvement in the planning of the battles.Watching this series you can't help but feel for the many nameless thousands on both sides who shed their blood, lost a limb or were buried without fanfare for their heroic behavior over a cause that seemed clouded in politics, strained, nebulous and increasingly ill-defined as the war raged on.A highly recommended visual history lesson that is not for the squeamish.	5.0	One of Ken Burns best	2013-07-22	1	1	0
6301996135	The Civil War - A Film by Ken Burns (Boxed Set) [VHS]	A2ZKDKIU3YDT3G	R. Gillim	Ken Burns's Civil War is one of his best series.  Now I own the entire series for low cost.  What more could you ask.Yes, I know, even with all he has, there is still much missing.  Don't use this series as a complete history.  For example, it is no surprise that the film's discussion of the causes of the war don't go into the detail necessary for a full understanding - but the series is called Civil War, not the History of the Civil War.And with the US at war as I write this, I feel so sad.	5.0	Best of Ken Burns	2010-10-08	1	1	0
6301996135	The Civil War - A Film by Ken Burns (Boxed Set) [VHS]	ADUEWFPNY1MEU	R. House	Great documentary series, extremely watchable and enjoyable. The series tells the story via quotes, interviews, and pictures through a large 'cast' of historical figures and modern day historians. It feels like you're watching a drama while learning a huge lesson on American history.	5.0	Great !	2013-04-14	0	0	0
6301996135	The Civil War - A Film by Ken Burns (Boxed Set) [VHS]	A20RYO25IUWXD4	RichAbel1	Being a history buff I found this documentary enlightening. I learned more about Gettysburg than I had realized before. I also learned that the Civil War began and ended in the same families backyards...	5.0	Great Documentary	2013-10-22	0	0	0
6301996135	The Civil War - A Film by Ken Burns (Boxed Set) [VHS]	A1M1KNK6X380E	"Richard A. Fandel ""Alito"""	This PBS history lesson shows that Ken Burns knows how to spin the Federalist position as saviors of the Union.  It does not do justice to the many brave lads who fought and died defending their homes and lifestyle against the vicious invading forces of Mr. Lincoln.  Certainly the winners write the history books but the honor of those brave men and women of the South will live on forever.  Addionally no one should ever forget the brutality of the federalists both during and after the war between the states.	1.0	The War Between the States	2010-09-21	175	24	151
6301996135	The Civil War - A Film by Ken Burns (Boxed Set) [VHS]	A1O130H3XTF5WF	Richard Buck	I have spent quite a bit of my learning time in the past two years focusing on the Civil War, wanting to get a better handle on the whole thing. I watched movies, read books, listened to books on tape, listened to college lectures, recorded and watched shows from the History Channel and PBS. I visited Civil War battlefields at Gettysburg and in Virginia and Tennessee.Throughout this, I used Ken Burns' film as my guide to keep things straight. I think I have watched every part of this film at least twice, and it never let me down.Burns, whom I once heard give a lecture at Willamette University, found what in my opinion was just the right way to weave elements of learning into a compelling fabric that never bores. I loved getting to listen to and see historians like Shelby Foote. I loved the photographs, the music, the animated battlefield sequences. The many quotations from letters and diaries of participants, read by such familiar voices as Garrison Keillor, lent the whole project an unmistakable credibility.Finally, no review could do justice to this film without lauding the narration of David McCullough. Whenever I read something aloud to anybody, I try to imagine how McCullough would do it. My imitation of him is always inadequate, but that is not a word that could ever be fairly applied to this film.	5.0	Unsurpassed overview of the Civil War	2008-12-07	0	0	0
6301996135	The Civil War - A Film by Ken Burns (Boxed Set) [VHS]	A24W9H8XEJ50H2	"Richard C. Woolever ""Pond Man"""	Included many old photos to suplement the actual descriptions as events are depicted.  More for likes of history buffs than just entertainment.	5.0	History depiction of Civil War struggle	2013-11-24	0	0	0
6301996135	The Civil War - A Film by Ken Burns (Boxed Set) [VHS]	AEAAVN7MZ2NTZ	Richard F. Gray Jr.	great picture depicts the civil war with great accuracy and very informative of learning about Americas history from years past	5.0	civil war	2013-06-23	0	0	0
6301996135	The Civil War - A Film by Ken Burns (Boxed Set) [VHS]	A3NJRJM6EDTWI	Richard Hamilton	This is by far the best documentary ever made. Even those with no interest in history would enjoy this series. Ken Burns and his spectacular cast actually make you feel like you are there to witness the war that defined  who and what kind of country we are today.	5.0	Civil War - The best documentary on our country	2000-05-18	0	0	0
6301996135	The Civil War - A Film by Ken Burns (Boxed Set) [VHS]	A3EV5GW1U4NTVJ	Richard heischman	Excellent series.  Photos, narrative, insights are all valuable.  Should be required viewing for all citizens and those desiring to become citizens.  Freedom is not and was not free.	5.0	Excellent Series	2014-07-09	0	0	0
6301996135	The Civil War - A Film by Ken Burns (Boxed Set) [VHS]	A2G46YB1ZNPP4P	Richard L. Dick	Most indepth documentary ever about teh civil war in its entirety. Most civil war documentaries are quick 1 hour sumaries about the most important events. Ken Burns knows how to tell a story with great insights. I learned things about the civil war, certain facts of persons and the people of that era then I ever did in High School History lessons.	5.0	Ken Burns	2013-10-14	0	0	0
6301996135	The Civil War - A Film by Ken Burns (Boxed Set) [VHS]	AEUMR9NXNOCAG	Richard Turner	This documentary on the Civil War must represent Ken Burns' finest hour and the greatest gift to the American people.  It's a meticulously and thoroughly researched piece of work.  It's amazing that Ken didn't get overwhelmed with the number of  Libraries, Universities, Historical Archives and Societies he used for the material.  He brought the war story to life in an easy to understand sequence of events.  The music is very captivating  and the Narrators/Commentators bring different perspectives of the war that drew me into the war moments, as if I was there.	5.0	Greatest Gift to the American People	2014-04-15	0	0	0
6301996135	The Civil War - A Film by Ken Burns (Boxed Set) [VHS]	AQJX6Q5SVESFN	"Richmond Brown ""Richmond"""	If you have any interest in the civil whatnot American history you should watch this.  You will not be disappointed.	5.0	Simply the best	2013-07-24	1	1	0
6301996135	The Civil War - A Film by Ken Burns (Boxed Set) [VHS]	AYI9174JRO362	"Richvs ""Richvs"""	Excellant, best DVD set that I've seen so far re. the Civil War.  Would highly recommend it to history buffs like myself.  5 Stars...Plus.	5.0	Civil War DVD set by Ken Burns	2009-04-15	0	0	0
6301996135	The Civil War - A Film by Ken Burns (Boxed Set) [VHS]	A1K0IUVCTK9VS1	Rick Gleason	What can one say that hasn't already been offered?Ken Burns' series is probably the best program I've ever seen on television.  I know this says a lot, but I honestly believe it.His film should be required viewing of every student of American history.  Visually powerful and emotionally unforgetable, it's a superb and comprehensive overview of the greatest war in our history.  I highly recommend it.	5.0	The Best of What Television &amp; Film Can Offer	2002-09-26	0	0	0
6301996135	The Civil War - A Film by Ken Burns (Boxed Set) [VHS]	ADE6RHHG0SWWM	Rick K	A comprehensive look at the Civil War or the War of Northern Aggression as we call it in the south.  Interviews with black and southern historians shed interesting facts above & beyond the battles and dates.  As with all of Ken Burns multipart documentaries he spends a lot of time on his political & politically correct views on the subject matter.While this is very important to tell the overall story - IMHO he spends a little too much time it and not the overall theme of the documentary to its detriment.  But overall a great series	4.0	Very Good series on the Civil War	2013-06-13	0	0	0
6301996135	The Civil War - A Film by Ken Burns (Boxed Set) [VHS]	A30D5IHQ75LRXN	Rick L.	This should be shown in high school history class. All most people know is that the North and South had a civil war, but know no details about it.	5.0	Very  Comprehensive Coverage	2013-07-14	0	0	0
6301996135	The Civil War - A Film by Ken Burns (Boxed Set) [VHS]	A388QE4OGNMBDW	Rikki Ritterbach	This is the second documentary by Ken Burns that I have watched and I absolutely loved it! There was so much information and one can really get a sense for what was going through the hearts and minds of the folks living through the war.	5.0	I absolutely loved this!	2013-10-19	0	0	0
6301996135	The Civil War - A Film by Ken Burns (Boxed Set) [VHS]	A2X1IIDFC7YSZI	"Rita Marbury ""Rita"""	If you want an overview of this tragic war, there is none better. Besides that, it is a work of sheer artistry.	5.0	Best Synopsis of the Civil War	2014-02-17	0	0	0
6301996135	The Civil War - A Film by Ken Burns (Boxed Set) [VHS]	A3NVF9T1XXW9XP	"R Joe ""RJ"""	I had heard of this many years ago, but finally caught it on Amazon Prime. It is a fascinating look at the beginning, the causes and problems both sides faced during the civil war. If you are interested in history like I am, that this is a good series. There were some surprising facts that I never knew about Lincoln and Lee. There were times when they used the same photos a bit too much, but that is understandable, I was so immersed in the first episode, I ended up watching the entire series on one lazy Sunday.	4.0	Still intriguing for first time viewer	2014-06-29	0	0	0
6301996135	The Civil War - A Film by Ken Burns (Boxed Set) [VHS]	A1EHIO9W8ILYPV	R. king	Upgrading from VHS copies to DVD is sometimes a letdown, but this set is well worth it. Ken Burns is a national treasure, and his work holds up well to repeated viewing.	5.0	It never gets old	2009-10-07	1	1	0
6301996135	The Civil War - A Film by Ken Burns (Boxed Set) [VHS]	A2F9T4BS3JLRQM	R. L. Hines	I very much liked the way it was presented and the background music, plus the different narraratiors. Very informative story.	5.0	Great History Lesson	2013-02-10	0	0	0
6301996135	The Civil War - A Film by Ken Burns (Boxed Set) [VHS]	A1TAVHDIQ5JQH6	R. McNulty	It is well researched, narrated, and edited for video.  It is a great lesson in history about a war that should never have happened, but thankfully, led to the abolition of the criminal offense of slavery at the cost of over 620,000 lives.	5.0	As far as I know, the best documentary on the Civil War that exists	2014-06-16	0	0	0
6301996135	The Civil War - A Film by Ken Burns (Boxed Set) [VHS]	AUX9KZUUB3YCE	R. Nicholson	Having just finished watching The Civil War by Ken Burns I felt I had to review it. The DVD, on 6 discs, encompass the entire civil war from beginning to end, including important events that preceded the firing of the first shot.In the end, the union won of course, but was somewhat lucky to do so: despite continually squandering the advantage of numerical superiority and the innumerable opportunities they had for victory.Although it is difficult to describe what so compelling and addictive about this work, I believe, one of the factors is the beauty of the story telling. The main portion of the series in simply nothing more than old black and white photographs captured by photographers of the day; images with a ghostly, grainy quality that makes for a special eerie affect. I do not think colored pictures, somehow, would have been effective in creating the mood that these B &W; photos do: simple images of men in their barracks, in front of a tent, on a horse etc. or sometimes grotesque scenes of death and destruction after a battle. The fact that so many of these images survived is a miracle in itself.Just as important is the beautiful, narrative voice of David McCullough and others historians who give expert commentary and actors who read letters written by people involved in this event.However, in my opinion, it is the music that sets this epic event apart from any other work on the same topic. The Ashoken Farewell by Jay Ungar begins each installment: it is hard to imagine a more fitting piece of music that could preface each episode: this haunting melody, played by a solo violin, seems to capture the raw essence of the story so perfectly: it simply seems to reach out and touch the soul.  The majority of the music accompanying the story is played by solo guitar, piano, banjo or violin: and again the singular instrument seems much more appropriate than orchestrated music: capturing the ever increasing loneliness and solitude that these men must have felt as the war dragged on throughout these four years.All in all, the photographs, the narrative, and the music blend together to make an unforgettable 10 hour series that surly is one of the most important events not only in American history, but maybe even more importantly, for the entire world.	5.0	The Civil War:  Ken Burns masterpiece	2003-01-26	9	9	0
6301996135	The Civil War - A Film by Ken Burns (Boxed Set) [VHS]	A39GV4G05ANQEW	"Robert A. Johnson ""Bob Johnson - bobjohnson.w..."	"It's been many years since originally glued to I think HBO to watch this magnificent portrayal of the fight between the gray and the blue.  It is a bit pricey, but it is polished and insightful. When I purchased it, I'd just finished reading ""The Civil War"" by Bruce Catton, and the Catton Trilogy on the Civil War, and I realized I simply had to re-watch this engaging film by Ken Burns.Ken Burns I think started the era of talking heads and documentary's using experts along the way.  It works well in his film (but I do wish others would find another way - it is getting old).  There is one man in this film, Shelby Foote who is just priceless.  He knows how southerners feel about the war, and northerners who think the civil war over, while correct, underestimate the feelings of loss that are present in the south.At one point Foote discusses how proud many Americans are of our record in wars.  ""We have never lost"" many think and say.  I paraphrase Foote now; he says with an ironic look on his face, ""Not in the South"".  I've found that talk of the Civil War in social circles is a topic best left at the door.  I've been told in no uncertain terms, after bringing it up is some way, ""We don't talk about that down here"".  I recall vividly being surprised and feeling foolish.  Later I wondered why, for I see the Civil Was as a great tragedy and example of the failure of compromise, and the lack of will to solve very difficult problems.  We must learn how to deal with supposedly insolvable problems.The Civil War is also an excellent example of how a war must be fought, and, the power of resources and logistics.  The north had many generals who were the bane of Lincoln's life; generals who may have been sympathetic to the southern cause and unwilling to slaughter people with whom they agreed.  McClellan is the primary example of a fumbling pompous man who thought of himself as Savior and real president and commander and chief.  While Lincoln bemoaned their behavior - he had to lose sleep over his judgment and ability to appoint real fighting men - he knew the north could not lose if only he could get the army to fight.  And then along came Grant and Sherman.Lee recognized that without manpower, supplies, and transportation he had to whittle away at the will of northerners, lowering their will to fight to a point where resignation to the idea of a Confederacy might win for his beloved Virginia and the south.  His swift and incisive victory's almost carried the day.  And then along came Grant and Sherman.The Battle of Richmond with Grant continuously moving to outflank Lee on the left, and Lee anticipating the move and beating back Grant, demonstrates Lee's warrior skills and Grant's willingness to keep the fight going.  Grant knew he could not loss; eventually Lee would run out of men, literally, and supplies.Sherman waged total war.  (We might think about this offensive before going to war.  Can this nation repeat it?  Is it a necessity in order to win a war?)  The obliteration of cities, towns and fields and people,  put an effective end to the war for the south lost its base of supply and I think realized the war would be lost.  This was especially true in South Carolina; Sherman punished the state for leading the secessionists to fight.This invitation to review ""The Civil War - A Film by Ken Burns"" comes with an urge to watch it yet again.  The playing of Ashokan Farewell while reading a soldier's letter home to Sarah, his wife, and his acceptance of his coming death, is a stunning and emotional point in the film.  There are many others, and I will watch it again, and urge you to do so as well.[...]"	5.0	Pricey But Polished and Insightful	2009-03-11	0	0	0
6301996135	The Civil War - A Film by Ken Burns (Boxed Set) [VHS]	A2DFFDS6X548QE	Roberta R. Cavallo	I HAD WANTED TO OWN THIS FOR A LONG TIME.  I WAS VERY PLEASED WITH BOTH THE PRICE I FOUND IT FOR AND THE SERVICE.  PERFECT!	5.0	THE CIVIL WAR - A FILM BY KEN BURNS	2008-04-02	5	1	4
6301996135	The Civil War - A Film by Ken Burns (Boxed Set) [VHS]	A33RSODP4FWR4P	Robert B. Knight, Jr	I ordered the series again just as a refresher. I saw the original TV documentary on History Channel and was amazed then and after seeing it again am amazed again. Ken Burns is a genious at fidning the intracacies in history that matter and getting them on the table. I will watch this over and over again.	5.0	This Documentary is fabulous!	2013-09-23	0	0	0
6301996135	The Civil War - A Film by Ken Burns (Boxed Set) [VHS]	A1R76JISSSQ9GL	Robert C. Richards	I especially enjoyed the videotaped insights from novelist and historian Shelby Foote. I expected a first-rate product from Ken Burns and was not disappointed.	5.0	Excellent!	2013-02-10	0	0	0
6301996135	The Civil War - A Film by Ken Burns (Boxed Set) [VHS]	A366F86IDR5X73	Robert Crouse	As in all of Ken Burns production this series is well done. If I had this highly motivatinal view of past events in high school and college and I would have a ton of knowledge. Plus, I would not have recived those narrow and personaized veiws of the instructors.	5.0	The Best Possible View of the Civil War	2013-09-27	0	0	0
6301996135	The Civil War - A Film by Ken Burns (Boxed Set) [VHS]	A2H9HN9YD8XVIV	Robert C. Woll	Ken Burns did a fantastic job with this.  It is enjoyable to watch and so very informative.  I, and my entire family (including grandchildren) watched it and enjoyed it.	5.0	Civil War	2008-11-01	0	0	0
6301996135	The Civil War - A Film by Ken Burns (Boxed Set) [VHS]	A30RUN9EWSXHVU	Robert Ethier	As with all Ken Burns works,this is superlative. Very we'll thought out and with seamless continuity. Really happy with the great price!	5.0	Outstanding!	2014-02-06	0	0	0
6301996135	The Civil War - A Film by Ken Burns (Boxed Set) [VHS]	A3RBYX0L47WO0M	Robert E. Williams	This presentation by Ken Burns is far and away the best DVD that I have ever viewed.Burns' format has become a model for many, many other subsequent documentaries.The narrator is superb. The voices Burns chose to represent characters in the film were excellent choices.Who can forget Shelby Foote's cool and authoritative  comments throughout the film?.Even the background music exactly sets the mood for the events being presented.If you were not a Civil War buff before seeing this film, you will be one afterwardsI had recorded the series twenty some years ago on VHS Tape  when it was presented by PBS, But the quality of the tape vs that of the DVD isn't even in the same ball-park. The DVD is like watching a Movie.The set consists of 6 DVDs. The price was outstanding.  Delivery was very fast and packaging was robust.I recommend this set without reservation to any and all.	5.0	Words Fail Me	2013-03-24	0	0	0
6301996135	The Civil War - A Film by Ken Burns (Boxed Set) [VHS]	ATW0ZJUQHFBG	Robert F.	One of the best documentaries on the Civil War, even twenty years after its original release.	5.0	Ken Burns - The Civil War	2009-02-15	1	1	0
6301996135	The Civil War - A Film by Ken Burns (Boxed Set) [VHS]	AIRFVGQ77A20U	"Robert Flournoy ""rwf3"""	"I watched The Civil War on DVD and cried my eyes out, as I did previous times when I viewed it on PBS. I made my 16 year old son watch it with me, and, he was more moved by my emotion than by the film, I think. The stark beauty of the presentation, balanced by the unimaginable horror that gripped our land 137 years ago was both eloquent and artistic in its' presentation. As a Vietnam combat veteran, my heart reached out to all the men on both sides for the incredible hardship they endured and their single minded devotion to duty and their comrads. Lincoln's greatness is magnified and examined and one is left in awe of his single minded purpose, which was to keep us a house undivided. As brilliant as Ken Burns' film making abilities are, however, he is ill advised on the issue of slavery and its' place in the cause and continuation of the war. It is almost as if he has a racial agenda with his films. His misunderstanding of the true causes of The Civil War are, sadly, the result of a historical agenda that was set in place long ago in an attempt to assign a higher morality to the reasons the north fought other than union preservation. The record clearly reveals that those who followed the battle flag of freedom were southerners who were rebelling against unfair taxation and representation, just as their own father's had done against the British. Shelby Foote's quotation by the poor southern farm boy who, when captured by yankees, told them he was fighting because ""your down here"" pretty much says it all. Let us be reminded that the first act of aggression, that started the fighting, was Lincoln's ordering of the blockading of southern ports. There was not a single piece of legislation before congress that threatened the right of southern states with regards to slavery."	4.0	Brilliant, but, Biased	2002-09-27	15	9	6
6301996135	The Civil War - A Film by Ken Burns (Boxed Set) [VHS]	A2OAKHL0E0A4YQ	"Robert G. Martinez ""Doctor of Rock"""	I have always been a student of history. I now publish a historical magazine in Florida, and always thought this documentary was the one that set the highest standard for documentaries. There are 11 hours of captivating photos, stories, excellent narration and music of all the paegentry, hopes and ultimate tragedy of the war. It is just too exhaustive to write about. But I honestly believe this documentary will live on..long after we're gone..as the definitive documentary on the Civil War. It is well worth the investment knowing that this can be viewed just as effectively....100 years from now. This is Ken Burns' masterpiece for the ages.	5.0	Long after we're gone..this documentary will live on!.	2008-03-06	0	0	0
6301996135	The Civil War - A Film by Ken Burns (Boxed Set) [VHS]	A3QPRJNJVEU4Q2	Robert G. Pielke	"As everyone already knows, this documentary is excellent. I do wish, however, that the letters and writings read throughout the documentary were identified *all* of the time [name, outfit, etc.] . Also, there could have been some kind of ""chapter selection"" capability added for searching."	5.0	The Civil War	2007-12-12	1	1	0
6301996135	The Civil War - A Film by Ken Burns (Boxed Set) [VHS]	A1RJA9PZ7DEMK	Robert G. Shropshire	"I recently received my boxed set of the 5 disc documentary about the Civil War. This is my all time favorite documentary from PBS and Ken Burns. The copy was listed as ""like new"", but I could'nt see any difference between it and a new copy. It also arrived  quicker than I expected. I am very pleased"	5.0	Civil War Just Right	2011-04-28	1	0	1
