asin	title	reviewer_id	reviewer_name	review_text	rating	summary	review_date	total_votes	helpful_votes	unhelpful_votes
0767002652	Upstairs Downstairs - The Premiere Season [VHS]	A1V6EB54MYTZ6A	Donna	My grandfather was in he Army in the Netherlands during WWI my father and my uncles were in the military during WWII. I was born just before WWII so these eras are of Great interest to me.  Although Upstairs Downstairs takes place in England, much was the same in the US.  A wonderful production.	5.0	The Wars	2013-03-29	0	0	0
0767002652	Upstairs Downstairs - The Premiere Season [VHS]	A33IZ2OVOGBEMP	Donna Mcallister	My husband and I wanted more Downton Abbey when the season ended, so we watched this version of Upstairs Downstairs. It is set in the build up toward WW2 which was a very difficult time in history. But it is well done, and worth watching.	4.0	Darker than Downton Abbey	2013-03-10	0	0	0
0767002652	Upstairs Downstairs - The Premiere Season [VHS]	A1WFCHSJC0J6OH	Donna M. Ftich	While this program is comfortable and cozy to watch, the sound effects are too loud for some of the actresses voices to be heard.  This is not only this show only that has this problem, as more and more I see this trend, and I believe it makes it unnessarily hard for the actors and actresses.	4.0	Nice to watch.	2014-01-08	0	0	0
0767002652	Upstairs Downstairs - The Premiere Season [VHS]	A1FH5H3N0HMV6B	"Donna Miller ""stmarymead"""	I saw the first show and I remember my mother watching the first show this us a great new show and I hope it continues	5.0	Great show	2014-03-18	0	0	0
0767002652	Upstairs Downstairs - The Premiere Season [VHS]	A3MODBHQOD91KZ	Donnogram444	Great story line so far and intrigue. I love the old buildings and wardrobes seem true to the period. Words required getting met this way.	5.0	Period costumes rate a prominate 10.	2013-12-16	0	0	0
0767002652	Upstairs Downstairs - The Premiere Season [VHS]	A1OJW2KF2PXONX	doodles	Having followed the Downton Abby series, I was curious about its precursor, Upstairs, Downstairs.  I was not disappointed and enjoyed season 1 enough to start watching season 2	4.0	Upstairs Downstairs	2013-08-14	1	1	0
0767002652	Upstairs Downstairs - The Premiere Season [VHS]	A14QR23477SW5J	doris chavez	like the period sagas. It is well done and very entertaining. Anyone that enjoys mini series will enjoy it very much	5.0	Great	2014-01-30	0	0	0
0767002652	Upstairs Downstairs - The Premiere Season [VHS]	A2C8C4KKBNNGO4	Doris E. Rudolph	I was born in 1933 and this time period is, therefore, very interesting for me.  I am looking forward to the next one	5.0	Interesting	2013-10-20	0	0	0
0767002652	Upstairs Downstairs - The Premiere Season [VHS]	AYC3NPKNE24O	Dothan	"This is a absolute marvelous theatrical work on TV.  I wish more current shows TV could improve to meet this 40 year old standard. I can not say enough good about this drama, so many others have said it better.But, I am just wondering why Amazon streaming does not have the closed captions?We have Amazon Prime, but are wondering if it is really worth the price, since we already have Netflix which does have closed captioning.  I have started to notice a lot of Amazon shows do not have CC. This is very discouraging especially since we are getting older and listening to the British accent can at times be frustrating..therefore -1 star.  Oh well, if you hearing is excellent then you will be amazed at the breath and fluidity of this TV show. Easy to get ""hooked"" and you will not regret it."	4.0	Beautiful, just wished it had closed captions	2012-11-20	1	1	0
0767002652	Upstairs Downstairs - The Premiere Season [VHS]	A9ASZ5M0UM6CZ	doting mom	I felt that this show was very antiquated and slow moving.  Perhaps I feel this way because I had the same expectations for this show that were presented in Downtown Abbey.	1.0	Very Dull!	2013-03-17	4	0	4
0767002652	Upstairs Downstairs - The Premiere Season [VHS]	A1HMLTJY3G7BZ0	Dottie Krull	Upstairs, Downstairs is showing its age, but still remains an interesting view. Not the exciting drama of an ongoing drama like Downton Abby, but still a bit of an insight into times gone by.	3.0	Dated but delightful	2014-02-08	0	0	0
0767002652	Upstairs Downstairs - The Premiere Season [VHS]	AU7M8M5ZX5GGO	Douglas Anderson	Great look at British aristocracy in the 30's. Well done.Good to see the continuation of the real star - #165.	5.0	165 revisited	2012-12-06	0	0	0
0767002652	Upstairs Downstairs - The Premiere Season [VHS]	ASM9QI0KTQVIX	Drag	I found this series very interesting. Lots of happenings that I didn't expect. Hope to see more. World war two history along with drama	4.0	interesting series.	2014-01-31	0	0	0
0767002652	Upstairs Downstairs - The Premiere Season [VHS]	APC019EFEX12R	drdebs	I pre-ordered this set when it appeared on the website and recently received my copy to get me through the summer re-runs.  I was so thrilled to see the superb boxed set, and was doubly impressed at the quality of the  recording both visually and in terms of sound.Upstairs, Downstairs is  the saga of the Bellamy family and their household staff in the early 20th  century.  Throughout the series their lives, loves, tragedies and triumphs  are portrayed.  This set of 13 episodes includes the COMPLETE first season  as seen in Britain, including some black and white episodes never seen on  tv in the US.  In the first episode we are introduced to the colorful Sarah  (Pauline Collins), in the second (B&amp;W episode) Lady Marjorie has her  portrait painted only to discover at the Royal Academy Show that the artist  has also painted two half-naked maids in an attic room (possibly Bellamy  maids?).  In episodes 3 and 4 (B&amp;W) we are introduced to the children,  James and Elizabeth Bellamy.  Episodes 5 and 6 show us the romance between  Elizabeth Bellamy and a German Baron (and it's dark underside), and the  pregnancy of the new maid, Mary.  More familiar episodes to the US audience  come in #7 and #8, Lady Marjorie is spellbound with a young army captain  who is friends with her son James, and Emily (the annoying kitchen maid)  falls for a neighboring family's footman, with disastrous results.  Episodes 9 and 10 have Mrs. Bridges, the cook, behaving in a most improper  way and stealing a baby, and the erstwhile Sarah returns with a new plan to  improve her social standing.  The two penultimate episodes in this set  include the further adventures of Sarah the housemaid with a Swedish valet,  and the further adventures of the Bellamy's daughter, Elizabeth, with a  group of young Socialists.  Finally we are left with the now estranged  Elizabeth Bellamy and her relationship with a leftist poet, Lawrence  Kirbridge--and a great eagerness to own the next 13 episodes, now also  available.Upstairs, Downstairs is the classic &quot;Masterpiece  Theater&quot; series, with costumes, drama, comedy, and riveting characters  that we take to our hearts.  If you are a fan of more recent costume dramas  on A&amp;E and PBS, you will very much enjoy this early series which holds  up remarkably well, after nearly two decades.  Treat yourself--you won't  regret it.  And, the set is very reasonably priced here at Amazon.com (I  saw the same thing in a catalogue for $149.99)	5.0	An old favorite returns--beautifully	2000-07-07	53	49	4
0767002652	Upstairs Downstairs - The Premiere Season [VHS]	ALBYN6ZDZCXZ5	Dr Mike C	This DVD is the first season of the new Upstairs, Downstairs.  It is only 3 hours long, which, frankly, does not justify the price being charged.  Despite this, I would like to note: (i) I enjoyed the series very much; (ii) I cried at the end of the third episode; (iii) Eileen Atkins' character is great; (iv) the DVD appears to contain the full BBC version of the series (not the stripped down PBS version sans 30 minutes); and (v) next year there will be six more episodes.  I hope that PBS shows all of them next year, and does not hold some back for the following year (which was the case for Poirot and Miss Marple).  Personally, I would hold off buying the DVD until the price comes down.	5.0	New Upstairs, Downstairs	2011-04-15	10	8	2
0767002652	Upstairs Downstairs - The Premiere Season [VHS]	APILPEQRSVOWE	Dr Pepper 7Up Gal	Compared to Downton Abbey, Upstairs Downstairs is good. Had I not seen Downton Abbey I probably would have rated Upstairs Downstairs with top ratings.  It is however hard to not compare the two shows.Still very enjoyable and it certainly is far above the reality trash that is so prevalent on most TV  stations.	4.0	Upstairs Downstairs	2013-07-05	0	0	0
0767002652	Upstairs Downstairs - The Premiere Season [VHS]	A6QA74AASV8RM	"Dr. Rita Bigel-Casher ""author, BRIDE'S GUIDE ..."	When television was reaching for the stars this series which lasted 5 years was like a rocketship in the anals of entertainment. Thirty years later it is still totally absorbing, sophisticated, and fun to watch. It is a classic that my husband and I re-visited recently over a period of several months. If you missed Upstairs Downstairs in the '70's don't miss it now if you can help it. A combination of a British soap opera, classical drama and comedy, we got totally involved in the family upstairs, and the second family of servants, downstairs. It's a hoot.	5.0	Positively Addictive	2002-02-14	3	3	0
